id,count,bezeichnung_de,bezeichnung_fr,bezeichnung_it,bezeichnung_en,mean_sterne,meldung_ids
18,119,Diverse Lebensmittel,Aliments divers,Diverse derrate alimentari,Miscellaneous,1.23,"[1976, 1998, 2009, 2016, 2017, 2018, 2020, 2034, 2053, 2061, 2062, 2066, 2069, 2071, 2004, 2055, 2087, 2096, 2101, 2105, 2113, 2114, 2124, 2125, 2111, 2068, 2065, 2151, 2142, 2134, 2141, 2138, 2137, 2131, 2118, 2172, 2179, 2196, 2215, 2176, 2189, 2194, 2197, 2199, 2223, 2242, 2272, 2277, 2280, 2228, 2235, 2248, 2265, 2259, 2256, 2224, 2260, 2267, 2276, 2238, 2318, 2232, 2324, 2355, 2359, 2372, 2321, 2295, 2315, 2279, 2282, 2316, 2317, 2330, 2283, 2298, 2304, 2347, 2320, 2287, 2319, 2328, 2307, 2351, 2354, 2369, 2350, 2358, 2349, 2438, 2444, 2456, 2489, 2409, 2411, 2430, 2451, 2464, 2468, 2437, 2450, 2396, 2448, 2458, 2463, 2507, 2325, 2540, 2480, 2492, 2483, 2524, 2526, 2545, 2533, 2522, 2580, 2585, 2591]"
9,39,"Fische, Meeresfrüchte, Amphibien und Reptilien","Poissons, fruits de mer, amphibiens et reptiles","Pesce, crostacei, frutti di mare e anfibi","Fish, Shellfish And Amphibians",1.1,"[1941, 1932, 1982, 1954, 1963, 1895, 2028, 2074, 2025, 2000, 2102, 2115, 2119, 2127, 2205, 2203, 2231, 2253, 2234, 2365, 2308, 2333, 2341, 2284, 2331, 2374, 2368, 2416, 2390, 2404, 2421, 2425, 2541, 2482, 2490, 2552, 2534, 2531, 2581]"
8,38,"Fleisch, Fleischprodukte und Fleischersatz","Viandes, produits à base de viande et substituts de viande","Carne, prodotti di carne e sostituti della carne","Meat, Meat Products And Substitutes",1.32,"[1897, 1957, 1986, 1965, 1919, 2005, 2036, 2007, 2084, 2079, 2089, 2157, 2149, 2165, 2213, 2187, 2182, 2251, 2334, 2360, 2292, 2309, 2306, 2332, 2405, 2382, 2011, 2475, 2494, 2442, 2399, 2457, 2525, 2536, 2488, 2497, 2570, 2523]"
82,29,Wasser,Eau,Acqua,Waters,1.21,"[1918, 1931, 1930, 1975, 1991, 1910, 2023, 2033, 2010, 2052, 2039, 2112, 2100, 2082, 2143, 2164, 2185, 2083, 2237, 2243, 2310, 2301, 2317, 2320, 2362, 2389, 2477, 2479, 2533]"
6,28,"Milch, Milchprodukte und Milchersatzprodukte","Laits, produits laitiers et substituts de lait","Latte, latticini e succedanei del latte",Dairy Products And Substitutes,1.25,"[1900, 1983, 1985, 1991, 2032, 2093, 2085, 2206, 2241, 2250, 2255, 2257, 2273, 2300, 2330, 2335, 2320, 2313, 2403, 2379, 2393, 2491, 2399, 2469, 2525, 2535, 2509, 2593]"
1,28,Nicht spezifiziert,Non spécifié,Non specificato,Unclassified,1.25,"[1898, 1885, 1945, 1958, 1974, 1996, 2001, 2002, 1966, 1970, 1915, 2022, 2042, 2031, 2041, 2110, 2059, 2294, 2303, 2297, 2371, 2435, 2452, 2467, 2495, 2532, 2500, 2476]"
60,22,Fische,Poissons,Pesce,Fish,1.18,"[1933, 1962, 1913, 2067, 2019, 2108, 2200, 2245, 2221, 2271, 2254, 2234, 2344, 2356, 2290, 2320, 2398, 2416, 2419, 2429, 2470, 2508]"
34,16,Früchte,Fruits,Frutta,Fruits,1.31,"[1905, 1964, 1952, 1926, 1938, 1990, 2014, 2117, 2227, 2239, 2269, 2337, 2342, 2391, 2441, 2472]"
23,14,"Blattgemüse (ohne Kohlgemüse), Blattsalate und Algen","Légumes-feuilles (excl. chou), mescluns et algues","Verdure a foglie (esclusi cavoli), insalate a foglie e alghe",Leafy Vegetables (Except Cabbages),1.36,"[1905, 1961, 1909, 1952, 2026, 2099, 2226, 2262, 2274, 2259, 2375, 2332, 2328, 2465]"
3,14,Gemüse,Légumes,Ortaggi,Vegetables,1.36,"[1890, 1960, 1964, 2026, 1990, 2239, 2269, 2270, 2357, 2293, 2314, 2407, 2424, 2472]"
5,13,"Früchte, Nüsse und Samen","Fruits, fruits oléagineux et graines","Frutta, frutta oleaginosa e semi","Fruits, Nuts And Seeds",1.15,"[1908, 1884, 2026, 1993, 2044, 2081, 2219, 2261, 2363, 2427, 2473, 2410, 2428]"
42,11,Käse,Fromages,Formaggi,Cheeses (Including Spread Cheeses),1.27,"[1949, 1984, 1944, 2139, 2187, 2271, 2281, 2364, 2474, 2484, 2582]"
11,11,Fette und Öle,Graisses et huiles,Oli e grassi,Fats And Oils,1.09,"[1980, 2160, 2266, 2286, 2240, 2244, 2326, 2296, 2305, 2348, 2414]"
80,10,"Softdrinks, Sprudelgetränke, Energydrinks und isotonische Getränke","Boissons sucrées, gazeuses, énergétiques et isotoniques","Bevande zuccherate, gasate, energy drink e bevande isotoniche","Carbonated/Soft/Isotonic Drinks, Diluted",1.1,"[1892, 1987, 1907, 2008, 2056, 2191, 2266, 2340, 2439, 2447]"
93,8,"Gewürze, Kräuter und Aromastoffe","Epices, herbes et aromates","Spezie, erbe e aromi","Spices, Herbs And Flavourings",1.5,"[1884, 1964, 1990, 2373, 2436, 2400, 2401, 2460]"
54,7,Geflügel,Volailles,Pollame,Poultry,1.71,"[1896, 1989, 2076, 2174, 2173, 2455, 2516]"
48,7,"Teigwaren, Reis, andere Getreide und Körner","Pâtes alimentaires, riz, autres céréales et graines","Pasta, riso, altri cereali e grani","Pasta, Rice, Other Grain",1.14,"[2180, 2207, 2249, 2346, 2311, 2453, 2420]"
39,6,Milchersatz und Milchersatzprodukte,Substituts de lait et produits à base de substitut de lait,Succedanei del latte e prodotti a base di succedanei del latte,Milk Substitutes And Milk Substitute Products,1.0,"[1929, 1886, 1997, 1920, 2229, 2433]"
7,6,"Getreide, Getreideprodukte und Körner",Céréales et produits céréaliers,Cereali e prodotti cereali,Cereals And Cereal Products,1.5,"[1890, 1980, 2188, 2230, 2246, 2431]"
56,6,Fleisch- und Wurstwaren (verarbeitetes Fleisch),Charcuterie,Prodotti di carne e insaccati (carne trasformata),Processed Meat,1.33,"[1899, 2027, 2266, 2271, 2538, 2542]"
38,6,"Milch, Milchgetränke und fermentierte Milchgetränke","Laits, boissons à base de lait ou de lait fermenté","Latte, bevande a base di latte e di latte fermentato","Milk, Milk Beverages And Fermented Milk Beverages",1.17,"[2006, 2030, 2015, 2116, 2322, 2484]"
133,5,Honig,Miel,Miele,Honey,1.0,"[1971, 2098, 2158, 2201, 2211]"
58,5,Fleischersatz,Substituts de viande,Sostituti della carne,Meat Substitutes,1.2,"[1997, 1980, 1916, 2043, 2329]"
81,5,"Kaffee, Tee, Frucht- und Kräutertee","Café, thé, tisane aux fruits et aux herbes","Caffè, tè, tè di frutti e di erbe","Coffee, Tea And Herbal Teas",1.4,"[1921, 2397, 2432, 2498, 2551]"
148,5,Wein,Vin,Vino,Wine,1.0,"[1994, 2054, 2184, 2129, 2481]"
24,4,Blüten- und Fruchtgemüse,Légumes-fruits,"Ortaggi da fiore, verdura a frutti ",Fruiting Vegetables,1.0,"[2395, 2423, 2499, 2519]"
118,4,Rind,Boeuf,Manzo,Beef,1.0,"[2257, 2379, 2454, 2446]"
98,3,Nicht spezifizierte sowie gemischte diverse Lebensmittel,Aliments divers non spécifiés ou mélangés,Vari alimenti non classificati o misti,Unclassified Or Combined Miscellaneous Foods,1.0,"[2445, 2493, 2478]"
155,3,Nicht spezifizierte sowie gemischte Diätprodukte und Sportlernahrung,Produits diététiques et aliments pour sportifs non spécifiés ou mélangés,Prodotti dietetici e alimenti per sportivi non classificati e misti,Unclassified And Combined Dietetic Produc,1.0,"[2063, 2486, 2520]"
126,3,Huhn und Hähnchen,"Poule, poulet","Pollo, gallina","Chicken, Hen",1.33,"[1906, 2275, 2296]"
144,3,Koffeinhaltiger Tee und Teezubereitungen (inkl. Pulver),Thé contenant de la caféine et préparations à base de thé (poudre incluse),Tè contenente caffeina e preparazioni a base di tè (inclusa polvere),Tea Containing Coffeine And Tea-Based Preparations (Incl. Powdered),1.0,"[1904, 2291, 2378]"
73,3,"Schokolade, Schokoriegel, Aufstriche, Pulver und Süsswaren mit Schokolade","Chocolat, barre, pâte à tartiner, poudre et confiserie avec chocolat","Cioccolato, barrette di cioccolato, prodotti da spalmare, polvere e dolciumi al cioccolato","Chocolate, Candy Bars, Paste, Confetti/Fl",1.0,"[2070, 2092, 2135]"
35,3,Nüsse und Samen (inkl. Aufstriche und Pasten),Fruits oléagineux et graines (incl. beurre),Frutta oleaginosa e semi (inclusi prodotti da spalmare e paste),Nuts And Seeds (+ Nut Spread),1.0,"[1942, 2181, 2338]"
100,3,Diätprodukte und Sportlernahrung,Produits diététiques et aliments pour sportifs,Prodotti dietetici e alimenti per sportivi,Dietetic Products,1.0,"[1917, 2013, 2487]"
14,3,Alkoholfreie Getränke,Boissons sans alcool,Bevande analcoliche,Non Alcoholic Beverages,1.0,"[1981, 1922, 2088]"
120,3,Schwein,Porc,Maiale,Pork,1.33,"[2138, 2263, 2289]"
30,3,Blattstiel- und Stängelgemüse sowie Keimlinge und Sprossen,"Légumes-tiges, germes et pousses",Ortaggi a stelo e germogli,"Stalk Vegetables, Sprouts",1.33,"[2073, 2049, 2412]"
22,3,Nicht spezifizierte sowie gemischte Gemüse und Salate,Légumes et salades non spécifiés ou mélangés,Insalate e ortaggi misti non specificati,"Unclassified, Mixed Salad/Vegetables",1.33,"[2014, 2140, 2554]"
10,3,Eier und Eiprodukte,Oeufs et dérivés,Uova e prodotti di uova,Eggs And Egg Products,1.33,"[2076, 2336, 2366]"
27,3,Pilze,Champignons,Funghi,Mushrooms,1.67,"[2190, 2471, 2418]"
49,2,Brot und Dauerbackwaren,Pains et biscottes,Pane e articoli di biscotteria,"Bread, Crispbread, Rusks",1.0,"[2481, 2590]"
13,2,"Cakes, Kuchen, Torten, süsse Wähen, Patisserie und Feingebäck","Cakes, gâteaux, tartes sucrées, pâtisseries et petits fours","Cake, torte, prodotti di confetteria e panetteria fine",Cakes And Sweet Biscuits,1.5,"[1980, 2104]"
115,2,"Brot, Brötchen und Gipfel","Pains, petits pains et croissants","Pane, panini e croissant","Bread, Croissants",1.0,"[1979, 2353]"
12,2,"Zucker, Schokolade und Süsswaren","Sucre, chocolat et confiserie","Zucchero, cioccolato e dolciumi",Sugar And Confectionery,1.0,"[2247, 2583]"
86,2,Bier,Bière,Birra,Beer,1.0,"[2327, 2406]"
50,2,Frühstückscerealien,Céréales du petit-déjeuner,Cereali per la colazione,Breakfast Cereals,1.5,"[2204, 2328]"
67,2,Pflanzliche Öle,Huiles végétales,Oli vegetali,Vegetable Oils,1.0,"[2166, 2548]"
21,2,Kartoffeln,Pommes de terre,Patate,Potatoes,1.0,"[2270, 2361]"
26,2,Kohlgemüse,Choux,Cavoli,Cabbages,1.0,"[2040, 2012]"
101,1,Nicht spezifizierte sowie gemischte salzige Snacks,Snacks salés non spécifiés ou mélangés,Spuntini salati non classificati o misti,Unclassified Or Combined Snacks,1.0,[1894]
79,1,Frucht- und Gemüsesäfte,Jus de fruits et de légumes,Succhi di frutta e di verdura,Fruit And Vegetable Juices,2.0,[1883]
105,1,Nicht fermentierte Milch und Milchgetränke,Laits non fermentés et boissons à base de lait non fermenté,Latte non fermentato e bevande a base di latte non fermentato,Non Fermented Milk And Milk Beverages,2.0,[1980]
33,1,"Nicht spezifizierte sowie gemischte Früchte, Nüsse und Samen","Fruits, fruits oléagineux et graines non spécifiés ou mélangés","Frutta, frutta oleaginosa e semi non specificati e misti","Unclassified, Mixed Fruits, Nuts And Seed",1.0,[1914]
139,1,Schokoriegel,Barres de chocolat,Barrette di cioccolato,Chocolate Candy Bars,1.0,[2072]
43,1,"Desserts auf Milchbasis (z.B. Crème, Mousse, Pudding; ohne Speiseeis)","Desserts lactés (p.ex. crème, mousse, pudding; sans glace) ","Dessert a base di latte (p.e. crema, mousse, budini; esclusi gelati)","Cream Desserts, Puddings (Milk Based)",1.0,[2080]
142,1,"Nicht spezifizierte sowie gemischte Kaffee-, Tee-, Frucht- und Kräuterteegetränke","Café, thé, tisane aux fruits et aux herbes non spécifié ou mélangé","Caffè, tè, tè di frutti e di erbe non classificati e misti",Unclassified And Combined Coffee/Tea Drin,1.0,[2057]
16,1,"Würzmittel, Gewürze, Hefen, Kräuter und Saucen","Assaisonnement, épices, levures, herbes et sauces","Condimenti, spezie, lieviti, erbe e salse","Condiments, Spices, Yeast, Herbs And Sauces",2.0,[2302]
65,1,Eier,Oeufs,Uova,Egg,1.0,[2296]
62,1,Fischprodukte und panierter Fisch,Produits à base de poissons et poissons panés,Prodotti della pesca e pesce impanato,"Fish Products, Fish In Crumbs",2.0,[2352]
76,1,"Cakes, Kuchen, Torten, süsse Wähen, Patisserie sowie weiches oder gefülltes Feingebäck","Cakes, gâteaux, tartes sucrées, pâtisseries et petits fours mollets ou fourrés","Cake, torte, prodotti di confetteria e panetteria fine, molli o farciti","Cakes, Pies, Pastries, Puddings (Non Milk",1.0,[2339]
104,1,Nicht spezifizierte sowie gemischte Milch und Milchgetränke,Laits et boissons à base de laits non spécifiés ou mélangés,Latte e bevande a base di latte non specificate e miste,Unclassified Or Combined Milk And Milk Beverages,1.0,[2312]
84,1,"Wein, Apfelwein und andere Fruchtweine","Vin, cidre et autres vins de fruits","Vino, sidro e altri vini di frutti","Wine, Cider, Fruit Wines",1.0,[2363]
25,1,Knollen- und Wurzelgemüse,Légumes-racines,Tuberi e radici,Root Vegetables,2.0,[2413]
15,1,Alkoholische Getränke,Boissons avec alcool,Bevande alcoliche,Alcoholic Beverages,1.0,[2434]
113,1,Sorbet und Wasserglace,Sorbets et glaces à l'eau,Sorbetto e ghiacciolo,Sorbet/Water Ice,1.0,[2415]
32,1,Hülsenfrüchte,Légumes secs,Leguminose,Legumes,2.0,[2440]
55,1,Wild,Gibier,Selvaggina,Game,2.0,[2558]
