id,count,bezeichnung_de,bezeichnung_fr,bezeichnung_it,bezeichnung_en,mean_sterne,meldung_ids
18,2,Diverse Lebensmittel,Aliments divers,Diverse derrate alimentari,Miscellaneous,1.5,"[2489, 2492]"
8,2,"Fleisch, Fleischprodukte und Fleischersatz","Viandes, produits à base de viande et substituts de viande","Carne, prodotti di carne e sostituti della carne","Meat, Meat Products And Substitutes",1.0,"[2494, 2497]"
6,1,"Milch, Milchprodukte und Milchersatzprodukte","Laits, produits laitiers et substituts de lait","Latte, latticini e succedanei del latte",Dairy Products And Substitutes,1.0,[2491]
9,1,"Fische, Meeresfrüchte, Amphibien und Reptilien","Poissons, fruits de mer, amphibiens et reptiles","Pesce, crostacei, frutti di mare e anfibi","Fish, Shellfish And Amphibians",1.0,[2490]
98,1,Nicht spezifizierte sowie gemischte diverse Lebensmittel,Aliments divers non spécifiés ou mélangés,Vari alimenti non classificati o misti,Unclassified Or Combined Miscellaneous Foods,1.0,[2493]
81,1,"Kaffee, Tee, Frucht- und Kräutertee","Café, thé, tisane aux fruits et aux herbes","Caffè, tè, tè di frutti e di erbe","Coffee, Tea And Herbal Teas",2.0,[2498]
1,1,Nicht spezifiziert,Non spécifié,Non specificato,Unclassified,1.0,[2495]
24,1,Blüten- und Fruchtgemüse,Légumes-fruits,"Ortaggi da fiore, verdura a frutti ",Fruiting Vegetables,1.0,[2499]
