id,count,bezeichnung_de,bezeichnung_fr,bezeichnung_it,bezeichnung_en,mean_sterne,meldung_ids
8,2,"Fleisch, Fleischprodukte und Fleischersatz","Viandes, produits à base de viande et substituts de viande","Carne, prodotti di carne e sostituti della carne","Meat, Meat Products And Substitutes",1.0,"[2007, 2011]"
38,1,"Milch, Milchgetränke und fermentierte Milchgetränke","Laits, boissons à base de lait ou de lait fermenté","Latte, bevande a base di latte e di latte fermentato","Milk, Milk Beverages And Fermented Milk Beverages",1.0,[2006]
80,1,"Softdrinks, Sprudelgetränke, Energydrinks und isotonische Getränke","Boissons sucrées, gazeuses, énergétiques et isotoniques","Bevande zuccherate, gasate, energy drink e bevande isotoniche","Carbonated/Soft/Isotonic Drinks, Diluted",2.0,[2008]
82,1,Wasser,Eau,Acqua,Waters,1.0,[2010]
18,1,Diverse Lebensmittel,Aliments divers,Diverse derrate alimentari,Miscellaneous,1.0,[2009]
100,1,Diätprodukte und Sportlernahrung,Produits diététiques et aliments pour sportifs,Prodotti dietetici e alimenti per sportivi,Dietetic Products,1.0,[2013]
