id,count,bezeichnung_de,bezeichnung_fr,bezeichnung_it,bezeichnung_en,mean_sterne,meldung_ids
18,1,Diverse Lebensmittel,Aliments divers,Diverse derrate alimentari,Miscellaneous,2.0,[2372]
93,1,"Gewürze, Kräuter und Aromastoffe","Epices, herbes et aromates","Spezie, erbe e aromi","Spices, Herbs And Flavourings",1.0,[2373]
9,1,"Fische, Meeresfrüchte, Amphibien und Reptilien","Poissons, fruits de mer, amphibiens et reptiles","Pesce, crostacei, frutti di mare e anfibi","Fish, Shellfish And Amphibians",1.0,[2374]
23,1,"Blattgemüse (ohne Kohlgemüse), Blattsalate und Algen","Légumes-feuilles (excl. chou), mescluns et algues","Verdure a foglie (esclusi cavoli), insalate a foglie e alghe",Leafy Vegetables (Except Cabbages),1.0,[2375]
144,1,Koffeinhaltiger Tee und Teezubereitungen (inkl. Pulver),Thé contenant de la caféine et préparations à base de thé (poudre incluse),Tè contenente caffeina e preparazioni a base di tè (inclusa polvere),Tea Containing Coffeine And Tea-Based Preparations (Incl. Powdered),1.0,[2378]
