id,count,bezeichnung_de,bezeichnung_fr,bezeichnung_it,bezeichnung_en,mean_sterne,meldung_ids
18,50,Diverse Lebensmittel,Aliments divers,Diverse derrate alimentari,Miscellaneous,1.2,"[1008, 1249, 1273, 1290, 1274, 1270, 1300, 1308, 1316, 1329, 1344, 1370, 1311, 1397, 1396, 1423, 1384, 1476, 1442, 1168, 1516, 1536, 1541, 1551, 1550, 1548, 1533, 1539, 1609, 1557, 1624, 1594, 1593, 1623, 1670, 1687, 1693, 1698, 1678, 1648, 1737, 1718, 1685, 1669, 1744, 1746, 1747, 1769, 1791, 1787]"
1,34,Nicht spezifiziert,Non spécifié,Non specificato,Unclassified,1.41,"[1032, 1103, 1055, 984, 984, 1151, 1239, 1234, 1372, 1351, 1339, 1386, 1386, 1386, 1481, 1504, 1508, 1554, 1487, 1558, 1518, 1490, 1527, 1580, 1492, 1566, 1640, 1655, 1688, 1706, 1767, 1768, 1758, 1741]"
58,33,Fleischersatz,Substituts de viande,Sostituti della carne,Meat Substitutes,1.48,"[1032, 1063, 1069, 1047, 1147, 984, 1197, 1138, 1140, 1223, 1271, 1231, 1245, 1220, 1331, 1356, 1336, 1287, 1285, 1299, 1377, 1373, 1386, 1395, 1404, 1525, 1526, 1618, 1571, 1560, 1564, 1710, 1735]"
82,31,Wasser,Eau,Acqua,Waters,1.23,"[1011, 1014, 1031, 1045, 1079, 1117, 1276, 1263, 1327, 1354, 1345, 1425, 1353, 1501, 1523, 1535, 1496, 1596, 1616, 1673, 1721, 1743, 1635, 1708, 1740, 1753, 1760, 1762, 1778, 1788, 1725]"
60,30,Fische,Poissons,Pesce,Fish,1.23,"[1004, 1025, 1032, 1173, 1178, 1193, 1200, 1185, 1314, 1361, 1291, 1383, 1304, 1417, 1473, 1451, 1530, 1592, 1688, 1690, 1727, 1715, 1650, 1658, 1745, 1763, 1772, 1771, 1789, 1792]"
9,29,"Fische, Meeresfrüchte, Amphibien und Reptilien","Poissons, fruits de mer, amphibiens et reptiles","Pesce, crostacei, frutti di mare e anfibi","Fish, Shellfish And Amphibians",1.24,"[1097, 1127, 1260, 1238, 1288, 1235, 1262, 1216, 1296, 1350, 1320, 1393, 1429, 1174, 1477, 1482, 1519, 1531, 1534, 1503, 1512, 1555, 1683, 1691, 1722, 1776, 1777, 1783, 1734]"
23,22,"Blattgemüse (ohne Kohlgemüse), Blattsalate und Algen","Légumes-feuilles (excl. chou), mescluns et algues","Verdure a foglie (esclusi cavoli), insalate a foglie e alghe",Leafy Vegetables (Except Cabbages),1.45,"[956, 971, 1024, 1042, 1087, 1106, 1082, 1201, 1343, 1369, 1365, 1280, 1281, 1434, 1436, 1380, 1399, 1603, 1577, 1715, 1707, 1717]"
34,20,Früchte,Fruits,Frutta,Fruits,1.2,"[974, 1032, 1066, 1166, 1192, 1219, 1250, 1240, 1205, 1259, 1310, 1369, 1342, 1360, 1358, 1409, 1599, 996, 1681, 1761]"
8,17,"Fleisch, Fleischprodukte und Fleischersatz","Viandes, produits à base de viande et substituts de viande","Carne, prodotti di carne e sostituti della carne","Meat, Meat Products And Substitutes",1.12,"[1039, 1082, 1092, 1213, 1381, 1406, 1545, 1579, 1638, 1692, 1709, 1723, 1730, 1735, 1739, 1732, 1754]"
3,17,Gemüse,Légumes,Ortaggi,Vegetables,1.29,"[1065, 1057, 1153, 1166, 1182, 1192, 1219, 1229, 1250, 1186, 1342, 1283, 1403, 1453, 1654, 1717, 1728]"
54,15,Geflügel,Volailles,Pollame,Poultry,1.53,"[1004, 1037, 1181, 1214, 1217, 1267, 1278, 1218, 1295, 1414, 1493, 1583, 1660, 1674, 1784]"
118,14,Rind,Boeuf,Manzo,Beef,1.21,"[992, 1113, 1269, 1333, 1393, 1479, 1482, 1547, 1561, 1608, 1660, 1785, 1784, 1794]"
38,13,"Milch, Milchgetränke und fermentierte Milchgetränke","Laits, boissons à base de lait ou de lait fermenté","Latte, bevande a base di latte e di latte fermentato","Milk, Milk Beverages And Fermented Milk Beverages",1.54,"[1038, 1227, 1226, 1258, 1323, 1284, 1334, 1406, 1471, 1667, 1703, 1709, 1726]"
80,12,"Softdrinks, Sprudelgetränke, Energydrinks und isotonische Getränke","Boissons sucrées, gazeuses, énergétiques et isotoniques","Bevande zuccherate, gasate, energy drink e bevande isotoniche","Carbonated/Soft/Isotonic Drinks, Diluted",1.08,"[1112, 1297, 1315, 1318, 1415, 1431, 1522, 1543, 1574, 1586, 1729, 1672]"
98,12,Nicht spezifizierte sowie gemischte diverse Lebensmittel,Aliments divers non spécifiés ou mélangés,Vari alimenti non classificati o misti,Unclassified Or Combined Miscellaneous Foods,1.25,"[1036, 1294, 1322, 1327, 1331, 1321, 1469, 1445, 1584, 1643, 1644, 1666]"
67,10,Pflanzliche Öle,Huiles végétales,Oli vegetali,Vegetable Oils,1.2,"[1012, 997, 1046, 1355, 1426, 1440, 1511, 1509, 1632, 1786]"
120,10,Schwein,Porc,Maiale,Pork,1.2,"[1006, 1247, 1269, 1369, 1282, 1333, 1376, 1573, 1679, 1784]"
6,9,"Milch, Milchprodukte und Milchersatzprodukte","Laits, produits laitiers et substituts de lait","Latte, latticini e succedanei del latte",Dairy Products And Substitutes,1.67,"[1130, 1043, 1244, 1209, 1335, 1313, 1347, 1607, 1668]"
22,9,Nicht spezifizierte sowie gemischte Gemüse und Salate,Légumes et salades non spécifiés ou mélangés,Insalate e ortaggi misti non specificati,"Unclassified, Mixed Salad/Vegetables",1.56,"[960, 1032, 1078, 1084, 1325, 1286, 1627, 1671, 1661]"
126,9,Huhn und Hähnchen,"Poule, poulet","Pollo, gallina","Chicken, Hen",1.11,"[951, 1161, 1203, 1366, 1333, 1393, 1452, 1357, 1498]"
7,9,"Getreide, Getreideprodukte und Körner",Céréales et produits céréaliers,Cereali e prodotti cereali,Cereals And Cereal Products,1.33,"[1199, 1192, 1211, 1219, 1301, 1529, 1562, 1567, 1681]"
39,8,Milchersatz und Milchersatzprodukte,Substituts de lait et produits à base de substitut de lait,Succedanei del latte e prodotti a base di succedanei del latte,Milk Substitutes And Milk Substitute Products,1.25,"[1029, 1108, 1331, 1312, 1412, 1528, 1556, 1485]"
155,8,Nicht spezifizierte sowie gemischte Diätprodukte und Sportlernahrung,Produits diététiques et aliments pour sportifs non spécifiés ou mélangés,Prodotti dietetici e alimenti per sportivi non classificati e misti,Unclassified And Combined Dietetic Produc,1.5,"[1100, 1230, 1340, 1402, 1362, 1454, 1483, 1242]"
93,7,"Gewürze, Kräuter und Aromastoffe","Epices, herbes et aromates","Spezie, erbe e aromi","Spices, Herbs And Flavourings",1.29,"[1042, 1110, 1513, 1633, 1619, 996, 1707]"
42,7,Käse,Fromages,Formaggi,Cheeses (Including Spread Cheeses),1.29,"[1032, 1052, 1194, 1393, 1495, 1592, 1733]"
48,7,"Teigwaren, Reis, andere Getreide und Körner","Pâtes alimentaires, riz, autres céréales et graines","Pasta, riso, altri cereali e grani","Pasta, Rice, Other Grain",1.29,"[1171, 1265, 1482, 1473, 1538, 1626, 1720]"
65,6,Eier,Oeufs,Uova,Egg,1.67,"[953, 1090, 1236, 1209, 1394, 1757]"
14,6,Alkoholfreie Getränke,Boissons sans alcool,Bevande analcoliche,Non Alcoholic Beverages,1.33,"[983, 1183, 1191, 1198, 1225, 1731]"
15,6,Alkoholische Getränke,Boissons avec alcool,Bevande alcoliche,Alcoholic Beverages,1.33,"[1086, 1225, 1369, 1467, 1597, 1696]"
62,6,Fischprodukte und panierter Fisch,Produits à base de poissons et poissons panés,Prodotti della pesca e pesce impanato,"Fish Products, Fish In Crumbs",1.5,"[1116, 1364, 1326, 1422, 1540, 1686]"
100,5,Diätprodukte und Sportlernahrung,Produits diététiques et aliments pour sportifs,Prodotti dietetici e alimenti per sportivi,Dietetic Products,1.6,"[1032, 1094, 1192, 1257, 1410]"
81,5,"Kaffee, Tee, Frucht- und Kräutertee","Café, thé, tisane aux fruits et aux herbes","Caffè, tè, tè di frutti e di erbe","Coffee, Tea And Herbal Teas",1.2,"[1026, 1307, 1374, 1636, 1770]"
30,5,Blattstiel- und Stängelgemüse sowie Keimlinge und Sprossen,"Légumes-tiges, germes et pousses",Ortaggi a stelo e germogli,"Stalk Vegetables, Sprouts",1.6,"[1004, 1032, 1005, 1128, 1115]"
52,5,"Nicht spezifizierte sowie gemischte Fleisch, Fleischprodukte und Fleischersatz","Viandes, produits à base de viande et substituts de viande non spécifiés ou mélangés","Carne, prodotti di carne e sostituti della carne non specificati e misti",Unclassified And Combined Meat And Meat P,1.2,"[1030, 1306, 1388, 1398, 1382]"
143,4,Kaffee und Kaffeezubereitungen (inkl. Pulver),Café et préparations à base de café (poudre incluse),Caffè e preparazioni a base di caffè (inclusa polvere),Coffee And Coffe-Based Preparations (Inlc Powdered),1.0,"[1144, 1172, 1574, 1742]"
35,4,Nüsse und Samen (inkl. Aufstriche und Pasten),Fruits oléagineux et graines (incl. beurre),Frutta oleaginosa e semi (inclusi prodotti da spalmare e paste),Nuts And Seeds (+ Nut Spread),1.5,"[1077, 1169, 1348, 1457]"
27,4,Pilze,Champignons,Funghi,Mushrooms,1.5,"[1032, 1107, 1349, 1403]"
56,4,Fleisch- und Wurstwaren (verarbeitetes Fleisch),Charcuterie,Prodotti di carne e insaccati (carne trasformata),Processed Meat,1.25,"[983, 1197, 1578, 1592]"
24,4,Blüten- und Fruchtgemüse,Légumes-fruits,"Ortaggi da fiore, verdura a frutti ",Fruiting Vegetables,1.25,"[1032, 1369, 1365, 1559]"
73,4,"Schokolade, Schokoriegel, Aufstriche, Pulver und Süsswaren mit Schokolade","Chocolat, barre, pâte à tartiner, poudre et confiserie avec chocolat","Cioccolato, barrette di cioccolato, prodotti da spalmare, polvere e dolciumi al cioccolato","Chocolate, Candy Bars, Paste, Confetti/Fl",1.75,"[1150, 1646, 1475, 1672]"
5,4,"Früchte, Nüsse und Samen","Fruits, fruits oléagineux et graines","Frutta, frutta oleaginosa e semi","Fruits, Nuts And Seeds",1.25,"[1099, 1132, 1240, 1186]"
148,4,Wein,Vin,Vino,Wine,1.25,"[1222, 1360, 1341, 1751]"
104,4,Nicht spezifizierte sowie gemischte Milch und Milchgetränke,Laits et boissons à base de laits non spécifiés ou mélangés,Latte e bevande a base di latte non specificate e miste,Unclassified Or Combined Milk And Milk Beverages,1.0,"[1134, 1184, 1393, 1449]"
25,3,Knollen- und Wurzelgemüse,Légumes-racines,Tuberi e radici,Root Vegetables,1.0,"[1024, 1049, 1365]"
21,3,Kartoffeln,Pommes de terre,Patate,Potatoes,1.0,"[954, 1024, 1639]"
133,3,Honig,Miel,Miele,Honey,1.67,"[1506, 1558, 1774]"
26,3,Kohlgemüse,Choux,Cavoli,Cabbages,1.33,"[1246, 1615, 1650]"
141,3,Andere Süsswaren mit Schokolade,Autres confiserie avec chocolat,Dolciumi al cioccolato,Chocolate Confectionery,1.0,"[1212, 1411, 1447]"
59,3,"Nicht spezifizierte sowie gemischte Fische, Meeresfrüchte und Amphibien","Poissons, fruits de mer, amphibiens et reptiles non spécifiés ou mélangés","Pesce, crostacei frutti die mare e anfibi non classificati e misti",Unclassified And Combined Fish Products,1.67,"[1030, 1275, 1386]"
37,3,"Nicht spezifizierte sowie gemischte Milch, Milchprodukte und Milchersatzprodukte","Laits, produits laitiers et substituts de lait non spécifiés ou mélangés","Latte, latticini e succedanei del latte non specificati e misti",Unclassified And Mixed Dairy Products,1.0,"[1211, 1272, 1589]"
55,3,Wild,Gibier,Selvaggina,Game,2.0,"[1114, 1328, 1570]"
10,2,Eier und Eiprodukte,Oeufs et dérivés,Uova e prodotti di uova,Eggs And Egg Products,1.0,"[975, 1752]"
111,2,Speiseeis (auf Milchbasis),Glaces (à base de lait),Gelato (a base di latte),Ice Cream (Milk Based),2.0,"[1032, 1667]"
50,2,Frühstückscerealien,Céréales du petit-déjeuner,Cereali per la colazione,Breakfast Cereals,1.0,"[1449, 1675]"
138,2,Schokoladentafeln,Tablettes de chocolat,Tavoletta di cioccolato,Chocolate Tablet,1.0,"[1510, 1656]"
121,2,"Lamm, Schaf und Hammel","Agneau, brebis et mouton","Agnello, pecora e montone",Mutton/Lamb,1.0,"[1333, 1610]"
47,2,"Flocken, Griess, Keime, Mehl, Schrot und Stärke (inkl. Pulver für Desserts)","Farine, fécule, gruau, germes, flocons, semoule utilisée comme farine (incl. poudre pour desserts)","Farina, fiocchi, germi, faricello, semola e amidi (incluse polveri per dessert)","Flours, Starches, Flakes, Semolina Used A",1.0,"[1409, 1524]"
105,2,Nicht fermentierte Milch und Milchgetränke,Laits non fermentés et boissons à base de lait non fermenté,Latte non fermentato e bevande a base di latte non fermentato,Non Fermented Milk And Milk Beverages,1.0,"[1148, 1369]"
12,2,"Zucker, Schokolade und Süsswaren","Sucre, chocolat et confiserie","Zucchero, cioccolato e dolciumi",Sugar And Confectionery,1.0,"[1167, 1261]"
28,2,Hülsen- und Samengemüse,Légumes grains et pois,Ortaggi a seme e leguminose,Grain And Pod Vegetables,1.0,"[1409, 1563]"
79,2,Frucht- und Gemüsesäfte,Jus de fruits et de légumes,Succhi di frutta e di verdura,Fruit And Vegetable Juices,1.0,"[1071, 1449]"
31,2,Nicht spezifizierte sowie gemischte Hülsenfrüchte,Légumes secs non spécifiés et mélangés,Leguminose non specificate e miste,Unclassified,2.0,"[1368, 1455]"
115,1,"Brot, Brötchen und Gipfel","Pains, petits pains et croissants","Pane, panini e croissant","Bread, Croissants",1.0,[976]
90,1,"Nicht spezifizierte sowie gemischte Würzmittel, Gewürze, Hefen, Kräuter und Saucen","Assaisonnement, épices, levures, herbes et sauces non spécifiés ou mélangés","Condimenti, spezie, lieviti, erbe e salse non classificati o misti",Unclassified Or Combined Condiments And S,2.0,[983]
134,1,Andere süsse Aufstriche,Autres pâtes à tartiner sucrées,Altri prodotti dolci da spalmare,Other Sweet Spread,2.0,[1032]
142,1,"Nicht spezifizierte sowie gemischte Kaffee-, Tee-, Frucht- und Kräuterteegetränke","Café, thé, tisane aux fruits et aux herbes non spécifié ou mélangé","Caffè, tè, tè di frutti e di erbe non classificati e misti",Unclassified And Combined Coffee/Tea Drin,1.0,[1083]
122,1,Pferd,Cheval,Cavallo,Horse,1.0,[1040]
135,1,Süsse Saucen und Toppings für Dessert,Sauces sucrées et garniture pour dessert,Salse e guarnizioni dolci per dessert,"Sweet Sauce, Sweet Topping For Desserts",1.0,[1017]
86,1,Bier,Bière,Birra,Beer,1.0,[1152]
99,1,Vegetarische Produkte und Gerichte,Produits et plats végétariens,Prodotti/piatti vegetariani,Vegetarian Products/Dishes,1.0,[1190]
156,1,Künstliche Süssstoffe,Edulcorants,Edulcoranti artificiali,Artificial Sweeteners,1.0,[1191]
46,1,"Nicht spezifizierte sowie gemischte Getreide, Getreideprodukte und Körner",Céréales et produits céréaliers non spécifiés ou mélangés,Cereali e prodotti cereali non specificati e misti,Unclassified And Combined Cereal Products,1.0,[1369]
11,1,Fette und Öle,Graisses et huiles,Oli e grassi,Fats And Oils,2.0,[1248]
74,1,"Getreideriegel, Pulver und Süsswaren ohne Schokolade","Barres céréales, poudre et confiserie sans chocolat","Dolciumi, barrette ai cereali e polvere per bevande senza cioccolato",11 03    Confectionery Non Chocolate,1.0,[1411]
96,1,Suppen,Soupes,Minestre,Soups,1.0,[1331]
77,1,"Trockenes Feingebäck (z.B. Guetzli, Stückli)",Petits fours secs (p.ex. biscuits),Prodotti di panetteria fine secchi (p.e. biscotti),"Dry Cakes, Sweet Biscuits",1.0,[1324]
36,1,Oliven,Olives,Olive,Olives,1.0,[1240]
102,1,Apérogebäck und Chips,Biscuits pour l'apéritif et chips,"Spuntini, biscotti salati e chips per aperitivo","Savoury Snacks, Biscuits And Crisps",1.0,[1432]
151,1,"Salatsaucen, Dips und Mayonnaise","Sauces à salade, dips et mayonnaises","Salse per insalata, dips e maionese","Dressing Sauces, Mayonnaises And Similars",1.0,[1371]
16,1,"Würzmittel, Gewürze, Hefen, Kräuter und Saucen","Assaisonnement, épices, levures, herbes et sauces","Condimenti, spezie, lieviti, erbe e salse","Condiments, Spices, Yeast, Herbs And Sauces",1.0,[1291]
103,1,"Salzige belegte oder gefüllte Brötchen, Gipfel, Törtchen und Wähen","Ballons et croissants tartinés ou fourrés, tartes salées","Tartine e panini farciti salati, croissant salati, torte salate","Savoury Filled Buns, Croissants",1.0,[1449]
61,1,Schalen- und Weichtiere,Crustacés et mollusques,Crostacei e molluschi,"Crustaceans, Molluscs",3.0,[1139]
33,1,"Nicht spezifizierte sowie gemischte Früchte, Nüsse und Samen","Fruits, fruits oléagineux et graines non spécifiés ou mélangés","Frutta, frutta oleaginosa e semi non specificati e misti","Unclassified, Mixed Fruits, Nuts And Seed",1.0,[1568]
123,1,Ziege,Chèvre,Capra,Goat,1.0,[1610]
106,1,Fermentierte Milch und Milchgetränke sowie Joghurtdrinks,"Laits fermentés et boissons à base de lait fermenté, yogourts à boire","Latte fermentato, bevande a base di latte fermentato e yogurt da bere","Fermented Milk, Milk Beverages And Yoghurt",2.0,[1617]
144,1,Koffeinhaltiger Tee und Teezubereitungen (inkl. Pulver),Thé contenant de la caféine et préparations à base de thé (poudre incluse),Tè contenente caffeina e preparazioni a base di tè (inclusa polvere),Tea Containing Coffeine And Tea-Based Preparations (Incl. Powdered),1.0,[1574]
139,1,Schokoriegel,Barres de chocolat,Barrette di cioccolato,Chocolate Candy Bars,3.0,[1590]
78,1,Nicht spezifizierte sowie gemischte alkoholfreie Getränke (inkl. Punsch),Boissons sans alcool non spécifiées ou mélangées (incl. punch sans alcool),Bevande analcoliche non specificate e miste (inclusi punch),Unclassified And Combined Non Alc. Drinks,1.0,[1731]
72,1,"Zucker, Konfitüre, Honig, süsse Aufstriche und Saucen sowie Sirup","Sucre, pâtes à tartiner sucrées, miel, confitures, sauces sucrées et sirop","Zucchero, miele, marmellata, prodotti da spalmare e salse dolci, sciroppo","Sugar, Honey, Jam, Syrup",2.0,[1672]
13,1,"Cakes, Kuchen, Torten, süsse Wähen, Patisserie und Feingebäck","Cakes, gâteaux, tartes sucrées, pâtisseries et petits fours","Cake, torte, prodotti di confetteria e panetteria fine",Cakes And Sweet Biscuits,2.0,[1672]
92,1,Hefe,Levures,Lievito,Yeast,3.0,[1697]
19,1,Salzige Snacks,Snacks salés,Spuntini salati,Salty Snacks,1.0,[1649]
76,1,"Cakes, Kuchen, Torten, süsse Wähen, Patisserie sowie weiches oder gefülltes Feingebäck","Cakes, gâteaux, tartes sucrées, pâtisseries et petits fours mollets ou fourrés","Cake, torte, prodotti di confetteria e panetteria fine, molli o farciti","Cakes, Pies, Pastries, Puddings (Non Milk",1.0,[1750]
