id,count,bezeichnung_de,bezeichnung_fr,bezeichnung_it,bezeichnung_en,mean_sterne,meldung_ids
18,4,Diverse Lebensmittel,Aliments divers,Diverse derrate alimentari,Miscellaneous,1.0,"[2223, 2224, 2228, 2232]"
23,1,"Blattgemüse (ohne Kohlgemüse), Blattsalate und Algen","Légumes-feuilles (excl. chou), mescluns et algues","Verdure a foglie (esclusi cavoli), insalate a foglie e alghe",Leafy Vegetables (Except Cabbages),2.0,[2226]
34,1,Früchte,Fruits,Frutta,Fruits,1.0,[2227]
39,1,Milchersatz und Milchersatzprodukte,Substituts de lait et produits à base de substitut de lait,Succedanei del latte e prodotti a base di succedanei del latte,Milk Substitutes And Milk Substitute Products,1.0,[2229]
7,1,"Getreide, Getreideprodukte und Körner",Céréales et produits céréaliers,Cereali e prodotti cereali,Cereals And Cereal Products,2.0,[2230]
9,1,"Fische, Meeresfrüchte, Amphibien und Reptilien","Poissons, fruits de mer, amphibiens et reptiles","Pesce, crostacei, frutti di mare e anfibi","Fish, Shellfish And Amphibians",2.0,[2231]
