id,count,code,titel,kurzinfo,signal,erf_date,mut_date,mean_sterne,count_mut,meldung_ids
8,1,F-2018-024,Microplastics,"Microplastics are ubiquitous in various bodies of water. It is estimated that 4.8-12.7 million tonnes of plastic entered the oceans in 2010. Plastic pollution is classified as an emerging risk and poses a global threat to marine ecosystems. Various studies (and subsequent media reports) report contamination of microplastics in table salt and drinking water. The amounts vary, but there is agreement that microplastics are found in table salt in different countries. Inorganic and organic particles can adhere to microplastics, which are then absorbed by the human body through consumption of contaminated salt. In addition, various types of plastic contain plasticisers, which can have a negative impact on health.",True,2018-09-25T00:00:00,2026-03-04T07:58:33,1.0,69.0,[2752]
108,1,F-2021-195,Residues of veterinary drugs in groundwater,"Due to the intensification of food production in Europe, veterinary medicines have become a critical component in animal husbandry. The administration of these products can potentially lead to their presence in environmental waters such as groundwater, which is why they are now considered potential groundwater contaminants. In Ireland, several residues of anthelmintic and anticoccidial veterinary drugs have been detected in groundwater. 22% of 106 sampling sites detected residues of anthelmintics in the range of 1-41 ng/L and anticoccidials in the range of 1-390 ng/L. Residues were higher near intensive farming sites. These veterinary drug compounds are associated with a range of acute as well as chronic side effects, and their degradation products may have additional adverse effects.",True,2021-05-12T00:00:00,2024-11-05T08:53:57,1.0,19.0,[2750]
34,1,F-2018-054,Mycotoxins in foods,"Mycotoxins are metabolites formed from certain moulds. Mould – and hence mycotoxins – can form on vulnerable foods in warm and humid conditions, either whilst crops are still growing or post-harvest during storage, drying and transport. Most mycotoxins have toxic effects in humans, and some of the better characterised mycotoxins have regulatory limits in food. Certain foods are at particular risk. These include nuts and peanuts (primarily for aflatoxins) and raisins (primarily for ochratoxin A). Horizon Scan (a non-public database) has compiled a list of the most important products and has noted an increase in recalls. These findings are also supported by other stakeholders across the food chain (e.g., Biomin World Mycotoxin Survey 2018).",True,2018-12-11T00:00:00,2026-02-17T08:01:32,1.0,64.0,[2749]
238,1,F-2023-021,"The use of AI in nutrition, food production and food safety","The Global Food and Retail Managing director of British Standards International stressed during a Forum that there are three major areas of consideration where caution is needed regarding the use of Artificial Intelligence (AI) in food production. These are : bias and discriminations linked to the data used, privacy and security, and finally how AI-led world would impact people's lives.",False,2023-07-12T06:56:16,2025-11-10T08:35:26,2.0,68.0,[2744]
25,1,F-2019-045,Insects for human consumption,The microbiological safety of insects approved for consumption is the subject of various studies. These products are relatively new on the market and corresponding experience is lacking.,False,2019-01-31T00:00:00,2025-07-07T06:37:16,1.0,27.0,[2761]
