id,count,code,titel,kurzinfo,signal,erf_date,mut_date,mean_sterne,count_mut,meldung_ids
236,11,F-2023-019,Antimicrobial resistance genes in probiotic bacteria,"Antimicrobial resistance (AMR) is a major threat to public health. In bacteria, AMR depends on antibiotic resistance genes (ARGs), some of which are mobile and can transfer their ARGs to other bacteria. This action, known as horizontal gene transfer (HGT), involves the transfer of small fragments of DNA between bacteria and is facilitated by plasmids, among other things. If bacteria with mobile ARGs are found in food, they can transmit these ARGs to bacteria in the human digestive tract or to pathogens when ingested, contributing to the emergence of drug-resistant bacteria. Although the extent to which probiotics modulate the microbiome is disputed, it is possible that they contribute to the intestinal resistome by colonising the gut. A recent study conducted in Europe, analysing in detail probiotic bacterial species commonly used in certain foods (fermented and non-fermented) and dietary supplements, suggests that consumption of certain probiotic bacterial strains could contribute to the onset and spread of AMR, as in more than half of AGR-positive samples, at least one gene is linked to a plasmid. The results are consistent with another study concluding that the consumption of probiotic products can lead to the transfer of AGRs to human intestinal bacteria. Similarly, probiotics used to feed livestock can also cause antibiotic-resistant THG in animals. Animals treated with these resistant probiotics are likely to become a possible source of ARG for human consumers after ingestion of meat or dairy products.",True,2023-05-02T10:47:28,2025-10-09T09:07:44,1.64,20.0,"[696, 913, 919, 424, 896, 233, 1340, 1647, 2287, 2524, 2118]"
222,11,F-2023-005,Protein supplements : effects of a (too) high protein diet,"""A high protein intake is great for losing weight, but it's also great for athletes."" With such and similar statements, the importance of proteins in the diet is advertised. At the same time, more and more ""high protein"" foods are available, which - as the name suggests - have a higher protein content than their conventional counterparts. Proteins are essential for many functions in the body. But what are the consequences if the recommended daily intake is chronically exceeded? People who follow this ""high protein"" trend are particularly affected.A chronic excess of protein can have negative consequences in the long term. However, these health risks are only discussed in the specialist literature; the general population is insufficiently informed about them. On the contrary, protein-enriched products are now widely available in shops, and big advertising campaigns by the industry promise health benefits thanks to these (expensive) trendy products. The lack of information about the possible negative effects of too much protein gives the false impression that the ""healthy"" amount of protein is unlimited, in the sense of ""if it doesn't help, it doesn't hurt"".Delimaris et al. (2013) conclude in their article that extra protein is not efficiently utilised by the body and can put a strain on the metabolism of bones, kidneys and liver. According to the authors, there is currently no reasonable scientific basis in the literature for recommending consumption above the RDA for healthy adults (= recommended daily allowance). Disorders of bone and calcium homeostasis, disorders of kidney function, increased risk of cancer, disorders of liver function and accelerated progression of coronary heart disease are mentioned as health risks associated with long-term intake of (too) much protein in humans. Barzel et al. (1998) also describe the effect of over-acidification of the body through excessive protein intake and the associated compensation through bone loss and thus calcium loss.<br>In connection with protein diets for weight reduction, St. Jeor et al. (2001) write that there are no scientific long-term studies that prove the effectiveness and safety of such diets. High-protein diets even prevent the necessary requirements of important vitamins and minerals from being met due to the restriction of certain groups of nutrients. LM groups. Furthermore, there is a general risk - despite ""high protein"" - of a deficiency of essential amino acids if the biological value of the proteins is not taken into account and the foods are combined accordingly.  <br>In summary, the excessive intake of proteins does not represent an acute danger for the Swiss population, but long-term damage is to be expected.",True,2023-01-27T13:00:59,2025-09-16T07:10:35,1.55,24.0,"[1486, 1157, 1224, 263, 262, 739, 2478, 499, 546, 291, 1917]"
187,10,F-2022-343,Herbs and spices - fraudulent manipulations,"Culinary herbs and spices are valued for flavouring food and could also provide other beneficial properties, such as antioxidative and bacteriostatic effects as well as certain pharmacological activities. Their supply chain is complex, long, and globalised. Europe is one of the world’s leading importing regions for herbs and spices, importing approximately 300.000 tons, mostly spices from East Asia. Most of the spices are produced in countries where certain post-harvest processes such as drying and cleaning may happen before being shipped to the importing country where they are further cleaned and sanitised before being packaged and distributed either to other food businesses or for retail consumption. At each stage, fraudulent manipulations may happen and the more often the material is transferred from one operator to the next, the fraud opportunity increases",False,2022-05-02T00:00:00,2022-09-12T13:16:19,1.4,4.0,"[270, 349, 130, 1110, 1513, 161, 198, 2436, 2268, 2585]"
86,10,F-2019-126,Mercury in permafrost,"New studies reveal that permafrost is the largest natural source of mercury on Earth - with mercury levels twice as high as all other soils, the ocean and the atmosphere combined. Climate warming threatens to melt this permafrost and gradually release mercury into the food chain. Mercury enters permafrost naturally, as part of the global mercury cycle, but also as a result of anthropogenic activities such as burning coal and petroleum. Once inorganic mercury is released, it can be converted by microbes into methylmercury, a potent neurotoxin. Eating fish from mercury-contaminated water therefore often leads to damage to the central nervous system and birth defects in humans. Released mercury can also enter the atmosphere and thus be distributed to other parts of the world, where it usually settles in rivers, lakes and seas.",True,2019-11-18T00:00:00,2026-01-14T16:31:44,1.1,67.0,"[533, 321, 1095, 1908, 273, 1715, 1772, 1022, 1927, 1913]"
23,10,F-2019-043,<em>Escherichia coli</em> ST131 as a uropathogen,"In 2008, a previously unknown <em>Escherichia coli</em> clonal group, sequence type 131 (ST131), was identified on three continents. Today, ST131 is the predominant <em>E. coli</em> lineage among extra-intestinal pathogenic <em>E. coli</em> (ExPEC) isolates worldwide. Retrospective studies have suggested that it may originally have risen to prominence as early as 2003. ST131 isolates are commonly reported to produce extended-spectrum beta-lactamases, such as CTX-M-15, and almost all are resistant to fluoroquinolones. Moreover, ST131 <em>E. coli</em> isolates are considered to be truly pathogenic, due to the spectrum of infections they cause in both community and hospital settings, and the large number of virulence-associated genes they contain. Previous investigations appeared to exonerate retail meat as a source of human exposure to ST131; recently in the United States, a 1-year prospective study of <em>E. coli</em> from meat products and clinical cultures showed that <em>E. coli</em> ST131 strains are shared by both clinical samples from extra-intestinal human infections and meat samples from poultry.",True,2019-01-30T00:00:00,2024-01-30T09:34:46,1.9,27.0,"[380, 1037, 875, 1093, 1813, 2497, 2402, 224, 1021, 2314]"
199,10,F-2022-355,STEC contamination in pork production chain,"Epidemiological evidence of Shiga toxin-producing <em>Escherichia coli</em> (STEC) infections associated with the consumption of contaminated pork highlight the need for increased awareness of STEC as an emerging pathogen in the pork supply chain. The reported prevalence rate of stx-positive <em>E. coli</em> isolates in live swine, slaughtered swine, and retail pork samples around the world ranged from 4.4 % (22/500) to 68.3 % (82/120), 22 % (309/1395) to 86.3 % (69/80), and 0.10 % (1/1167) to 80 % (32/40), respectively,depending upon the sample categories, detection methods, and the hygiene condition of the slaughterhouses and retail markets. In retail pork, serogroup O26 was prevalent in the U.S., Europe, and Africa. Serogroup O121 was only reported in the U.S. Furthermore, serogroup O91 was reported in the U.S., Asia, and South American retail pork samples. The most common virulence gene combination in retail pork around the globe were as follows: the U.S.: serogroup O157 + stx, non-O157 + stx, unknown serogroups+stx + eae; Europe: unknown serogroups +(stx+ eae, stx2 + eae, or stx1 + stx2 + eae); Asia: O157 + stx1 + stx2 + ehxA, Unknown+stx1 + eaeA + ehxA, or only eae; Africa: O157 + stx2 + eae + ehxA. STEC strains derived from retail pork in the U.S. fall under low to moderate risk categories capable of causing human disease, thus indicating the need for adequate cooking and prevention of cross contamination to minimize infection risk in humans.",False,2022-07-13T00:00:00,2024-07-01T10:36:13,1.5,9.0,"[897, 23, 2318, 22, 2134, 1949, 1785, 1964, 1944, 503]"
116,9,F-2021-232,<em>Anisakis </em>spp.: a parasite with allergic potential,"The consumption of raw or undercooked fish poses a potential risk of contamination with <em>Anksakis spp.</em>, a parasitic helminth, that can cause anisakidosis in humans. Swiss legislation requires fish that is to be consumed raw must be subjected to a treatment that inactivates the larvae of <em>Anisakis</em>. However, the larvae, even when dead, pose an allergenic risk to some consumers. Allergic and anaphylactic symptoms have been observed with increasing frequency, even after eating well-cooked fish. There is now evidence that the digestion of material from dead parasites in food also poses a risk (<a href=""https://www.sciencedirect.com/science/article/pii/S0924224415301503"" target=""_blank"" rel=""noopener"">J. Ivanović J. et al, 2017</a>); indeed, some <em>Anisakis </em>allergens are heat-stable and resistant to pepsin (<a href=""https://pubmed.ncbi.nlm.nih.gov/32191412/"" target=""_blank"" rel=""noopener"">Morozińska-Gogol J. et al., 2019</a>).",True,2021-01-05T00:00:00,2025-12-16T08:15:28,1.22,30.0,"[98, 1304, 2208, 2344, 2597, 1193, 2429, 1540, 2345]"
181,9,F-2022-337,Safety of probiotics,"The microbiome affects the initiation and progression of cancerous tumours through direct effects on tumour cells, and indirectly through manipulation of the immune system. It can also determine the response to cancer therapies and predict disease progression and survival (Jain et al., 2021). There is vast literature on the beneficial effects of probiotics for the prevention and treatment of cancer. A review of the available literature on the subject was published in 2022. The authors conclude that probiotics have been shown to be effective against various types of cancer, but also that there is a need to evaluate the adverse effects of probiotics (gastrointestinal side effects, skin reactions, access to antibiotic resistance genes, harmful effects of metabolites, abnormal stimulation of the immune system) (Sankarapandian et al., 2022). Cancer patients have compromised immunity due to primary disease, chemotherapy, and radiotherapy. The effects of probiotics in this population may differ from those in healthy individuals and raise several critical issues (Lu et al., 2021). A new publication states that Lactobacillus can alter the function of immune cells (macrophages) in the pancreatic tumour environment and stimulate cancer growth (Hezaveh et al., 2022). The mechanism involves the metabolisation of dietary tryptophan by bacteria in the gut, which leads to an inactivation of immune cells involved in tumour control. This is not the only indication of potentially harmful effects of probiotic microorganisms, even independently of the presence of cancer. Among others:
<ul>
<li>Although probiotic bacteria are generally recognised as safe (GRAS status), there are several reports of side effects triggered by the presence of these organisms: systemic infections, impact on the immune system, disruption of metabolism and horizontal gene transfer (Zawistowska-Rojek and Tyski, 2018).</li>
<li>Brain fog syndrome has been reported to be related to probiotic use, with symptoms improving with antibiotics and probiotic discontinuation (Rao et al., 2018).</li>
<li>Fungemia and other fungal infections have been associated with the use of probiotic supplements based on Saccharomyces boulardii (Rannikko et al., 2021).</li>
</ul>",True,2022-03-17T00:00:00,2025-10-09T09:14:53,1.22,41.0,"[913, 919, 1242, 1584, 1799, 1589, 2287, 2524, 2118]"
7,9,F-2018-023,Microbiological safety: convenience products (produce),"Convenience (ready-to-eat) products are very popular. These products include vegetables and fruits that are ready to eat or can be prepared with minimal effort (e.g. heating). Such products also find their way into smoothies, where a variety of different fruits and vegetables are processed. Numerous outbreaks involving such products have been reported internationally. The range of possible pathogens includes:
<ul>
<li>Viral pathogens: NoV on raspberries, cherry tomatoes; HAV on dates, frozen pomegranate seeds.</li>
<li>Bacterial pathogens: salmonella on melons, basil, coconuts; STEC on lettuce; listeria on pre-cut vegetables</li>
<li>Parasitic pathogens: cyclospora on pre-cut vegetables; crypotosporidia in smoothies.</li>
</ul>
For example, from 2015 to 2018, an outbreak related to frozen ready-to-eat vegetables was ongoing. The source of this outbreak could be identified. In addition to frozen maize, other frozen vegetables have also been affected. 47 cases and 9 deaths have been linked to the outbreak. As a result, there have been global recalls of frozen vegetables, with thousands of tonnes destroyed. In the UK alone, more than 50 products were affected. Recalls were also issued in Switzerland. It was striking that listeriosis was caused in frozen products that were not ready for consumption. The question arises as to what the reasons for the listerioses were. The question arises: how can listerioses develop from frozen products that are not ready to eat? Is this a question of inadequate heating instructions (e.g. microwave: too few watts, too short thermal exposure, no homogeneous heating) or a question of production? Is it a question of cross-contamination in production, in households?",True,2018-09-25T00:00:00,2024-11-28T07:59:19,1.33,37.0,"[957, 1042, 1065, 2460, 1049, 864, 1057, 927, 1099]"
239,9,F-2023-022,<em>Helicobacter pylori </em>in raw and ready-to-eat meat,"<em>Helicobacter pylori</em>, classified as a <strong>class-I carcinogen</strong>, is one of the leading medical pathogens of global concern associated mainly with the development of gastric adenocarcinomas and gastric mucosa-associated lymphoid tissue lymphomas; nevertheless, its prevalence in food especially meat and meat products is not fully covered. A study investigated the <strong>prevalence</strong>, <strong>molecular characterization</strong>, and <strong>antimicrobial resistance</strong> profiles of clarithromycin-, and metronidazole-resistant <em>H. pylori</em> isolated from raw and ready-to-eat meat samples retailed in Mansoura city, Egypt. The results showed a <strong>widespread contamination of examined raw and ready-to-eat meat </strong>product samples with multidrug-resistant <em>H. pylori</em> isolates, which could constitute a <strong>tremendous public health hazard</strong>.",True,2023-07-26T11:34:05,2025-10-31T09:18:37,1.56,41.0,"[1118, 1019, 2149, 203, 1957, 1007, 1279, 2320, 1270]"
227,8,F-2023-010,Irrigation with wastewater,"As climatic changes are increasing the pressure on water resources and more fresh fruits and vegetables are needed to meet the demands of a growing population, growers may need to start depending on more varied sources of water for irrigation, including environmental, recycled, and reclaimed wastewaters. Additionally, the wastewater draining from massive pools of sewage sludge has the potential to play a role in more sustainable agriculture (Science of The Total Environment, 20.01.2023). However, this practice is not without risks as some of some of these wastewater sources might be susceptible to contamination with microbial pathogensFor instance, surveys have found <em>Listeria monocytogenes</em> in water, soil, vegetation, and farm animal feces around the world. The frequency at which this pathogen is present in water sources is dependent on multiple factors, including the season, surrounding land use, presence of animals, and physicochemical water parameters. Understanding the survival duration of <em>L. monocytogenes </em>in specific water sources is important, but studies are limited concerning this environment and the impact of these highly variable factors. Understanding the pathogen’s ability to remain infectious is key to understanding how <em>L. monocytogenes</em> impacts produce outbreaks and, ultimately, consumers’ health.Moreover, the German federal institute for risk assessment (BfR) has published a risk assessment of transmission of <em>Cryptosporidium </em>spp., <em>Giardia duodenalis</em> and <em>Toxoplasma gondii </em>to humans related to using reclaimed wastewater in agriculture where they recommend to only use irrigation water of a quality comparable to drinking water for watering plants that are usually consumed raw.",True,2023-02-28T11:35:21,2025-07-24T07:08:52,1.12,32.0,"[52, 1042, 1655, 148, 180, 1182, 613, 2243]"
224,8,F-2023-007,Ukraine war: long-term effects on food safety,"Armed conflict is inherently destructive. Environmental damage that arises during conflict brings devastating  consequences for natural resources, critical ecosystems and people’s health, livelihoods and security. The  containment, mitigation and remediation of environmental impacts is, therefore, an essential part of response to and  recovery from conflict. These impacts may also endanger food safety, be it directly, be it indirectly.Initial information shows that Ukraine, already burdened by a host of legacy environmental challenges, is now facing a compounded, multi-dimensional environmental crisis that has either exacerbated existing issues or added new ones.  The country and the region risk being burdened with a toxic legacy long after the conflict ends.",True,2023-01-31T14:20:15,2025-09-10T08:47:56,1.5,48.0,"[1752, 1301, 1569, 1604, 498, 768, 943, 268]"
58,7,F-2021-097,Food platforms and delivery services,"What has found its way into other domains is also spreading in the food sector. Platforms offer consumers the possibility of having their food delivered and ready-to-eat by the restaurant of their choice, whereby different people in the same household can have a wide variety of dishes delivered to their home at the same time (e.g., <a href=""https://www.smood.ch/en"" target=""_blank"" rel=""noopener"">smood.ch</a>). Another option is to go eat at someone's place who offers their services on an internet platform (e.g., <a href=""https://de.eatwith.com/"" target=""_blank"" rel=""noopener"">de.eatwith.com</a>); yet another option is to have someone cook for you at home (e.g., <a href=""https://www.deinkoch.ch/"" target=""_blank"" rel=""noopener"">deinkoch.ch</a>). There are numerous delivery platforms, such as: Uber Eats, Deliveroo, Blue Apron, Amazon restaurants, GrubHub, Eat street, just eat, etc. In contrast to already existing offers, 'ghost kitchens' are establishing themselves, which uniquely produce on an industrial scale for delivery services and deliver to customers. A dining room with guests is no longer needed. Production and delivery can be industrialised using robots and drones. Bank analysts assume that there is great growth potential. Some providers go even further, they try to no longer use packaging materials. The German app Vanilla Bean, for example, plans to launch a <a href=""https://www.business-punk.com/2019/01/verpackungsfreier-lieferservice/"" target=""_blank"" rel=""noopener"">packaging-free delivery service </a>as soon as autumn 2019.",True,2021-06-29T00:00:00,2025-07-25T07:10:30,1.14,13.0,"[1516, 1289, 692, 2449, 136, 1950, 2242]"
40,7,F-2019-060,<em>Cronobacter sakazakii</em>,"<em>Cronobacter sakazakii </em>is a motile, gram-negative, rod-shaped bacterium from the Enterobacteriaceae family. The bacterium has so far been detected in domestic environments and food production sites, in clinical sample material such as cerebrospinal fluid (CSF), blood or sputum, as well as in food (e.g., cheese, meat and vegetables) and animals (e.g., rats and flies). The bacterium <em>Cronobacter sakazakii </em>can cause life-threatening infections, especially in newborns. A Europe-wide study led by AGES has determined how frequently infections with this pathogen occur. In the process, 77 human<em> C. sakazakii</em> isolates from sick people from eleven European countries, of which 36 isolates were from 2017 and 41 isolates from the years before 2017, were evaluated by AGES.",False,2019-03-12T00:00:00,2025-10-13T10:26:01,1.14,10.0,"[716, 719, 1478, 11, 1409, 1974, 886]"
242,7,F-2023-025,Sweet and acidic drinks: Risk of tooth erosion,"Consumption of <strong>energy drinks</strong> has been increasing dramatically in the last two decades, particularly amongst adolescents and young adults. Energy drinks are aggressively marketed with the claim that these products give an energy boost to improve physical and cognitive performance. However, studies supporting these claims are limited. In fact, several a<strong>dverse health effects </strong>have been related to energy drink; this has raised the question of whether these beverages are safe.",True,2023-10-02T16:56:51,2025-03-07T08:39:36,1.14,21.0,"[846, 833, 693, 747, 1431, 832, 1083]"
42,7,F-2019-062,<em>Bacillus cereus</em> sensu lato - <em>Bacillus thuringiensis</em>,"In agriculture, bacteria of the genus Bacillus are increasingly used as biocides or plant protection products respectively.<em> B. thuringiensis </em>in particular is used as an insecticide as these bacteria produce Bt toxins. The<em> Bacillus cereus </em>group (<em>Bacillus cereus sensu lato</em>) consists of the <em>B. cereus sensu stricto, B. anthracis, B. thuringiensis, B. weihenstephanensis, B. mycoides, B. pseudomycoides, B. cytotoxicus,</em> and<em> B. toyonensis </em>species<em>. </em><em>B. cereus </em>and <em>B. thuringiensis</em> genotypically hardly differ. Furthermore, in clinical diagnostics, these species are not differentiated; therefore, it is unclear to what extent <em>B. thuringiensis </em>could have an impact on food-associated intoxications. The greatest difference between the two species is limited to the presence or absence of plasmids. Plasmids often code exotoxins. The mechanisms of horizontal gene transfer would enable a plasmid exchange in the <em>Bacillus cereus sensu lato</em> group. Whether and how this happens has not been closely investigated yet. Thus, whether <em>B. thuringiensis</em> can be detected in food samples has also not been investigated in greater detail. Recently, certain strain of <em>B. thuringiensis</em> was described as being able to produce large amounts of sphingomyelinase; several other strains of <em>B. thuringiensis</em> demonstrated cytotoxicity in vero cell assays. Therefore, these strains have to be potentially considered virulent. The investigated strains were all isolated from biocides. The safety of strains (QPS or GRAS) employed in agriculture is not explicitly demonstrated. In general, precise identification and characterisation of the strains used, in particular of<em> B. thuringiensis</em> and of possible virulence factors, are not available.",True,2019-07-11T00:00:00,2026-01-12T06:49:01,1.14,54.0,"[1268, 851, 918, 2110, 2328, 912, 2472]"
188,7,F-2022-344,Trifluoroacetate (TFA) in water,"Trifluoroacetate (TFA) is a mobile and persistent substance that is primarily introduced into the water cycle through the degradation of various fluorochemicals and remains there for an unforeseeable period of time. There is already a high baseline load of TFA in many water bodies with some regional hotspots. This background paper presents current data and estimates on sources, input pathways, loads, impacts and measures on TFA. It gives an outlook on first activities and options to comprehensively minimise TFA inputs to the environment. Despite gaps in knowledge, it becomes clear that consistent regulation and an overarching minimisation strategy must be initiated in the short term.",False,2022-05-03T00:00:00,2025-07-24T07:51:40,1.29,9.0,"[1496, 1854, 2481, 2437, 2561, 2204, 2598]"
