id,count,code,titel,kurzinfo,signal,erf_date,mut_date,mean_sterne,count_mut,meldung_ids
8,5,F-2018-024,Microplastics,"Microplastics are ubiquitous in various bodies of water. It is estimated that 4.8-12.7 million tonnes of plastic entered the oceans in 2010. Plastic pollution is classified as an emerging risk and poses a global threat to marine ecosystems. Various studies (and subsequent media reports) report contamination of microplastics in table salt and drinking water. The amounts vary, but there is agreement that microplastics are found in table salt in different countries. Inorganic and organic particles can adhere to microplastics, which are then absorbed by the human body through consumption of contaminated salt. In addition, various types of plastic contain plasticisers, which can have a negative impact on health.",True,2018-09-25T00:00:00,2024-11-08T08:10:41,1.2,51.0,"[1759, 1793, 1740, 1767, 1769]"
234,4,F-2023-017,PFAS in water and soils,"During the last 20 years, guideline values for Per- and polyfluoroalkyl substances (PFAS) in drinking water, surface waters, and soils have decreased dramatically due to new insights into their toxicity. As a result, levels in environmental media are now ubiquitously above guideline levels.",False,2023-03-15T08:32:44,2024-08-30T08:15:03,1.25,28.0,"[1753, 1762, 1795, 1725]"
263,4,F-2024-011,"Salmonella Infantis, an emerging human multidrug-resistant pathogen","Salmonella enterica serovar Infantis is a concerning human pathogen due to its widespread presence and high levels of antimicrobial resistance. A study analyzing strains from 74 countries found that a high percentage of poultry isolates exhibited multidrug resistance, attributed to the presence of the pESI megaplasmid. This highlights the potential for transmission of multidrug-resistant strains from poultry to humans, emphasizing the need for surveillance and control measures.",False,2024-03-14T08:26:04,2024-03-15T10:20:57,1.0,4.0,"[1794, 1733, 1723, 1782]"
115,4,F-2021-231,Salmonella Napoli - seasonality,"Individual cases salmonellosis, spread throughout Switzerland and attributable to a specific salmonella species, were frequent in 2019. However, the occurrence of S. Napoli is particularly striking. The cases that have been occurring since 2002 show a seasonal pattern. The weekly threshold defined by the FOPH was exceeded in 2019, triggering investigations which, however, did not reveal any indication of a possible cause of the illness mentioned above. At present, there are no indications of sources or causes of infection. According to literature studies, the pathogen occurs conspicuously often on rocket. However, further investigations also show an association with surface water. Water could thus be a central source, whether as irrigation water for salads and vegetables or as water associated with leisure activities (bathing, swimming, paddling, etc.). Animal products, on the other hand, seem to be of secondary importance. In contrast to other Salmonella serovars, this pathogen seems to cause more invasive diseases in addition to gastrointestinal diseases.",True,2021-05-18T00:00:00,2024-02-26T11:08:34,1.0,34.0,"[1794, 1723, 1733, 1782]"
83,2,F-2021-123,PFAS in food packaging,"Per- and polyfluorinated alkyl substances (PFAS) are industrial chemicals that are used in numerous industrial processes and consumer products, such as fire extinguishing materials. They are also popular in food packaging because the substances are water and fat repellent. However, in animal studies, some of them have been shown to be liver-damaging, toxic to reproduction and probably carcinogenic. PFAS are of particular concern because, unlike other common contaminants that pass quickly through the human body, they can linger for years and thus accumulate cumulatively. This property has given them the name ""forever chemicals"". PFASs can also enter the food chain through environmental pollution, for example when plants are supplied with contaminated water or grown in contaminated soil, such as near factories or places where products containing PFASs have been used for firefighting. From mid-2020, Denmark will be the first country to ban the use of all PFASs in food packaging.",False,2021-06-17T00:00:00,2024-10-08T08:29:00,1.0,48.0,"[1753, 1795]"
43,2,F-2019-063,Hepatitis E virus (HEV),"Hepatitis E virus (HEV) is an important human infection in the EU/EEA countries and, according to EFSA, more than 21,000 acute clinical cases with 28 deaths have been reported in the last 10 years, with a tenfold increase in the total number of HEV cases reported; the majority (80%) of cases were reported in France, Germany and the UK. However, as human infections are not notifiable in all Member States and surveillance varies from country to country, the number of reported cases is not comparable and the actual number of cases may be higher. Food-borne transmissions of HEV appear to be one of the main routes in Europe; pigs and wild boar are the main source of HEV, but deer may also be infected. There is a particular risk related to the consumption of pig liver and raw meat products. Recently, HEV has been detected in shellfish and their production environment (seawater) in Italy. HEV can also enter food through faecal contamination. Outbreaks and sporadic cases have been identified in immunocompetent individuals as well as in recognised risk groups, such as those with pre-existing liver damage, immunosuppressive diseases or immunosuppressive treatments.",True,2019-05-10T00:00:00,2024-10-25T07:52:57,1.5,25.0,"[1749, 1726]"
178,2,F-2022-334,Protozoan parasites in foods,"Parasitic protozoa are important pathogens in humans and animals. Due to their complex life cycles, different transmission routes and longer periods between infection and symptoms, the public health burden and the relative importance of different transmission routes are often difficult to assess. Protozoa are unicellular, eukaryotic organisms. There are about 40 known human pathogenic species. They include cryptosporidia, giardia, microsporidia, toxoplasma, balantidium coli, entamoeba histolytica, blastocystis. Cryptosporidia and Giardia are considered the main cause of diarrhoeal diseases in humans worldwide. Toxoplasmas, for example, were ranked as the pathogens with the highest risk in a comparative assessment by the Biological Hazards Panel of the Norwegian Scientific Committee for Food and Environment in 2021. In pets, coccidia, toxoplasma, cryptosporidia and giardia are the main ones. In addition to consumer exposure to protozoan parasites through animal contact or contaminated water, foodborne transmission is also possible.",False,2022-08-03T00:00:00,2024-11-05T11:09:59,1.5,13.0,"[1743, 1789]"
165,1,F-2022-316,Marine toxins: an emerging risk in Europe?,"Ciguatera is the most common form of marine biotoxin food poisoning in the world, with between 10,000 and 50,000 cases reported each year, a figure that is probably far from the reality. Ciguatera poisoning (CTXs) is endemic in tropical and subtropical areas, particularly in the Pacific and Caribbean (West Indies). Ciguatera is a complex syndrome with gastrointestinal, neurological and cardiovascular effects. The symptoms appear two to twelve hours after the contaminating meal. The question of a possible emergence of indigenous European cases is raised in view of the potential impact of climate change on the contamination of the food chain.",False,2022-07-21T00:00:00,2024-10-14T08:45:20,1.0,8.0,[1783]
224,1,F-2023-007,Ukraine war: long-term effects on food safety,"Armed conflict is inherently destructive. Environmental damage that arises during conflict brings devastating  consequences for natural resources, critical ecosystems and people’s health, livelihoods and security. The  containment, mitigation and remediation of environmental impacts is, therefore, an essential part of response to and  recovery from conflict. These impacts may also endanger food safety, be it directly, be it indirectly.Initial information shows that Ukraine, already burdened by a host of legacy environmental challenges, is now facing a compounded, multi-dimensional environmental crisis that has either exacerbated existing issues or added new ones.  The country and the region risk being burdened with a toxic legacy long after the conflict ends.",True,2023-01-31T14:20:15,2024-10-23T08:41:53,1.0,40.0,[1752]
11,1,F-2018-027,Vibrio spp. in seafood,"V. vulnificus and V. parahaemolyticus are marine bacterial microorganisms that can occur in seawater, especially at warmer temperatures. They are the main cause of bacterial diseases caused by seafood. These pathogens are regularly detected in the USA and Asia. In Europe, the pathogen is hardly ever found. There are fears that these pathogens will become increasingly important as the oceans warm up. The severity of the diseases caused by V. vulnificus can be described as very severe. According to literature, the lethality rate is over 50% after infection. This makes it one of the most serious pathogens in terms of lethality in the area of food-borne diseases. The FDA regulation expresses this with a zero tolerance. In the EU and Switzerland, there is no regulation of this pathogen. In addition, various publications report the multiple development of antibiotic resistance in these pathogens, caused by the use of antibiotics in aquacultures. Environmental and patient isolates show similar resistance profiles. These included resistance to ampicillin, penicillin and tetracycline. HorizonScan: Since 1999, 250 reports of Vibrio spp. in shrimp have been recorded.",True,2018-12-20T00:00:00,2024-10-28T07:44:02,1.0,45.0,[1777]
281,1,F-2024-029,Antifungal resistance,"Fungi are known for causing superficial infections of the nails, skin and hair, but they can also cause systemic infections that can have much more serious health implications. Indeed, over 6.5 million people are infected yearly with a life-threatening fungal infection, leading to 3.8 million deaths. Many of the fungal pathogens are resistant to treatment with current drugs – of which only four classes are in use – or can rapidly acquire resistance during treatment or in their natural environment. As with bacteria and antibiotic resistance, so fungi can evolve to become resistant to the drugs used to treat them. The second UN-hosted meeting on antimicrobial resistance took place on September 26, 2024. Aside from the wider acknowledgement of antimicrobial resistance, the meeting drew attention to the growing problem of fungal pathogens and their resistance to known treatments, globally. Tons of fungicides are used annually to protect crops, of which some work the same way as antifungals used in humans. An example of this is an antifungal drug class called the azoles. There is strong evidence to suggest that azole resistance in the clinic can be of environmental origin due to agriculturally used azoles.",False,2024-10-21T08:08:50,2024-10-21T17:16:22,1.0,5.0,[1748]
95,1,F-2020-135,Ultraprocessed food,"Since 1980, scientific literature has reported on the links between the prevalence of certain health conditions and the high consumption of ultra-processed food (see NOVA Klassifikation for definition of ultraprocessed food). The increased consumption of this type of food may be responsible for the increase in incidence of many health conditions such as obesity, type 2 diabetes, hypertension, dyslipidaemia, loss of microbial diversity, dysbiosis, other inflammation-related diseases of the digestive system, increased risk of ischaemic heart disease, coronary heart disease and cancer. Ultra-processed foods have high energy density (energy per volume) and low nutrient density (nutrient per unit energy), making them nutritionally unbalanced. Additives are often used to improve shelf life and taste, and chemical contaminants can result from processing methods. Maximum permitted levels for food additives and contaminants are set to protect consumers, but their cumulative effects are largely unknown.",False,2020-01-06T00:00:00,2024-11-06T09:08:12,1.0,69.0,[1791]
31,1,F-2019-051,Campylobacter - roles of flies in transmission,"Campylobateriosis is the most common food-associated disease, not only in Switzerland but worldwide. The number of campylobaterioses is around 7,000 cases per year. The sum of Disability Adjusted Life Years (DALY) is estimated at over 1 million worldwide. With climate change, Canadian researchers predict that the incidence will double by 2080, due to an increase in fly populations that are likely to develop as a result of the warmer climate. Although the transmission of Campylobacter is not fully understood in all its details, domestic flies do not play a  insignificant role in the transmission of Campylobacter in reservoirs. Cousins et al. (2019) have investigated the role of flies in Campylobacteriosis. When temperatures rise, the number of flies increases and the incidence of campylobacteriosis rises at the same rate.",False,2019-02-25T00:00:00,2023-10-26T07:35:31,1.0,5.0,[1754]
282,1,F-2024-030,Foodborne illnesses caused by Edwardsiella tarda,"Edwardsiella (E.) tarda is a bacterial pathogen with a wide host range in fish, reptiles, amphibians and mammals. As a fish pathogen, E. tarda has a high economic impact. Foodborne diseases caused by the consumption of contaminated fish and seafood have been described in the past, particularly in Asian countries. There are first indications that the number of human cases of E. tarda infection is increasing and that cases are also occurring outside Asia. Climate change, environmental pollution and an increase in aquaculture are being discussed as possible triggers for the increase and spread. This BeoWarn report summarises current knowledge about the pathogen E. tarda as a possible cause of foodborne diseases.",False,2024-10-28T07:07:57,2024-10-28T11:40:20,1.0,6.0,[1763]
34,1,F-2018-054,Mycotoxins in foods,"Mycotoxins are metabolites formed from certain moulds. Mould – and hence mycotoxins – can form on vulnerable foods in warm and humid conditions, either whilst crops are still growing or post-harvest during storage, drying and transport. Most mycotoxins have toxic effects in humans, and some of the better characterised mycotoxins have regulatory limits in food. Certain foods are at particular risk. These include nuts and peanuts (primarily for aflatoxins) and raisins (primarily for ochratoxin A). Horizon Scan (a non-public database) has compiled a list of the most important products and has noted an increase in recalls. These findings are also supported by other stakeholders across the food chain (e.g., Biomin World Mycotoxin Survey 2018).",True,2018-12-11T00:00:00,2024-10-18T07:35:42,1.0,47.0,[1781]
196,1,F-2022-352,PFOS in meat,"Perfluorooctanesulfonic acid (PFOS) (conjugate base perfluorooctanesulfonate) is an anthropogenic (man-made) fluorosurfactant, now regarded as a global pollutant. There is a major focus on PFOS hotspot contaminations in DK right now. During the spring and summer a site previously used for training fires and firefighting has been investigated. A field close to the site was used for grassing by cows owned by 20 families. Five cows each summer has been grassing there. PFOS is analysed in the meat at concentrations from 156 to 230 ng/g in four samples from four cows. Also grass was analyzed from the area up to 165 ng/g and water in the stream showed very high levels. The theory is that rainwater is running off in the direction of the field and the stream. So the cows have had the intake both from the water in the stream and from the grass. About 187 local consumers, that have eaten the meat through the years, have had the blood analyzed for PFOS. There are a big variation of PFOS in the blood. From 1,1 ng/ml up to 500 ng/ml. Doctors at the nearby hospital will follow the people who has high levels in the blood and try to help them. They will now try to use a type of cholesterol-lowering medicine that is thought to increase the secretion of PFOS. 145 other areas around DK, where use of PFOS has been going on, will now be investigated.",False,2022-07-13T00:00:00,2024-09-04T06:40:26,2.0,6.0,[1725]
137,1,F-2021-284,Fish oil as a food supplement,"Currently, fish oil supplements are indicated for patients with elevated plasma triglycerides to reduce cardiovascular risk. Due to the high prevalence of elevated triglycerides in the population, they can be prescribed frequently. It is worth noting that low-dose omega-3 fatty acids are available over the counter. Some clinical studies suggest that omega-3 fatty acids may be associated with an increased risk of atrial fibrillation, the most common cardiac arrhythmia. People with this disorder are five times more likely to have a stroke. Lombardi et al (2021) found that omega-3 fatty acid supplementation was associated with a significantly increased risk of atrial fibrillation compared to placebo, with an incidence rate of 1.37 (95% confidence interval 1.22-1.54; p<0.001).",False,2021-05-12T00:00:00,2022-09-12T11:03:19,1.0,4.0,[1727]
25,1,F-2019-045,Insects for human consumption,The microbiological safety of insects approved for consumption is the subject of various studies. These products are relatively new on the market and corresponding experience is lacking.,False,2019-01-31T00:00:00,2024-10-14T12:06:47,1.0,23.0,[1735]
27,1,F-2019-047,Dietary supplements,"According to Menu CH, around 50% of Swiss people regularly consume food supplements containing vitamins, minerals, trace elements or other substances. The focus of this briefing note is primarily on food supplements containing plant extracts or endogenous substances (amino acids, coenzymes, etc.) in concentrated doses, which are notyet specifically regulated in Switzerland (see legal framework). Food supplements are foods and as such must be safe and not deceptive, they must also not be pharmacologically active. This responsibility primarily lies with the manufacturers/distributors within the framework of their self-regulation. As they are available as capsules, pills, powder, etc., the presentation of food supplements is similar to that of drugs; more concretely, they are sometimes advertised similarly to drugs namely, as improving health/quality of life or are at least perceived as such by consumers. On the internet, but also in supermarkets and health food shops, products are also offered as food supplements which are to be classified as non-approved novel foods or drugs. Novel foods and medicinal products undergo an official approval procedure in which their safety to health must be proven before they can be marketed. For the other food supplements, which are not considered novel foods, no approval procedure is required. Practice shows that the specifications of such products are often unclear and the toxicity (main substance, residual extracts, contaminants) is not clarified by experts. In literature, through nutrivigilance systems and through official warnings (e.g., from the US FDA), case studies of adverse effects, of up to serious liver or kidney damage are described (e.g., with certain green tea extracts), or also interactions with drugs taken simultaneously. The number of undesirable effects that go unnoticed is estimated to be high; as the effects are often not immediately visible and thus the causal connection to previous consumption goes unnoticed. Consumers do not necessarily consult a doctor or a poison control centre, and there is no nutrivigilance system in Switzerland.Legal framework Switzerland: Most important: General food law provisions on safety and protection against deception, VNem, Ordinance on Novel Food, certain plants and substances may not be used in food (VLpH and VZVM). No nutrivigilance system (unlike France), no notification legal framework EU: Largely non-harmonised. Certain countries have specific regulations (maximum quantities, plant lists), some notification, few countries with nutrivigilance systems.",True,2019-02-11T00:00:00,2024-06-11T07:55:09,1.0,18.0,[1737]
86,1,F-2019-126,Mercury in permafrost,"New studies reveal that permafrost is the largest natural source of mercury on Earth - with mercury levels twice as high as all other soils, the ocean and the atmosphere combined. Climate warming threatens to melt this permafrost and gradually release mercury into the food chain. Mercury enters permafrost naturally, as part of the global mercury cycle, but also as a result of anthropogenic activities such as burning coal and petroleum. Once inorganic mercury is released, it can be converted by microbes into methylmercury, a potent neurotoxin. Eating fish from mercury-contaminated water therefore often leads to damage to the central nervous system and birth defects in humans. Released mercury can also enter the atmosphere and thus be distributed to other parts of the world, where it usually settles in rivers, lakes and seas.",True,2019-11-18T00:00:00,2024-10-18T07:04:04,2.0,64.0,[1772]
143,1,F-2021-291,Circular economy,"The Circular Economy (CE) is an approach that decouples economic activity from the consumption of finite resources, avoids waste, opposes the linear economic model of 'take-produce-consume-waste' and replaces it with an economic model based on sharing, leasing, reusing, repairing, refurbishing and recycling in an (almost) closed loop. Such a shift from a linear economy to a circular economy is expected to significantly support the achievement of the UN Sustainable Development Goals (SDGs), in particular SDG 12 (Responsible Consumption and Production). However, the design and implementation of the circular economy requires careful consideration of the numerous trade-offs that may arise. This is a prerequisite for achieving SDG 3 (Good health and well-being).In the transition to a circular economy, it will be crucial to identify potentially emerging risks to the environment and food and feed safety in a holistic and integrated manner in order to achieve an optimal balance between opportunities, benefits and risks. It is important to ensure that food and feed safety and environmental health considerations are included at an early stage of research or policy initiatives related to recycling and the circular economy.",False,2021-12-18T00:00:00,2024-10-14T08:57:22,2.0,7.0,[1774]
199,1,F-2022-355,STEC contamination in pork production chain,"Epidemiological evidence of Shiga toxin-producing Escherichia coli (STEC) infections associated with the consumption of contaminated pork highlight the need for increased awareness of STEC as an emerging pathogen in the pork supply chain. The reported prevalence rate of stx-positive E. coli isolates in live swine, slaughtered swine, and retail pork samples around the world ranged from 4.4 % (22/500) to 68.3 % (82/120), 22 % (309/1395) to 86.3 % (69/80), and 0.10 % (1/1167) to 80 % (32/40), respectively,depending upon the sample categories, detection methods, and the hygiene condition of the slaughterhouses and retail markets. In retail pork, serogroup O26 was prevalent in the U.S., Europe, and Africa. Serogroup O121 was only reported in the U.S. Furthermore, serogroup O91 was reported in the U.S., Asia, and South American retail pork samples. The most common virulence gene combination in retail pork around the globe were as follows: the U.S.: serogroup O157 + stx, non-O157 + stx, unknown serogroups+stx + eae; Europe: unknown serogroups +(stx+ eae, stx2 + eae, or stx1 + stx2 + eae); Asia: O157 + stx1 + stx2 + ehxA, Unknown+stx1 + eaeA + ehxA, or only eae; Africa: O157 + stx2 + eae + ehxA. STEC strains derived from retail pork in the U.S. fall under low to moderate risk categories capable of causing human disease, thus indicating the need for adequate cooking and prevention of cross contamination to minimize infection risk in humans.",False,2022-07-13T00:00:00,2024-07-01T10:36:13,1.0,7.0,[1785]
142,1,F-2021-289,Plastic straw  alternatives,"Straws are one of the disposable plastic articles that will be subject to a Europe-wide sales ban from 3 July 2021. This was stipulated in EU Directive 2019/904 of 5 June 2019, which raises the question of whether and how frequently used everyday products, the majority of which have been made of plastic up to now, can be made of other materials.",False,2021-05-28T00:00:00,2023-08-31T08:29:42,1.0,4.0,[1790]
126,1,F-2021-273,"6PPD-Chinon - car tire abrasion, artificial turf","Exposure of coho salmon (Oncorhynchus kisutch) in the Pacific Northwest of the United States to stormwater causes unexplained acute annual mortality when adult salmon migrate to urban streams to reproduce. Investigating this phenomenon, researchers identified a highly toxic quinone transformation product of N-(1,3-dimethylbutyl)-N′-phenyl-p-phenylenediamine (6PPD), a ubiquitous antioxidant found in tyre rubber worldwide. Retrospective analyses of representative U.S. West Coast road runoff and stormwater-influenced streams revealed the widespread occurrence of 6PPD quinone (<0.3 to 19 micrograms per liter) at toxic concentrations (median lethal concentration of 0.8 ± 0.16 micrograms per liter). These results reveal unexpected risks of 6PPD antioxidants to this aquatic species and imply toxicological relevance for residues derived from tyre rubber.",True,2021-03-01T00:00:00,2024-11-08T08:09:21,2.0,38.0,[1796]
