id,count,code,titel,kurzinfo,signal,erf_date,mut_date,mean_sterne,count_mut,meldung_ids
250,5,F-2023-033,Dimethylated Thioarsenates in rice,"Arsenic (As) occurrence in rice is a serious human health threat. Worldwide, regulations typically limit only carcinogenic inorganic As, but not possibly carcinogenic dimethylated oxyarsenate (DMA). However, there is emerging evidence that “DMA”, determined by routine acid-based extraction and analysis, hides a substantial share of dimethylated thioarsenates that have similar or higher cytotoxicities than arsenite. Risk assessments characterizing the in vivo toxicity of rice-derived dimethylated thioarsenates are urgently needed. In the meantime, either more sophisticated methods based on enzymatic extraction and separation of dimethylated oxy- and thioarsenates have to become mandatory or total As should be regulated.Since the publication of the 2009 EFSA opinion on arsenic in food new studies have become available on the toxic effects of organic arsenic. Furthermore it has become clear that dimethylmonothioarsenate (DMMTA) is formed from methyl arsenate due to the application of sulphate fertilisers, and that this substance could be more toxic than methylarsenate. It is therefore appropriate to update the hazard identification and characterisation of organic arsenic. On the basis of the available occurrence data for organic arsenic or literature information on organic arsenic in food, the exposure could be estimated in order to carry out an assessment for the risks for human health related to organic arsenic in food. In view of different properties of the methylated arsenic species, arsenobetaine, arsenolipids and arsenosugars, it is appropriate to assess the organic arsenic species in 2 separate opinions: an opinion on methylated arsenic species and an opinion on arsenobetaine, arsenolipids and the arsenosugars, which should also include any other possible organic arsenic species. After finalising the risk assessments on inorganic and organic arsenic, also the combined exposure to inorganic and organic arsenic should be assessed (source: <a href=""https://open.efsa.europa.eu/questions/EFSA-Q-2021-00496"" target=""_blank"" rel=""noopener"">Open EFSA (europa.eu)</a>)",False,2023-11-09T07:40:13,2024-01-23T07:04:35,1.0,9.0,"[1856, 933, 1027, 1014, 2180]"
180,5,F-2022-336,Nano coating of foods,"There is currently a lot of investment in research to develop new types of food packaging and a trend towards sustainable and also edible forms of packaging. Edible packaging is usually made of sustainable, biodegradable material. On the one hand, this includes packaging such as yoghurt pots that can be eaten, but also edible coatings that are placed around the food. In Switzerland, edible coatings of fruits and some vegetables are permitted, e.g. beeswax (E 901) as a coating for apples. Provided that the substances are approved as food additives for the respective food. What is new is that more and more packaging or coating agents are now being developed in nano form. Depending on the application, these are nanofibres, nanoparticles, nanoemulsions or even nanoencapsulations. A current example is the development of a nano-cellulose layer for fruits and vegetables, which is made from pomace (pressed out fruit and vegetable peels). The project is a collaboration between Lidl and researchers at EMPA. The reason for using nano-forms is manifold. Nano-form coatings allow thin edible layers on the food (about 5nm thickness). Coatings based on nanotechnology usually also allow better regulation of moisture in the food and better gas exchange for longer shelf life. In addition, nanocoatings can enable other functions such as the incorporation of so-called nanosensors in food, which indicate the spoilage of food (so-called ""smart packaging""). Various legal and health issues arise in the application. For example, in the case of the cellulose developed by EMPA, it is not clear whether the already approved coating agents (celluloses E 460-469) cover the newly developed cellulose or whether it would need a new approval. Secondly, there are questions about the toxicity of the nanoparticles through the consumption of the edible layers, which need to be carefully clarified before new nanoforms can be put on the market. A report by the RIVM in the Netherlands, for example, points out that specific risk assessments are needed for nanocellulose applications in the food sector, and that these might even have to be considered as novel foods. Retailers and Empa (Swiss Federal Laboratories for Materials Science and Technology) are researching protective cellulose coating for fruit and vegetable products. The innovative coating is made from so-called pomace (press residue) and in the future, is to be used for retailers' products. The innovative project can reduce packaging and avoid food waste. No fresh vegetables are to be used for the novel protective coating, only organic residues. At Empa's Cellulose &amp; Wood Materials lab, commissioned by a retailer, researchers developed a special protective cellulose layer that can be applied to fruit and vegetables within a year's time. The result: the coated fruits and vegetables stay significantly longer fresh. In tests, for example, the shelf life of bananas could be extended by more than a week.Other materials for alternative packaging and substitutes for plastics are being researched, including silk, for example.",True,2022-03-16T00:00:00,2024-09-05T10:59:16,1.4,30.0,"[147, 185, 429, 209, 2004]"
275,5,F-2024-023,Lab-grown food,"Lab-grown food, also known as cultured or synthetic food, encompasses a variety of products that are produced using biotechnological methods rather than traditional agricultural practices. Some examples include cultured meat, derived from animal cells grown in a controlled environment, and lab-grown vegetables and fruits produced through tissue culture techniques. While this technology holds promise in addressing food security and environmental concerns, there are potential risks associated with its development and consumption.One significant concern is related to the safety and regulatory aspects of lab-grown food. Since these products are relatively new, there is limited data on their long-term health effects. Ensuring that the growth medium and conditions are free from contaminants and pathogens is crucial to avoid health risks to consumers. Additionally, there may be unknown allergens or unintended health consequences that could arise from consuming these novel food products.In laboratories, various types of food can be grown using biotechnological methods. Some of the most notable examples include:
<ul>
<li><strong>Cultured Meat:</strong> Also known as lab-grown meat or clean meat, this involves growing animal muscle tissue from stem cells in a controlled environment. It aims to replicate the taste, texture, and nutritional profile of traditional meat without the need for raising and slaughtering animals.</li>
<li><strong>Lab-Grown Fish and Seafood:</strong> Similar to cultured meat, lab-grown fish and seafood products are produced by cultivating fish cells in vitro. This technology offers a sustainable alternative to wild-caught or farmed seafood, potentially reducing overfishing and environmental impacts associated with traditional aquaculture.</li>
<li><strong>Lab-Grown Vegetables and Fruits:</strong> Tissue culture techniques can be used to propagate plants under sterile conditions, allowing for the production of uniform and disease-free plants. This method is particularly useful for propagating rare or endangered plant species and can also be applied to produce specific plant parts, such as fruits or seeds.</li>
<li><strong>Algae and Microbial Cultures:</strong> Algae and certain types of microorganisms can be cultivated in laboratories for their nutritional value and potential applications in food products. Algal biomass can be processed into oils, proteins, and other valuable nutrients.</li>
<li><strong>Lab-Grown Dairy Products:</strong> Researchers are exploring methods to produce dairy proteins, such as casein and whey, using microbial fermentation or bioengineering techniques. These proteins can be used as ingredients in dairy alternatives or other food products.</li>
<li><strong>Alternative Protein Sources:</strong> Beyond meat and seafood, labs are also investigating other sources of protein such as insects and fungi. These organisms can be cultured and processed into protein-rich ingredients for human consumption.</li>
<li><strong>Cacao and coffee : </strong>This process involves the cultivation of cacao cells, which grow, replicate and then differentiate to produce the various components needed for cocoa-based products, such as chocolate.</li>
</ul>",False,2024-07-11T08:19:59,2026-01-09T09:49:10,1.4,12.0,"[163, 370, 557, 606, 946]"
120,4,F-2021-238,<em>Listeria monocytogenes</em> serotyp 4b ST6 in cheese,"An outbreak of human listeriosis in Switzerland was attributed to persistent environmental contamination of a cheese factory with <em>Listeria monocytogenes</em> serotype 4b, sequence type 6, cluster type 7488. Whole genome sequencing was used to match clinical isolates with a cheese sample and with samples from numerous sites within the production environment.",False,2021-01-04T00:00:00,2024-10-17T06:54:42,1.0,11.0,"[126, 2271, 2011, 2013]"
60,4,F-2019-099,Pet food as a vector for pathogen transmission into domestic environments,"Pet food, just like food for humans, can be contaminated by microbiological or chemical contaminants. This danger is exacerbated by the new food trend 'Barf' or 'Biologically Apporopriate Raw Food'. Barfing' involves feeding raw meat, offal, bones and ingredients such as fruit and vegetables. These are supposed to be good for the animal, but can be particularly contaminated with bacteria. Not only is there a risk of the animal becoming ill, but also the spread of antibiotic-resistant bacteria. On the one hand, pet owners come into contact with the multi-resistant bacteria when preparing the food. On the other hand, pets have close contact with humans, which increases the risk of transmission from animal to human. Pet food for dogs has led to several outbreaks in humans. In the USA, for example, around 93 people in 27 states fell ill with various (multidrug-resistant) <em>Salmonella </em>serotypes in 2019 (4,[5],12:i:-, Infantis, Newport and London). Dried pig ears could be identified as the cause. Petfood recalls due to contamination with <em>Salmonella </em>are also taking place in Europe (RASFF notification).",True,2019-08-05T00:00:00,2025-12-22T17:04:34,1.25,17.0,"[110, 1490, 1901, 942]"
157,4,F-2021-306,<em>Toxoplasma gondii</em> in ostrich meat,"Toxoplasmosis is a worldwide disease that affects humans and many animal species, including birds. Antibodies against <em>Toxoplasma gondii</em> have been detected in ostriches from South and North America, Africa and Asia. With the exception of a study from Spain, there is no information on the seroprevalence of <em>T. gondii</em> in ostriches from Europe. The aim of the study by Bàrtovà et al. (2021) was therefore to detect antibodies against <em>T. gondii</em> in farmed ostriches in the Czech Republic. Serum samples from 409 ostriches (Struthio camelus) collected from 9 farms were analysed by latex agglutination test. Antibodies against <em>T. gondii</em> were detected in 149 (36 %) animals. High seropositivity may, according to Bàrtovà et al., indicate a risk of infection from ostrich meat to humans. Brain and heart tissues appear to be suitable samples for PCR detection of <em>T. gondii</em> DNA. Ostriches can presumably react as serological non-responders to<em> T. gondii</em> infection. Bàrtov et al. suggest that ostriches may pose a high risk of toxoplasmosis to humans by consuming raw or inadequately cooked ostrich meat and that even seronegative ostriches may harbour <em>T. gondii</em> in their tissues.",False,2021-08-10T00:00:00,2023-10-19T08:26:01,1.25,4.0,"[144, 1332, 2006, 248]"
230,4,F-2023-013,Grayanotoxin in honey,"The European Commission asked EFSA for a scientific opinion on the risks for human health of the presence of grayanotoxins (GTXs) in ‘certain honey’ from Ericaceae plants. The risk assessment included all structurally related grayananes occurring with GTXs in ‘certain’ honey. Oral exposure is associated with acute intoxication in humans. Acute symptoms affect the muscles, nervous and cardiovascular systems. These may lead to complete atrioventricular block, convulsions, mental confusion, agitation, syncope and respiratory depression. For acute effects, the CONTAM Panel derived a reference point (RP) of 15.3 μg/kg body weight for the sum of GTX I and III based on a BMDL10 for reduced heart rate in rats. A similar relative potency was considered for GTX I. Without chronic toxicity studies, an RP for long-term effects could not be derived. There is evidence for genotoxicity in mice exposed to GTX III or honey containing GTX I and III, showing increased levels of chromosomal damage. The mechanism of genotoxicity is unknown. Without representative occurrence data for the sum of GTX I and III and consumption data from Ericaceae honey, acute dietary exposure was estimated based on selected concentrations for GTX I and III reflecting concentrations measured in ‘certain’ honeys. Applying a margin of exposure (MOE) approach, the estimated MOEs raised health concerns for acute toxicity. The Panel calculated the highest concentrations for GTX I and III below which no acute effects would be expected following ‘certain honey’ consumption. The Panel is 75% or more certain that the calculated highest concentration of 0.05 mg for the sum of GTX I and III per kg honey is protective for all age groups regarding acute intoxications. This value does not consider other grayananes in ‘certain honey’ and does not cover the identified genotoxicity.",False,2023-03-06T09:24:30,2025-01-17T07:53:43,1.75,6.0,"[379, 754, 345, 225]"
10,4,F-2018-026,Shiga toxin-producing <em>E. coli </em>in flour,"STEC from different types of flour have caused epidemics in <a href=""https://www.canada.ca/en/public-health/services/public-health-notices/2017/public-health-notice-outbreak-e-coli-infections-linked-various-flours-flour-products.html"" target=""_blank"" rel=""noopener"">CAN</a> (O121) and the <a href=""https://www.fda.gov/Food/RecallsOutbreaksEmergencies/Outbreaks/ucm504192.htm"" target=""_blank"" rel=""noopener"">USA</a> (O121, O26). <a href=""https://www.fda.gov/safety/recalls-market-withdrawals-safety-alerts/association-adm-milling-co-king-arthur-flour-inc-expands-recall-unbleached-all-purpose-flour-5-lb-25"" target=""_blank"" rel=""noopener"">Several </a> <a href=""https://www.fda.gov/safety/recalls-market-withdrawals-safety-alerts/j-m-smucker-company-issues-voluntary-recall-specific-lots-robin-hoodr-all-purpose-flour-distributed#recall-announcement"" target=""_blank"" rel=""noopener"">product recalls</a> were issued in the USA. Based on the publication by <a href=""https://doi.org/10.1007/s00003-017-1113-1"" target=""_blank"" rel=""noopener"">Mäde et al</a>. (2017), investigations were also carried out at the FSVO which confirmed the findings (detection of STEC in types of flour).",True,2018-04-13T00:00:00,2024-01-19T07:25:05,1.5,18.0,"[1524, 2322, 531, 2314]"
270,4,F-2024-018,Additives and their implications in diabetes,"Diabetes is a significant global health concern, highlighting the critical role of dietary strategies in its management and prevention. <strong>Artificial sweeteners </strong>(ASs), due to their capacity to provide sweetness without contributing to caloric intake, have emerged as a potential tool in diabetes management. This review thoroughly examines the nuanced relationship between artificial sweeteners and diabetes, addressing their benefits and potential risks. ASs have been shown to aid in weight management, a key factor in reducing diabetes risk, and do not impact immediate blood glucose levels, offering improved glucose control for individuals with diabetes. Beyond these benefits, however, artificial sweeteners may interact complexly with gut microbiota, potentially altering its composition and affecting metabolic health. This interaction introduces concerns regarding insulin sensitivity and the risk of insulin resistance, with studies reporting conflicting findings. This comprehensive review highlights the importance of a nuanced approach to understanding the implications of artificial sweeteners in diabetes management. <strong>Given the mixed evidence on their health effects, there is a clear need for further research to fully elucidate the role of artificial sweeteners in metabolic health and their suitability as part of dietary interventions for diabetes.</strong><strong></strong>Published in The Lancet Diabetes and Endocrinology, a recent study carried out by researchers in France, indicates that certain f<strong>ood emulsifiers </strong>may increase the risk of developing type 2 diabetes. Emulsifiers are among the most commonly used additives in foods produced globally and are often added to processed and packaged foods such as certain factory-produced breads, cakes, biscuits, and desserts, as well as yogurts, ice creams, chocolate bars, margarines, and ready-to-eat meals.",False,2024-06-13T15:18:42,2026-01-21T07:32:18,1.5,5.0,"[44, 507, 1445, 1321]"
190,4,F-2022-346,Tick-borne meat allergy,"Meat allergy was first observed in the 1990s and formally described in 2009, which makes it a relatively recent arrival to the compendium of allergic conditions. Its most curious quality may be that it is seemingly triggered by a tick bite. In America, the culprit, called the lone-star tick, females have a distinctive white splotch on their backs, is common in the warm and humid Southeast, where most cases of meat allergy have been diagnosed.This syndrome is called AlphaGal syndrome (AGS). Individuals are allergic to a sugar molecule, which does not occur in humans but is on a large number of cells in all other mammals. It is a sugar with the name galactose-alpha-1,3 galaktose, or alpha-galactose, or alpha-gal for short. AGS patients develop a disease after eating mammalian meat, dairy products or even cosmetics containing animal ingredients. Allergy symptoms: from thick lips, shortness of breath and itchy skin to circulatory problems and unconsciousness. Many suffer from abdominal pain, nausea and diarrhoea.",False,2022-05-09T00:00:00,2025-08-07T08:20:17,1.75,12.0,"[2084, 2344, 684, 2536]"
285,4,F-2025-002,<em>Blastocystis</em> spp.,"Blastocystis hominis is probably the most common protozoan detected in human  faecal samples worldwide. Infection occurs in both immunocompetent and <br>immunocompromised individuals. Reported prevalence ranges from 2% to 50%, with  the highest rates reported for developing countries with poor environmental hygiene.  Infection appears to be more common in adults than in children. However, one study  showed that peak infection occurs at 10 years of age and then later in life. Pathogenicity  of B. hominis is controversial because of the nonspecific symptoms and prevalence of  asymptomatic infections. Some case–control studies of individuals with and without  symptoms show no difference in the prevalence of B. hominis. Symptoms attributed <br>to B. hominis include watery or loose stools, diarrhoea, abdominal pain, anal itching,  weight loss and excess gas. Duration of infection is not well known; some infections  can last for weeks, months or years. In some patients, the symptoms resolve, even  though Blastocystis can still be detected in stools. It has been suggested that B. hominis may be a commensal organism that becomes pathogenic when the host is immunosuppressed, is malnourished or has other infections.Contaminated water sources can lead to outbreaks of <strong>parasitic infections</strong> like <strong><em>Blastocystis </em>sp.</strong>, significantly straining healthcare systems and impacting community health. A systematic <strong>review </strong>analyzed 24 studies with 2,451 water samples from 15 countries, finding an overall prevalence of 18.8% for <em>Blastocystis</em> sp., with the highest infection rate in wastewater (35.5%) and notable levels in <strong>tap water</strong> (<strong>19.1%</strong>).",True,2025-02-03T16:15:44,2025-08-08T08:15:21,1.5,18.0,"[2421, 709, 1743, 2044]"
149,4,F-2021-297,ESKAPE pathogens transmission via food,"ESKAPE is an acronym that encompasses the scientific names of six highly virulent and antibiotic-resistant bacterial pathogens, including: <em>Enterococcus faecium</em>,<em> Staphylococcus aureus</em>, <em>Klebsiella pneumoniae, Acinetobacter baumannii, Pseudomonas aeruginosa</em> and <em>Enterobacter spp.</em> This group of Gram-positive and Gram-negative bacteria can evade or 'escape' common antibiotics due to their increasing multi-drug resistance (MDR). As a result, they are the leading cause of life-threatening nosocomial or hospital-acquired infections in immunocompromised and critically ill patients worldwide, who are most at risk. The food chain is one of the main drivers of MDR transmission, as food is not sterile and can usually have microbiological contamination or become contaminated at certain stages of the food chain (i.e. cross-contamination, recontamination). Indeed, the food chain can act as a driver for MDR spread, enabling the survival or even multiplication of MDR pathogens. MDR transmission is not exclusive to foods of animal origin or fish; plant foods can also harbour MDR microorganisms, as vegetables can be contaminated during primary production by water contaminated with faecal material from wastewater from surrounding farms. In general, pathogens are not common in food and the main risk arises from the high prevalence of non-pathogenic microorganisms that can transfer AMR genes to other microbial species, including foodborne pathogens. It is well documented that genes encoding resistance are transferable between different bacteria in farm animals and also from them to bacteria in food and humans by horizontal gene transfer (i.e. transformation, conjugation and transduction).",False,2021-09-21T00:00:00,2026-01-08T08:25:40,1.75,19.0,"[923, 1044, 922, 1650]"
128,4,F-2022-275,Bioplastic as packaging material,"As the environmental impact of the growing tide of plastic in the oceans and on land becomes more apparent, scientists are scrambling to create alternatives to petroleum-based plastics. But it has proven tricky to make bioplastics that are cheap, strong, water-resistant and break down quickly when their use is over. The race for renewable plastics has led to bioplastics made from corn starch, sugar cane, potatoes, coffee grounds, food waste, algae and wood waste powder.",False,2022-01-07T00:00:00,2022-09-06T13:17:32,1.75,3.0,"[212, 632, 2156, 1844]"
64,3,F-2019-103,Milk substitutes made from cashews,"Vegan nutrition is in vogue. Companies are responding by creating new milk substitutes, including cashew nut-based ones. In Switzerland, cheese has been made from cashew nuts since 2015. 50 to 60 tonnes of organic cashews are imported from Vietnam every year. The cashew milk is processed raw and not pasteurised, only the ""ricotta"" and the products sold in the retail trade are thermised at 65 degrees to make them last longer. The concern here is that products are not necessarily pasteurised, especially as nuts can be contaminated by micro-organisms and/or pesticides. In many countries, nuts are harvested by hand and dried in the sun. Contamination can occur through insects, birds, rodents, but also through air and soil. Wet, humid conditions also pose a significant risk for the formation of aflatoxins. Nuts and seeds are known sources of <em>salmonella</em>, but <em>E. coli O157</em> can also be frequently detected.",True,2019-10-17T00:00:00,2024-09-05T16:25:10,1.67,14.0,"[76, 2433, 186]"
13,3,F-2018-029,<em>Cyclospora</em>,"<em>Cyclospora</em> infection is an intestinal disease caused by a unicellular parasite. Humans can be infected by the fecal-oral route; most commonly via contaminated water or food treated with it (such as salads, berries, herbs, etc.). In 2017 and 2018, several outbreaks occurred in the United Kingdom and the United States. In each of these outbreaks, numerous people fell ill. As a result, various food products were withdrawn from the market. International companies have also been affected. The list of outbreaks is long and seems to have been increasing in recent years.",True,2018-12-17T00:00:00,2026-01-13T07:43:39,1.33,22.0,"[615, 2465, 2014]"
