id,count,code,titel,kurzinfo,signal,erf_date,mut_date,mean_sterne,count_mut,meldung_ids
101,2,F-2021-147,<em>Streptococcus agalactiae </em>ST283 in fish,"<em>Streptococcus agalactiae</em> is a gram-positive bacterium that can cause various infectious diseases. Previously. the pathogen was mainly known to cause severe neonatal infections (e.g., neonatal sepsis), but now <em>S. agalactiae</em> has also been linked to food, specifically the consumption of raw fish. In 2015, there was a large outbreak of severe invasive infections in Singapore, predominantly septic arthritis and meningitis, which could be traced back to sequence type (ST)283 of<em> S. agalactiae.</em> Epidemiological investigations revealed that the consumption of raw freshwater fish (tilapia) was the trigger. Follow-up investigations used whole genome sequencing (WGS) to assess the prevalence of the bacterium more precisely. The result:<em> S. agalactiae</em> ST283 seems to have caused diseases in humans and farmed fish in Southeast Asia for decades. However, much remains unclear. If ST283 is transmitted exclusively from fish to humans, as was the case in the Singapore outbreak, then cases of<em> S. agalactiae </em>sepsis in Thailand and Laos are predominantly a food-borne disease. However, whether the transmission is from aquaculture to humans or vice versa, and whether there is an as yet unidentified reservoir, remains unknown. The germ could also be detected in tilapia from Brazil. Until now, the serotypes ST260 and ST927 were known in Brazil, but now ST283 also seems to be widespread. Based on import data of live tilapia from Singapore in 2014, a study suspects that the genotype was introduced into the country by the imported fish.",True,2021-05-18T00:00:00,2025-07-28T08:42:32,1.5,17.0,"[2653, 1658]"
183,2,F-2022-339,<em>Coxiella burnetii</em> increase in animal population,"Q fever is an acute disease caused by the bacterium <em>Coxiella burnetii</em>. The natural reservoir of the pathogen is cattle, sheep, goats, dogs, cats, some wild animals and ticks. Infected animals often show no symptoms, but excrete the pathogen mainly via birth products of farm animals (e.g. placenta), which are usually highly infectious, but also via faeces, urine or milk. In the majority of cases, infection in humans occurs through inhalation of dust containing the pathogen, but also through direct contact with infected animals. People who are in close contact with animals (animal owners, veterinarians, slaughterhouse employees, etc.) are particularly affected. Depending on the wind conditions, however, people in the immediate vicinity of infected animals can also become infected. In about half of the people infected, the infection causes no symptoms or only mild flu-like symptoms that disappear spontaneously. The other half experience sudden fever, chills, sweating, fatigue and headache, which can be complicated by inflammation of the lungs, liver, heart muscle or brain. Q fever is usually treated with antibiotics to prevent the disease from becoming chronic. Besides sporadic cases, outbreaks can also occur.<br>There is a steady increase of reported cases in the animal population since 2014 in Switzerland; cattle: 2014: 54; 2021: 131; Goat: 2014:3; 2021: 19; sheep 1; 2021:10). In 2020, a total of 51 human cases of Q fever were reported to the FOPH, which corresponds to a reporting rate of 0.6 new cases per 100,000 inhabitants. In the previous year, there were almost twice as many cases due to an outbreak, with 101 cases. The outbreak was most likely linked to two infected goat herds in Ticino. There is no similalr increase in the human population as observed in the animal population.",False,2022-03-31T00:00:00,2022-09-01T14:48:36,1.5,5.0,"[2582, 146]"
266,2,F-2024-014,Poor diet increases cancer risk - scientists uncover missing link,"A research team has unearthed new findings which may help explain the connection between cancer risk and poor diet, as well as common diseases like diabetes, which arise from poor diet. The insights gained from this study hold promise for advancing cancer prevention strategies aimed at promoting healthy aging. Poor diet can increase the risk of obesity, heart disease, type 2 diabetes, and some cancers. However, experts have not yet found any firm causative links between individual dietary components and cancer. A new study has discovered that <strong>methylglyoxal</strong> — which is produced when glucose is broken down in cells — may help explain the link between poor diet and cancer. They suggest that a long-term poor diet leads to an increase in the production of methylglyoxal, which switches off cancer-preventing genes, increasing cancer risk.",False,2024-04-23T07:23:40,2024-04-23T15:58:30,2.0,5.0,"[1870, 1311]"
46,2,F-2019-076,<em>Listeria innocua</em>,"<em>Listeria innocua</em> is commonly described as a non-pathogenic Listeria species. However, recent studies now show that various genetic elements are present that confer the characteristics of a pathogenic strain to<em> L. innocua</em>. In vitro and in vivo assays have shown that atypical haemolytic <em>L. innocua</em> is virulent, can actively cross the intestinal epithelium and can spread systemically to the liver and spleen, albeit to a lesser extent than the reference strain <em>L. monocytogenes</em> EGDe .<em></em>",False,2019-04-05T00:00:00,2022-09-12T15:54:10,2.5,3.0,"[195, 267]"
12,2,F-2018-028,Azole resistance in <em>Aspergillus spp.</em>,"Infections with <em>Aspergillus spp. </em>show a high morbidity and mortality rate in risk groups. Over 30 different species are responsible for this, but the species<em> Aspergillus fumigatus (A. fumigatus)</em> is the most common. Azoles, mainly triazoles, are used to prevent or treat <em>Aspergillus spp.</em> infections in humans and plants. Resistance of <em>Aspergillus</em> usually results from long-term treatments with triazoles. However,<em> A. fumigatus</em> has been isolated from patients who have never been treated with such drugs. It is therefore suspected that resistant strains spread in the environment. These strains may have acquired their resistance through the use of triazole-based fungicides. Azole resistance is therefore described as an emerging problem. In Germany, an increased number of <em>aspergilloses</em> have been observed in the last 5 years. In agriculture, resistance to <em>Aspergillus </em>also seems to be increasing, probably due to changes in cultivation techniques (minimum tillage) which may promote contamination and the growth of<em> Aspergillus.</em> Another risk is the emergence of cross-resistance. Studies have shown that resistant <em>Aspergillus spp.</em> are also resistant to medicinal azoles, emerging from fungicides.",True,2018-04-13T00:00:00,2024-09-05T16:22:19,1.0,16.0,"[218, 1977]"
24,2,F-2019-044,"Tick-borne encephalitis (TBE, syn. FSME)","TBE or tick-borne encephalitis (encephalitis = inflammation of the brain) is an infectious disease caused by the TBE virus. The virus is transmitted by the bite of an infected tick (Castor bean tick). This is the most significant way of transmitting the virus. An alimentary transmission by unpasteurised milk, or milk products from acutely infected goats or cattle was reported on and has been discussed repeatedly in the past. In Germany, two outbreaks, caused by alimentary transmissions, were detected in 2016 and 2017 respectively. TBE is a viral infection caused by one in three tick-borne <em>encephalitis virus</em> (TBEV) subtypes belonging to the <em>Flaviviridae</em> family: Central European, Siberian and Far Eastern (formerly known as Russian spring-summer encephalitis).",True,2019-01-30T00:00:00,2025-11-12T08:34:41,1.0,45.0,"[625, 1711]"
261,2,F-2024-009,<em>Helicobacter pullorum</em> and chicken meat,"<em>Helicobacter pullorum</em> belongs to the genus <em>Helicobacter </em>and it is a fastidious, microaerophilic, non-sporulated, and Gram-negative spirally curved motile bacillus with monopolar flagellae. It is bileresistant and requires a microaerobic environment supplemented with H2 in which growth occurs at 37 and 42 ◦C.  It belongs to the enterohepatic <em>Helicobacter</em> species (EHH) that colonize the host intestine and hepatobiliary system . <em>H. pullorum</em> naturally infects many poultry birds, some rodent species, and also humans. , it has been isolated from the feces of human patients with enteritis as well as healthy humans. <em>H. pullorum</em> is associated with several clinically significant infections in humans , such as colitis and hepatitis, inflammatory bowel disease, recurrent diarrhea, and bacteremia . <em>H. pullorum</em> is also thought to play an important role in the development of Crohn’s disease.  <em>Helicobacter pullorum</em> is an emerging foodborne pathogen that commonly colonizes the gastrointestinal tract of <strong>poultry</strong>, causing gastroenteritis.  The bacterium may be transmitted to humans through <strong>undercooked poultry meat</strong>.",False,2024-03-11T06:34:37,2024-03-12T09:33:43,2.0,4.0,"[536, 1203]"
79,2,F-2019-119,<em>Arcobacter spp</em>. in foods and water,"<em>Arcobacter butzleri</em>, recently renamed <em>Aliarcobacter butzleri comb. nov</em>., are aerotolerant <em>Campylobacter-like</em> organisms previously classified as <em>Campylobacter</em>. The genus<em> Arcobacter</em> was described in 1992. <em>A. butzleri</em> is found in environmental samples and untreated water appears to be a potential source of infection. In industrialised countries, the most important source of human contamination is food. Indeed, <em>A. butzleri </em>has been isolated in several farmed animals and is found in a variety of retail meats, including chicken, beef, pork, and lamb, with a high prevalence in poultry. Milk and dairy products may also be affected.<em> A. butzleri</em> colonises diverse and numerous ecological niches, such as water sources, ready-to-eat foods like vegetables, and food products of animal origin like meat, milk and cheese, fish and seafood. In addition, its survival and growth has been demonstrated in raw, pasteurised and UHT milk, and in the production and storage of ricotta cheese and artisanal water buffalo mozzarella cheese. These findings have led to <em>A. butzleri </em>being considered one of the emerging pathogens in milk and dairy products/environments of the 21st century (Fusco et al., 2020). Some <em>Arcobacter</em> species can cause gastrointestinal diseases in humans and animals. These are usually associated with abdominal pain and nausea, and watery diarrhoea but can also be asymptomatic. In general, a mild course of disease is observed in humans.",True,2019-10-23T00:00:00,2025-08-04T08:32:22,2.5,32.0,"[50, 1267]"
117,2,F-2021-233,Soybean oil - cause of neurological diseases,"The consumption of soybean oil has increased dramatically over the last fifty years and is associated with obesity and diabetes. To test the hypothesis that soybean oil diets alter hypothalamic gene expression in relation to metabolic phenotype, the research group below performed RNA sequencing analysis with male mice that were fed isocaloric, high-fat diets based on conventional soybean oil (high in linoleic acid, LA), a genetically modified low-LA soybean oil (plenish) and coconut oil (high in saturated fat, without LA). Both soybean oil diets had similar but not identical effects on the hypothalamic transcriptome, while the coconut oil diet had a negligible effect compared to a low-fat control diet. Dysregulated genes were associated with inflammation, neuroendocrine, neurochemical and insulin signalling. Oxt was the only gene with metabolic, inflammatory, and neurological relevance that was upregulated by both soybean oil diets compared to both control diets. Oxytocin immunoreactivity in the supraoptic and paraventricular nuclei of the hypothalamus was reduced, while plasma oxytocin and hypothalamic Oxt were increased. These central and peripheral effects of the soybean oil diet correlated with glucose intolerance but not with body weight. In the coconut oil diet enriched with stigmasterol, a phytosterol derived from soybean oil, changes in hypothalamic Oxt and plasma oxytocin were not observed. The research team discovered about 100 other genes that are also affected by the soybean oil diet. They believe that this discovery could have implications not only for the energy metabolism, but also for important brain functions and diseases such as autism and Parkinson's disease. However, it has been indicated that there is no evidence that the oil causes these diseases. Furthermore, the team noted that the findings only applied to soybean oil - not to other soy products or other vegetable oils.",True,2021-01-05T00:00:00,2024-01-30T11:39:52,1.0,15.0,"[687, 759]"
287,2,F-2025-004,Weight-Loss Drugs (GLP-1) - Impact on communication?,Efforts to expand access to <strong>anti-obesity drugs</strong> like Ozempic and Wegovy could be a lifesaver for millions of people around the world. But we must not confuse symptoms for the underlying pathology: a dysfunctional food system that is endangering health. Is there a possibility that efforts to <strong>communicate </strong>healthy eating are undermined?,True,2025-02-18T08:56:00,2025-09-15T14:35:27,1.5,13.0,"[1881, 2260]"
108,2,F-2021-195,Residues of veterinary drugs in groundwater,"Due to the intensification of food production in Europe, veterinary medicines have become a critical component in animal husbandry. The administration of these products can potentially lead to their presence in environmental waters such as groundwater, which is why they are now considered potential groundwater contaminants. In Ireland, several residues of anthelmintic and anticoccidial veterinary drugs have been detected in groundwater. 22% of 106 sampling sites detected residues of anthelmintics in the range of 1-41 ng/L and anticoccidials in the range of 1-390 ng/L. Residues were higher near intensive farming sites. These veterinary drug compounds are associated with a range of acute as well as chronic side effects, and their degradation products may have additional adverse effects.",True,2021-05-12T00:00:00,2024-11-05T08:53:57,1.0,19.0,"[1204, 1910]"
247,2,F-2023-030,<em>Sarcocystis</em> spp.,"Sarcocystis species are apicomplexan protozoan parasites with a worldwide distribution. Although more than 200 species have been described, sarcocystosis has been deemed as a neglected parasitic disease. The complete life cycle of most of different Sarcocystis spp. is still unknown, the collection of data on the occurrence of these protozoa in farm animals and foodstuffs is fragmented and the zoonotic risk of some Sarcocystis spp. has been poorly investigated. In this context, as Sarcocystis spp. are not included in the list of agents which have to be monitored on a mandatory basis (Directive  2003/99/EC), reports concerning the<a target=""_blank""></a> occurrence of these parasitic infections in European (EU) countries are scarce and difficult to analyse and interpret. . However, Sarcocystis spp. can be included within “other zoonoses” in the list of agents that have to be monitored based on the epidemiological situation of the different countries; therefore, inference on the real impact of these parasites on food safety and animal health remains to be elucidated. However, Sarcocystis spp. can be included within “other zoonoses” in the list of agents that have to be monitored based on the epidemiological situation of the different countries; therefore, inference on the real impact of these parasites on food safety and animal health remains to be elucidated.<!-- [if !supportAnnotations]--><!--[endif]--><!-- [if !supportAnnotations]--><!--[endif]--><!-- [if !supportAnnotations]--><!--[endif]--><!-- [if !supportAnnotations]--><a target=""_blank""></a><!--[endif]--><!-- [if !supportAnnotations]--><!--[endif]-->",False,2023-10-17T14:44:10,2026-01-21T07:32:20,1.0,10.0,"[874, 1570]"
71,2,F-2019-110,Nipah Virus (NiV),"The Nipah virus (NiV) can cause an often severe infection in humans and pigs. In rarer cases, infections in dogs, cats, ruminants or horses have also been detected. Guinea pigs and hamsters are also experimentally infectable. Reservoir hosts are fruit-eating fruit bats of the genus Pteropus, from which it can be passed on to other animals and humans. Infected animals and patients excrete the virus with respiratory secretions, saliva and urine. Contact with respiratory secretions is considered the main route of transmission in nosocomial infection. In the first NiV outbreak in 1998/99 in Malaysia and Singapore, transmission from fruit bats occurred via excreta or infected fruit ingested by pigs. Transmission from infected pigs to humans (285 infections with 105 deaths) occurred through direct contact with infected animals and their secretions (saliva, urine, blood). The virus can also be transmitted between humans.an approved vaccine or therapy to protect potentially exposed or infected humans or animals is not yet available.",False,2019-10-21T00:00:00,2026-01-09T07:23:41,1.0,10.0,"[269, 785]"
9,1,F-2018-025,Organosilicone surfactants,"Organosilicone surfactants (OSS) adjuvants are silicone-based copolymers with super –penetrating, -spreading and –wetting properties to potentiate the active ingredient against plant and animal pests and diseases. Over 700’000 tons of OSS are produced globally per year out of over 4.5 million tons of total of organosilicon production making this class of formulants the most widely used amongst all high-production chemicals for pollution worldwide. The metabolism and fate of OSS are almost unstudied on published literature. Toxic effects from OSS are observed in honeybees. Several recently published peer-reviewed journals on this topic highlight the safety concerns of organosilicone surfactant on humans and animals.",True,2018-12-19T00:00:00,2023-12-05T09:28:00,1.0,10.0,[121]
221,1,F-2023-004,Occurrence of mycotoxins (e.g. phomopsin) in pulses,"Pulses, dry grains of the Fabaceae family used for food and feed, are particularly important agricultural products with increasing commercial and nutritional relevance. Similar to other plant commodities, pulses can be affected by fungi in the field and during postharvest. Some of these fungi produce mycotoxins, which can seriously threaten human and animal health by causing acute poisoning and chronic effects.Phomopsins are a family of mycotoxins produced by the fungus <em>Diaporthe toxica</em> (formerly referred to as <em>Phomopsis leptostromiformis</em>). Lupins are the main host for the fungus, and infected stubble is the major source of animal exposure to phomopsins. Lupin seed is used in food and feed production, but the extent is poorly documented and data on the occurrence of phomopsins in lupin-based foods and feeds are limited.",False,2023-01-23T09:41:05,2026-01-21T07:32:19,2.0,6.0,[256]
214,1,F-2022-370,<strong>Alongshan-Virus (ALSV) </strong>,"The ALS virus, first discovered in China in 2017, is a member of the flavivirus family along with the TBE virus. After being bitten by ticks, several patients suffered from fever and headaches – the typical symptoms of a TBE infection. And yet, no antibodies against the TBE virus or its genetic material could be detected in the affected individuals. Instead, the researchers found a previously unknown RNA virus, the Alongshan virus. The complete gene sequence of ALS viruses was found in numerous tick samples collected in several regions of Switzerland in 2021 and 2022. “Surprisingly, ALS viruses were detected in the tick samples far more frequently than TBE viruses,” says Cornel Fraefel, director of the Institute of Virology. Since the symptoms of an infection with ALS viruses are similar to those of an infection with TBE viruses, the Alongshan virus could already pose a public health concern in Switzerland, albeit hitherto unrecognized. At present a possible transmission also via <strong>milk</strong>, like TBE, is not known.",False,2022-12-13T07:50:37,2024-07-05T07:13:45,3.0,12.0,[208]
6,1,F-2018-022,<em>Echinococcus multilocularis</em>,"<em>E. multilocularis </em>is ranked 7th in terms of public health consequences for France by Anses (French Agency for Food, Environment, Health and Safety at Work). The assessment is based on an incidence score of 1 (low) combined with a disease severity of 4 (very high): Between 2013 and 2015, 29 cases occurred in France, with a noticeable increase in cases in the regions along the Swiss border (Grand Est; Bourgogne-Franche-Comté and Auvergene-Rhône-Alpes). Positive findings in foxes are also found in the areas mentioned.In Germany, a national database for alveolar echinococcosis is being established. Further information and assessment of the risk can be found in the dissertation by <a href=""https://oparu.uni-ulm.de/xmlui/handle/123456789/4517"" target=""_blank"" rel=""noopener"">Schmidberger J. (2017)</a>. The main endemic area in Germany is in Baden-Würtemberg and Bavaria.The prevalence estimate for Germany in the period from 1992 to 2016 was 0.64 cases per 100,000 inhabitants, for Baden-Württemberg the estimated prevalence in the same period was 2.18 cases per 100,000 inhabitants and in Bavaria 1.48 cases per 100,000 inhabitants were observed in this period.",True,2018-05-23T00:00:00,2025-08-04T15:51:38,1.0,16.0,[1098]
245,1,F-2023-028,Is it safe to cook with essential oils?,"Essential oils, which are extracted from plants, are best known for their use in aromatherapy, a complementary health practice that involves inhaling the scents or mixing the oils with lotion or massage oil. There has been a growing interest in other uses for these oils, however, including using them for cooking. In addition to irritating and burning the tissues of the mouth and esophagus, consuming essential oils directly can cause seizures, hallucinations, and coma. A <a href=""https://onlinelibrary.wiley.com/doi/full/10.5694/mja2.50403"" target=""_blank"" data-component-name="""" rel=""noopener"">study published in 2019 in <em>The Medical Journal of Australia</em></a> reported that toxicity from ingesting essential oils is on the rise, and “increasing frequency and severity of essential oil poisonings have been reported in Europe and the United States. Some essential oils have been linked to adverse effects when ingested, even in tiny amounts. These are particularly: Eucalyptus Oil, Sage Oil, Wintergreen Oil.",True,2023-10-11T11:14:35,2024-06-24T07:29:33,0.0,16.0,[853]
185,1,F-2022-341,<em>Yersinia pseudotuberculosis</em> - tomatoes,"<em>Yersinia pseudotuberculosis</em> is an enteric pathogen causing mild enteritis that can lead to mesenteric adenitis and septicemia in elderly patients. Most cases are sporadic, but outbreaks have already been described in different countries. Savin et al.(2022) report for the first time a <em>Y. pseudotuberculosis</em> clonal outbreak in France, that occurred in 2020. An epidemiological investigation pointed towards the consumption of tomatoes as the likely source of contamination.",False,2022-04-20T00:00:00,2022-09-19T11:52:23,2.0,3.0,[1004]
47,1,F-2019-077,Organochlorines when heating sucralose,"When foods containing sucralose are heated above 120°C, harmful substances such as organochlorines (e.g., polychlorinated dibenzodioxins, dibenzofurans, chloropropanols) can be formed through dechlorination and decomposition. The sweetener sucralose (E955) was internationally deemed as safe within the framework of the authorisation of additives and will be re-evaluated by the EFSA by the end of 2020 at the latest. The current state of knowledge (see BfR 2019) on the stability of sucralose and the decomposition products formed during heating should be taken into account. There are still many data gaps on the identity and concentration concerning these substances and the exposure estimation, and the BfR ( German Federal Institute for Risk Assessment) was not able to make a conclusive risk assessment in its statement (2019). The question arises whether measures should be taken in the meantime.",True,2019-04-16T00:00:00,2024-11-19T07:13:42,1.0,11.0,[1632]
191,1,F-2022-347,Cheapflation in the food industry,"As inflation rises and consumer purchasing power falls, food manufacturers and retailers are trying to adapt to avoid eroding their margins.Cheapflation (or the lowering of food quality) consists of replacing certain products or foods with cheaper substitutes (food or not). The aim is obviously to maintain margins or sell more products. Examples abound on the internet and the Reddit site in particular echoes them. The most obvious example of cheapflation is that of certain ice creams now called 'frozen desserts', because the dairy products that made them up have been replaced by fillers.",False,2022-05-11T00:00:00,2025-02-26T09:11:57,1.0,4.0,[2020]
