id,count,code,titel,kurzinfo,signal,erf_date,mut_date,mean_sterne,count_mut,meldung_ids
181,1,F-2022-337,Safety of probiotics,"The microbiome affects the initiation and progression of cancerous tumours through direct effects on tumour cells, and indirectly through manipulation of the immune system. It can also determine the response to cancer therapies and predict disease progression and survival (Jain et al., 2021). There is vast literature on the beneficial effects of probiotics for the prevention and treatment of cancer. A review of the available literature on the subject was published in 2022. The authors conclude that probiotics have been shown to be effective against various types of cancer, but also that there is a need to evaluate the adverse effects of probiotics (gastrointestinal side effects, skin reactions, access to antibiotic resistance genes, harmful effects of metabolites, abnormal stimulation of the immune system) (Sankarapandian et al., 2022). Cancer patients have compromised immunity due to primary disease, chemotherapy, and radiotherapy. The effects of probiotics in this population may differ from those in healthy individuals and raise several critical issues (Lu et al., 2021). A new publication states that Lactobacillus can alter the function of immune cells (macrophages) in the pancreatic tumour environment and stimulate cancer growth (Hezaveh et al., 2022). The mechanism involves the metabolisation of dietary tryptophan by bacteria in the gut, which leads to an inactivation of immune cells involved in tumour control. This is not the only indication of potentially harmful effects of probiotic microorganisms, even independently of the presence of cancer. Among others:

Although probiotic bacteria are generally recognised as safe (GRAS status), there are several reports of side effects triggered by the presence of these organisms: systemic infections, impact on the immune system, disruption of metabolism and horizontal gene transfer (Zawistowska-Rojek and Tyski, 2018).
Brain fog syndrome has been reported to be related to probiotic use, with symptoms improving with antibiotics and probiotic discontinuation (Rao et al., 2018).
Fungemia and other fungal infections have been associated with the use of probiotic supplements based on Saccharomyces boulardii (Rannikko et al., 2021).
",True,2022-03-17T00:00:00,2025-10-09T09:14:53,1.0,41.0,[2118]
