id,count,code,titel,kurzinfo,signal,erf_date,mut_date,mean_sterne,count_mut,meldung_ids
95,26,F-2020-135,Ultraprocessed food,"Since 1980, scientific literature has reported on the links between the prevalence of certain health conditions and the high consumption of ultra-processed food (see NOVA Klassifikation for definition of ultraprocessed food). The increased consumption of this type of food may be responsible for the increase in incidence of many health conditions such as obesity, type 2 diabetes, hypertension, dyslipidaemia, loss of microbial diversity, dysbiosis, other inflammation-related diseases of the digestive system, increased risk of ischaemic heart disease, coronary heart disease and cancer. Ultra-processed foods have high energy density (energy per volume) and low nutrient density (nutrient per unit energy), making them nutritionally unbalanced. Additives are often used to improve shelf life and taste, and chemical contaminants can result from processing methods. Maximum permitted levels for food additives and contaminants are set to protect consumers, but their cumulative effects are largely unknown.",False,2020-01-06T00:00:00,2025-08-11T08:31:58,1.08,87.0,"[2105, 2147, 2199, 2223, 2217, 2354, 2396, 2298, 2448, 1978, 2575, 2347, 2283, 2545, 2197, 2483, 2590, 2141, 2385, 2445, 1969, 2001, 2059, 2224, 2371, 2540]"
233,4,F-2023-016,Social media and food safety risk,"Food and nutrition are popular topics in the media and on social networks. The ubiquity of social media has created new opportunities for qualified or accredited experts from the scientific community to connect with customers and the public. It has also created challenges. Health and wellness gurus, or self-proclaimed experts, use social media platforms to attract attention with compelling narratives, build an audience and influence public opinion by sharing (often) misleading information about food and nutrition. This can result in the perpetuation of misinformation, which not only undermines the proper functioning of democracy, but also diminishes support for science-based or evidence-based policies. In addition, ephemeral types of content that attract the attention of a large audience (trends) can quickly spread across major social media platforms and be replicated by more or less aware users. The use of social media can be both a threat and an opportunity for public health.",True,2023-03-13T13:01:19,2025-06-25T07:44:44,1.25,51.0,"[2192, 1935, 1922, 2179]"
147,4,F-2021-295,Plant-based substitutes - nutrients,"Milk is the main source of iodine in the UK; however, the consumption and popularity of plant-based milk alternatives is increasing. Consumers may be at risk of iodine deficiency as milk alternatives, unless fortified, have low iodine concentrations.Agroscope has also conducted a study on the nutritional quality of plant-based beverages. This revealed major differences in macro- and micronutrient composition compared to cow's milk. Many of the milk alternatives are therefore fortified with micronutrients.",False,2021-07-20T00:00:00,2024-02-26T08:33:16,1.0,10.0,"[1978, 1997, 2137, 2139]"
36,3,F-2019-056,Climate change and its impact on food safety,"Climate change is likely to have a considerable impact on food safety, both direct and indirect, putting public health at risk. With changing rainfall patterns and increases in extreme weather conditions and the annual average temperature, we will begin to face the impacts of climate change. These impacts will affect the persistence and occurrence of bacteria, viruses, parasites, harmful algae, fungi and their vectors, and the patterns of their corresponding food-borne diseases and risk of toxic contamination. Alongside these impacts, chemical residues of pesticides and veterinary medicines in plant and animal products will be affected by changes in pest pressure. The risk of food contamination with heavy metals and persistent organic pollutants following changes in crop varieties cultivated, cultivation methods, soils, redistribution of sediments and long-range atmospheric transport, is increased because of climate change. Climate-sensitive risk factors and illnesses will be among the largest contributors to the global burden of food-related disease and mortality, including malnutrition, communicable, non-communicable, and diarrheal- and vector-borne diseases.",False,2019-03-05T00:00:00,2025-12-23T07:35:09,1.0,49.0,"[1925, 2274, 2154]"
211,3,F-2022-367,Surrogate dairy products,"Vegan nutrition is very much in vogue. Companies are responding to this trend by developing new milk substitutes to replace drinking milk, butter and cheese. To date, there are various milk substitutes with very different compositions. The impact on food safety of foods derived from plants depends on the soil, the agricultural inputs used to grow the source plants, but also on how the plants are harvested, stored, transported and processed. The process engineering methods used to treat and process the proteins are then decisive (FAO, 2021). Plant-based dairy products generally have a greater variety of ingredients than animal products and therefore potentially offer a wide range of sources from which hazards can arise. Compared to dairy products, dairy substitutes occupy a niche position. However, according to the FOAG, their market share in the retail trade is steadily increasing, from 2.7 per cent in 2017 to 4.2 per cent in 2021. Although there are numerous products on the market, only generic approaches for risk assessment of such products can be found. Banach et al. (2022) provide a general overview of potential hazards of alternative proteins for milk substitutes, based on the different protein sources. It shows that such products may be contaminated with pathogens on the market or have led to outbreaks. At present, there are hardly any results from microbiological analyses (monitoring ring data) of such products.",False,2022-10-10T08:40:39,2025-01-31T07:19:58,1.0,42.0,"[1920, 2229, 1983]"
34,3,F-2018-054,Mycotoxins in foods,"Mycotoxins are metabolites formed from certain moulds. Mould – and hence mycotoxins – can form on vulnerable foods in warm and humid conditions, either whilst crops are still growing or post-harvest during storage, drying and transport. Most mycotoxins have toxic effects in humans, and some of the better characterised mycotoxins have regulatory limits in food. Certain foods are at particular risk. These include nuts and peanuts (primarily for aflatoxins) and raisins (primarily for ochratoxin A). Horizon Scan (a non-public database) has compiled a list of the most important products and has noted an increase in recalls. These findings are also supported by other stakeholders across the food chain (e.g., Biomin World Mycotoxin Survey 2018).",True,2018-12-11T00:00:00,2025-12-23T07:35:47,1.33,61.0,"[1923, 2282, 2450]"
238,2,F-2023-021,"The use of AI in nutrition, food production and food safety","The Global Food and Retail Managing director of British Standards International stressed during a Forum that there are three major areas of consideration where caution is needed regarding the use of Artificial Intelligence (AI) in food production. These are : bias and discriminations linked to the data used, privacy and security, and finally how AI-led world would impact people's lives.",False,2023-07-12T06:56:16,2025-11-10T08:35:26,1.0,68.0,"[2276, 2430]"
273,1,F-2024-021,Psychotropic Substances in Food – Legal Classification (Microdosing candies),"The Food and Drug Administration is investigating nearly 50 illnesses—including one possible death—that might be linked to microdosing candies available online and at retailers nationwide. These chocolate bars and gummies showed higher than normal amounts of muscimol, a chemical found in mushrooms of the genus amanita, wich could be a potential cause of symptoms consistent with those observed in persons who became ill after eating the products",True,2024-07-04T08:58:03,2025-10-09T09:13:25,1.0,33.0,[2070]
174,1,F-2021-326,Does palm oil promote the spread of cancer?,"Palm oil is obtained from the pulp of the palm fruit. The fruits are sterilised and pressed, resulting in the crude palm oil, CPO (Crude Palm Oil). Due to their high carotene content, fruits and oil have an orange-yellow to brown-red colour, which is removed during refining. Pure and fresh palm oil has a specific violet smell, a sweetish, pleasant taste and is clear and light in colour. Commercial oil, however, is usually cloudy and coloured due to less carefully executed preparation methods. The oil also becomes increasingly cloudy and has a more intense odour as it ages (Wikipedia). Fatty acid found in palm oil has been linked to the spread of cancer. Given that palm oil is in frequently used in our foods, this is a worrying report. The palmitic acid found in palm oil alters the genes of cancer cells and increases the likelihood of metastases forming.",False,2021-11-22T00:00:00,2022-09-19T09:18:26,1.0,3.0,[2326]
27,1,F-2019-047,Dietary supplements,"According to Menu CH, around 50% of Swiss people regularly consume food supplements containing vitamins, minerals, trace elements or other substances. The focus of this briefing note is primarily on food supplements containing plant extracts or endogenous substances (amino acids, coenzymes, etc.) in concentrated doses, which are notyet specifically regulated in Switzerland (see legal framework). Food supplements are foods and as such must be safe and not deceptive, they must also not be pharmacologically active. This responsibility primarily lies with the manufacturers/distributors within the framework of their self-regulation. As they are available as capsules, pills, powder, etc., the presentation of food supplements is similar to that of drugs; more concretely, they are sometimes advertised similarly to drugs namely, as improving health/quality of life or are at least perceived as such by consumers. On the internet, but also in supermarkets and health food shops, products are also offered as food supplements which are to be classified as non-approved novel foods or drugs. Novel foods and medicinal products undergo an official approval procedure in which their safety to health must be proven before they can be marketed. For the other food supplements, which are not considered novel foods, no approval procedure is required. Practice shows that the specifications of such products are often unclear and the toxicity (main substance, residual extracts, contaminants) is not clarified by experts. In literature, through nutrivigilance systems and through official warnings (e.g., from the US FDA), case studies of adverse effects, of up to serious liver or kidney damage are described (e.g., with certain green tea extracts), or also interactions with drugs taken simultaneously. The number of undesirable effects that go unnoticed is estimated to be high; as the effects are often not immediately visible and thus the causal connection to previous consumption goes unnoticed. Consumers do not necessarily consult a doctor or a poison control centre, and there is no nutrivigilance system in Switzerland.Legal framework Switzerland: Most important: General food law provisions on safety and protection against deception, VNem, Ordinance on Novel Food, certain plants and substances may not be used in food (VLpH and VZVM). No nutrivigilance system (unlike France), no notification legal framework EU: Largely non-harmonised. Certain countries have specific regulations (maximum quantities, plant lists), some notification, few countries with nutrivigilance systems.",True,2019-02-11T00:00:00,2024-06-11T07:55:09,1.0,18.0,[2487]
87,1,F-2019-127,Cyanide in foods,"Bitter apricot kernels, flax seeds, and cassava contain cyanogenic glycosides in comparatively high concentrations as natural plant constituents. Cyanide is released by the enzyme ss-glucosidase, which is also contained in the plants, when they are eaten. After ingestion of a correspondingly high dose, cyanides can lead to acute poisoning by blocking energy production.Bitter apricot kernels are of particular concern as they can lead to poisoning even in small amounts.The consumption of flax seeds is harmless to health if the common consumption recommendations of up to 15 g per meal are adhered to. According to the BfR (Federal Institute for Drugs and Medical Devices), there is no cyanide risk when eating marzipan and persipan.",False,2019-11-19T00:00:00,2022-09-01T15:36:30,1.0,3.0,[2636]
140,1,F-2021-287,Human gut microbiome,"The human gut microbiome is a diversified, resilient, immunostabilised, metabolically active and physiologically essential component of the human body. Scientific investigations have been conducted to explore detailed information on the establishment of the human gut microbiome, the functioning of the microbiome, the succession of the microbiome, factors influencing microbial community dynamics and the role of the gut microbiome in health and disease. Extensive research has suggested microbiome therapeutics as a futuristic medicine for various physiological and metabolic disorders. A comprehensive review of microbial colonisation, host-microbe interactions, microbial adaptation, commensal selection and immune survivability is still required to catalogue the essential genetic and physiological features for commensal engagement. The evolution of a structured human gut microbiome relies on microbial flexibility for genetic, immunological and physiological adaptation in the human gut. The key features for commensalism could be used in the development of a tailored microbiome-based therapy to overcome various physiological and metabolic disorders.The influence of the gut microbiome on human health has come increasingly into focus in recent years. The microbiome in the gut has an important function in the metabolism of food components and chemicals and also serves as a barrier against harmful effects from the environment. The microbiome is a highly diverse community of microorganisms and includes bacteria, archaea, eukaryotes, and viruses. Ongoing studies show that microbiome structure and dynamics can have both a direct (e.g., direct metabolic conversion of chemicals) and indirect (e.g., regulation of gut barrier function) impact on human and animal health. The microbiome structure and dynamics are in turn influenced by external influences, such as food or chemicals. There are now a number of studies showing an effect of additives such as artificial sweeteners or emulsifiers on the microbiome, often resulting in impaired glucose metabolism or gut inflammation (Laudisi et al. 2019, Roca-Saavedra et al. 2018). There is evidence from studies with mice that emulsifiers, for example, can disrupt gut homeostasis and lead to inflammation in the gut (Chassaing et al. 2015). Recent data also show that artificial sweeteners favour horizontal gene transfer in intestinal bacteria and thus promote the spread of antimicrobial resistance genes (Yu et al. 2021).",True,2021-11-16T00:00:00,2025-05-26T11:50:21,1.0,34.0,[2439]
222,1,F-2023-005,Protein supplements : effects of a (too) high protein diet,"""A high protein intake is great for losing weight, but it's also great for athletes."" With such and similar statements, the importance of proteins in the diet is advertised. At the same time, more and more ""high protein"" foods are available, which - as the name suggests - have a higher protein content than their conventional counterparts. Proteins are essential for many functions in the body. But what are the consequences if the recommended daily intake is chronically exceeded? People who follow this ""high protein"" trend are particularly affected.A chronic excess of protein can have negative consequences in the long term. However, these health risks are only discussed in the specialist literature; the general population is insufficiently informed about them. On the contrary, protein-enriched products are now widely available in shops, and big advertising campaigns by the industry promise health benefits thanks to these (expensive) trendy products. The lack of information about the possible negative effects of too much protein gives the false impression that the ""healthy"" amount of protein is unlimited, in the sense of ""if it doesn't help, it doesn't hurt"".Delimaris et al. (2013) conclude in their article that extra protein is not efficiently utilised by the body and can put a strain on the metabolism of bones, kidneys and liver. According to the authors, there is currently no reasonable scientific basis in the literature for recommending consumption above the RDA for healthy adults (= recommended daily allowance). Disorders of bone and calcium homeostasis, disorders of kidney function, increased risk of cancer, disorders of liver function and accelerated progression of coronary heart disease are mentioned as health risks associated with long-term intake of (too) much protein in humans. Barzel et al. (1998) also describe the effect of over-acidification of the body through excessive protein intake and the associated compensation through bone loss and thus calcium loss.In connection with protein diets for weight reduction, St. Jeor et al. (2001) write that there are no scientific long-term studies that prove the effectiveness and safety of such diets. High-protein diets even prevent the necessary requirements of important vitamins and minerals from being met due to the restriction of certain groups of nutrients. LM groups. Furthermore, there is a general risk - despite ""high protein"" - of a deficiency of essential amino acids if the biological value of the proteins is not taken into account and the foods are combined accordingly.  In summary, the excessive intake of proteins does not represent an acute danger for the Swiss population, but long-term damage is to be expected.",True,2023-01-27T13:00:59,2025-09-16T07:10:35,1.0,24.0,[2478]
51,1,F-2019-083,Surrogate meat and meat alternatives,"The consumption of meat is coming under heightened pressure, be that for religious, environmental or health reasons. Numerous publications have appeared on this topic. But what does this mean in terms of opportunities and risks in terms of food safety?Alternative protein sources, mostly not animal-based, are an upward trend. Increasing interest in vegetarian or vegan diets is only one reason for this development, concerns about the environmental and climate impacts of animal agriculture, as well as the question of how to feed a growing world population in the future, also support the search for alternative protein sources. Here are some examples: Moringa tree: a Thurgau-based company wants to extract protein from the leaves of the Moringa tree and use it for the food and feed industry. Interview in the Tagblatt. (April 2020). Algae directly consumed and processed. Insects directly consumed and processed. Fermentation: see ADURA ID 129 'Animal-free food'.",True,2019-05-27T00:00:00,2026-01-08T08:03:47,1.0,114.0,[2043]
287,1,F-2025-004,Weight-Loss Drugs (GLP-1) - Impact on communication?,Efforts to expand access to anti-obesity drugs like Ozempic and Wegovy could be a lifesaver for millions of people around the world. But we must not confuse symptoms for the underlying pathology: a dysfunctional food system that is endangering health. Is there a possibility that efforts to communicate healthy eating are undermined?,True,2025-02-18T08:56:00,2025-09-15T14:35:27,1.0,13.0,[2260]
148,1,F-2021-296,Food supplements - Nootropics,"The category of performance-enhancing food supplements has undergone a significant change in the last ten years. For a long time, the market was dominated by products that were intended to increase athletic performance (e.g. through building muscle).In recent years, however, another market segment has established itself, that of so-called nootropics (substances with an effect on the central nervous system). These nutraceuticals (traditional/herbal remedies, food supplements, functional food) focus on increasing cognitive performance. Thus, physical and, above all, mental performance is to be increased by these products.",False,2021-06-21T00:00:00,2022-09-15T11:39:44,1.0,3.0,[2299]
118,1,F-2020-236,Listeria monocytogenes Serovar 4h - hypervirulent,"Listeria monocytogenes is a ubiquitous foodborne pathogen that comprises 14 serotypes, of which serovar 4h is a novel serotype recently reported. Serovar 4h L. monocytogenes belonging to hybrid sub-lineage II exhibit hypervirulent features. L. monocytogenes is one of the deadliest foodborne pathogens known and there is presently concern that foodborne outbreaks are increasingly caused by hypervirulent isolates. The isolates described by Yin et al. (2019) are unique in several ways: (i) they are unable to ferment rhamnose that is one of the four identifying biochemical features of Lm, (ii) they exhibit a CAMP-positive phenotype, typically only seen with the species L. ivanovii, (iii) they possess distinct anionic surface structures defining the serotype 4h, (iv) they are the only known Lm to carry genomic segments characteristic of another species, viz., L. ivanovii, and (v) they are the most virulent representatives of this species known today.",False,2020-12-22T00:00:00,2022-09-12T16:08:04,1.0,4.0,[2013]
232,1,F-2023-015,Persistent Listeria monocytogenes strains in food environments,Specific Listeria monocytogenes (Lm) genotypes are adapted to meat and dairy processing environments. Genome analysis identified slaughterhouse as a Lm contamination source for meat processing facilities. Several events of Lm persistence over four years were identified in food processing facilities in Italy. Persistence seems not to be related to specific Lm genotypes.,False,2023-03-10T08:20:25,2025-08-19T08:51:20,1.0,42.0,[2013]
120,1,F-2021-238,Listeria monocytogenes serotyp 4b ST6 in cheese,"An outbreak of human listeriosis in Switzerland was attributed to persistent environmental contamination of a cheese factory with Listeria monocytogenes serotype 4b, sequence type 6, cluster type 7488. Whole genome sequencing was used to match clinical isolates with a cheese sample and with samples from numerous sites within the production environment.",False,2021-01-04T00:00:00,2024-10-17T06:54:42,1.0,11.0,[2013]
195,1,F-2022-351,Antibiotic resistance genes in agricultural soils,"Antibiotic resistance genes may be considered as environmental pollutants if anthropogenic emission and manipulations increase their prevalence above usually occurring background levels . The prevalence of aph(3')-IIa/nptII and aph(3')-IIIa/nptIII, frequent marker genes in plant biotechnology conferring resistance to certain aminoglycosides, was determined by Woegerbauer et al. (2015) in Austrian soils from 100 maize and potato fields not yet exposed to but eligible for GMO crop cultivation . Total soil DNA extracts were analysed by nptII/nptIII-specific TaqMan real time PCR. Of all fields, 6% were positive for nptII (median: 150 copies/g soil; range: 31-856) and 85% for nptIII (1190 copies/g soil; 13-61600). The copy-number, deduced prevalence of nptIII carriers, was 14-fold higher compared to nptII. Of the cultivable kanamycin-resistant soil bacteria, 1.8% (95% confidence interval: 0-3.3%) were positive for nptIII, none for nptII (0-0.8%). The nptII-load of the studied soils was low rendering nptII a typical candidate for environmental pollution upon anthropogenic release into these ecosystems.",False,2022-07-13T00:00:00,2024-01-11T06:39:19,1.0,12.0,[2118]
236,1,F-2023-019,Antimicrobial resistance genes in probiotic bacteria,"Antimicrobial resistance (AMR) is a major threat to public health. In bacteria, AMR depends on antibiotic resistance genes (ARGs), some of which are mobile and can transfer their ARGs to other bacteria. This action, known as horizontal gene transfer (HGT), involves the transfer of small fragments of DNA between bacteria and is facilitated by plasmids, among other things. If bacteria with mobile ARGs are found in food, they can transmit these ARGs to bacteria in the human digestive tract or to pathogens when ingested, contributing to the emergence of drug-resistant bacteria. Although the extent to which probiotics modulate the microbiome is disputed, it is possible that they contribute to the intestinal resistome by colonising the gut. A recent study conducted in Europe, analysing in detail probiotic bacterial species commonly used in certain foods (fermented and non-fermented) and dietary supplements, suggests that consumption of certain probiotic bacterial strains could contribute to the onset and spread of AMR, as in more than half of AGR-positive samples, at least one gene is linked to a plasmid. The results are consistent with another study concluding that the consumption of probiotic products can lead to the transfer of AGRs to human intestinal bacteria. Similarly, probiotics used to feed livestock can also cause antibiotic-resistant THG in animals. Animals treated with these resistant probiotics are likely to become a possible source of ARG for human consumers after ingestion of meat or dairy products.",True,2023-05-02T10:47:28,2025-10-09T09:07:44,1.0,20.0,[2118]
