id,count,code,titel,kurzinfo,signal,erf_date,mut_date,mean_sterne,count_mut,meldung_ids
95,3,F-2020-135,Ultraprocessed food,"Since 1980, scientific literature has reported on the links between the prevalence of certain health conditions and the high consumption of ultra-processed food (see NOVA Klassifikation for definition of ultraprocessed food). The increased consumption of this type of food may be responsible for the increase in incidence of many health conditions such as obesity, type 2 diabetes, hypertension, dyslipidaemia, loss of microbial diversity, dysbiosis, other inflammation-related diseases of the digestive system, increased risk of ischaemic heart disease, coronary heart disease and cancer. Ultra-processed foods have high energy density (energy per volume) and low nutrient density (nutrient per unit energy), making them nutritionally unbalanced. Additives are often used to improve shelf life and taste, and chemical contaminants can result from processing methods. Maximum permitted levels for food additives and contaminants are set to protect consumers, but their cumulative effects are largely unknown.",False,2020-01-06T00:00:00,2026-02-27T06:43:07,1.0,88,"[2792, 2791, 2780]"
25,1,F-2019-045,Insects for human consumption,The microbiological safety of insects approved for consumption is the subject of various studies. These products are relatively new on the market and corresponding experience is lacking.,False,2019-01-31T00:00:00,2025-07-07T06:37:16,1.0,27,[2795]
266,1,F-2024-014,Poor diet increases cancer risk - scientists uncover missing link,"A research team has unearthed new findings which may help explain the connection between cancer risk and poor diet, as well as common diseases like diabetes, which arise from poor diet. The insights gained from this study hold promise for advancing cancer prevention strategies aimed at promoting healthy aging. Poor diet can increase the risk of obesity, heart disease, type 2 diabetes, and some cancers. However, experts have not yet found any firm causative links between individual dietary components and cancer. A new study has discovered that methylglyoxal — which is produced when glucose is broken down in cells — may help explain the link between poor diet and cancer. They suggest that a long-term poor diet leads to an increase in the production of methylglyoxal, which switches off cancer-preventing genes, increasing cancer risk.",False,2024-04-23T07:23:40,2024-04-23T15:58:30,1.0,5,[2787]
233,1,F-2023-016,Social media and food safety risk,"Food and nutrition are popular topics in the media and on social networks. The ubiquity of social media has created new opportunities for qualified or accredited experts from the scientific community to connect with customers and the public. It has also created challenges. Health and wellness gurus, or self-proclaimed experts, use social media platforms to attract attention with compelling narratives, build an audience and influence public opinion by sharing (often) misleading information about food and nutrition. This can result in the perpetuation of misinformation, which not only undermines the proper functioning of democracy, but also diminishes support for science-based or evidence-based policies. In addition, ephemeral types of content that attract the attention of a large audience (trends) can quickly spread across major social media platforms and be replicated by more or less aware users. The use of social media can be both a threat and an opportunity for public health.",True,2023-03-13T13:01:19,2025-06-25T07:44:44,1.0,51,[2823]
239,1,F-2023-022,Helicobacter pylori in raw and ready-to-eat meat,"Helicobacter pylori, classified as a class-I carcinogen, is one of the leading medical pathogens of global concern associated mainly with the development of gastric adenocarcinomas and gastric mucosa-associated lymphoid tissue lymphomas; nevertheless, its prevalence in food especially meat and meat products is not fully covered. A study investigated the prevalence, molecular characterization, and antimicrobial resistance profiles of clarithromycin-, and metronidazole-resistant H. pylori isolated from raw and ready-to-eat meat samples retailed in Mansoura city, Egypt. The results showed a widespread contamination of examined raw and ready-to-eat meat product samples with multidrug-resistant H. pylori isolates, which could constitute a tremendous public health hazard.",True,2023-07-26T11:34:05,2026-03-26T09:20:34,2.0,43,[2781]
47,1,F-2019-077,Organochlorines when heating sucralose,"When foods containing sucralose are heated above 120°C, harmful substances such as organochlorines (e.g., polychlorinated dibenzodioxins, dibenzofurans, chloropropanols) can be formed through dechlorination and decomposition. The sweetener sucralose (E955) was internationally deemed as safe within the framework of the authorisation of additives and will be re-evaluated by the EFSA by the end of 2020 at the latest. The current state of knowledge (see BfR 2019) on the stability of sucralose and the decomposition products formed during heating should be taken into account. There are still many data gaps on the identity and concentration concerning these substances and the exposure estimation, and the BfR ( German Federal Institute for Risk Assessment) was not able to make a conclusive risk assessment in its statement (2019). The question arises whether measures should be taken in the meantime.",True,2019-04-16T00:00:00,2026-02-27T07:44:28,2.0,14,[2782]
265,1,F-2024-013,Functional drinks,"There are sodas made with mushrooms that supposedly improve mental clarity and juices packed with bacteria that claim to enhance digestive health. Water infused with collagen carries the promise of better skin, and energy drinks offer to help burn body fat. What started in the late 1980s with caffeine- and vitamin-laced energy drinks has grown into a multi-billion-dollar industry. Hundreds of brands are vying for consumers’ attention with increasingly exotic ingredients and wellness-focused marketing.",False,2024-04-22T12:14:50,2024-07-29T13:21:28,1.0,6,[2814]
