id,count,bezeichnung_de,bezeichnung_fr,bezeichnung_it,bezeichnung_en,mean_sterne,meldung_ids
67,1,Pflanzliche Öle,Huiles végétales,Oli vegetali,Vegetable Oils,1.0,[2548]
9,1,"Fische, Meeresfrüchte, Amphibien und Reptilien","Poissons, fruits de mer, amphibiens et reptiles","Pesce, crostacei, frutti di mare e anfibi","Fish, Shellfish And Amphibians",1.0,[2552]
55,1,Wild,Gibier,Selvaggina,Game,2.0,[2558]
81,1,"Kaffee, Tee, Frucht- und Kräutertee","Café, thé, tisane aux fruits et aux herbes","Caffè, tè, tè di frutti e di erbe","Coffee, Tea And Herbal Teas",1.0,[2551]
6,1,"Milch, Milchprodukte und Milchersatzprodukte","Laits, produits laitiers et substituts de lait","Latte, latticini e succedanei del latte",Dairy Products And Substitutes,1.0,[2593]
