id,count,bezeichnung_de,bezeichnung_fr,bezeichnung_it,bezeichnung_en,mean_sterne,meldung_ids
18,5,Diverse Lebensmittel,Aliments divers,Diverse derrate alimentari,Miscellaneous,1.4,"[2151, 2142, 2172, 2176, 2189]"
22,1,Nicht spezifizierte sowie gemischte Gemüse und Salate,Légumes et salades non spécifiés ou mélangés,Insalate e ortaggi misti non specificati,"Unclassified, Mixed Salad/Vegetables",1.0,[2140]
67,1,Pflanzliche Öle,Huiles végétales,Oli vegetali,Vegetable Oils,1.0,[2166]
48,1,"Teigwaren, Reis, andere Getreide und Körner","Pâtes alimentaires, riz, autres céréales et graines","Pasta, riso, altri cereali e grani","Pasta, Rice, Other Grain",1.0,[2180]
8,1,"Fleisch, Fleischprodukte und Fleischersatz","Viandes, produits à base de viande et substituts de viande","Carne, prodotti di carne e sostituti della carne","Meat, Meat Products And Substitutes",1.0,[2182]
7,1,"Getreide, Getreideprodukte und Körner",Céréales et produits céréaliers,Cereali e prodotti cereali,Cereals And Cereal Products,1.0,[2188]
