id,count,code,titel,kurzinfo,signal,erf_date,mut_date,mean_sterne,count_mut,meldung_ids
8,83,F-2018-024,Microplastics,"Microplastics are ubiquitous in various bodies of water. It is estimated that 4.8-12.7 million tonnes of plastic entered the oceans in 2010. Plastic pollution is classified as an emerging risk and poses a global threat to marine ecosystems. Various studies (and subsequent media reports) report contamination of microplastics in table salt and drinking water. The amounts vary, but there is agreement that microplastics are found in table salt in different countries. Inorganic and organic particles can adhere to microplastics, which are then absorbed by the human body through consumption of contaminated salt. In addition, various types of plastic contain plasticisers, which can have a negative impact on health.",True,2018-09-25T00:00:00,2025-11-12T07:00:52,1.41,64.0,"[68, 137, 183, 295, 310, 523, 680, 710, 745, 1280, 1225, 1316, 1215, 2284, 1845, 580, 1031, 1440, 2099, 1895, 2122, 2069, 2175, 2201, 2194, 2249, 2392, 2456, 2490, 325, 657, 1178, 779, 1547, 1586, 554, 1030, 1361, 1991, 2546, 1759, 1812, 1931, 2573, 49, 283, 768, 1889, 2121, 1992, 2086, 2348, 2389, 1885, 2417, 2476, 566, 720, 1008, 1079, 1277, 1342, 1291, 1477, 1500, 1740, 1701, 1921, 1767, 1362, 1427, 2495, 2148, 2232, 2331, 2533, 2543, 2037, 243, 1043, 1235, 1314, 2022]"
34,52,F-2018-054,Mycotoxins in foods,"Mycotoxins are metabolites formed from certain moulds. Mould – and hence mycotoxins – can form on vulnerable foods in warm and humid conditions, either whilst crops are still growing or post-harvest during storage, drying and transport. Most mycotoxins have toxic effects in humans, and some of the better characterised mycotoxins have regulatory limits in food. Certain foods are at particular risk. These include nuts and peanuts (primarily for aflatoxins) and raisins (primarily for ochratoxin A). Horizon Scan (a non-public database) has compiled a list of the most important products and has noted an increase in recalls. These findings are also supported by other stakeholders across the food chain (e.g., Biomin World Mycotoxin Survey 2018).",True,2018-12-11T00:00:00,2025-09-24T06:44:21,1.23,60.0,"[99, 107, 436, 636, 699, 1556, 682, 728, 726, 836, 869, 1132, 1171, 1529, 1562, 1675, 1890, 1923, 2066, 2186, 2213, 2282, 2450, 252, 218, 1463, 2090, 1787, 2017, 2176, 2350, 641, 1884, 2222, 2273, 2363, 2427, 2366, 1220, 1259, 1276, 1063, 1199, 1457, 1591, 1979, 2397, 2306, 2593, 1605, 1998, 2246]"
234,51,F-2023-017,PFAS in water and soils,"During the last 20 years, guideline values for Per- and polyfluoroalkyl substances (PFAS) in drinking water, surface waters, and soils have decreased dramatically due to new insights into their toxicity. As a result, levels in environmental media are now ubiquitously above guideline levels.",False,2023-03-15T08:32:44,2025-05-22T08:55:29,1.29,34.0,"[822, 1508, 623, 908, 721, 733, 1117, 1753, 1496, 1762, 1854, 1918, 2129, 2262, 2440, 2406, 366, 1236, 490, 552, 1015, 1725, 1806, 2372, 2398, 628, 1126, 1795, 390, 57, 852, 1011, 1634, 1878, 2151, 457, 416, 614, 953, 952, 1345, 2003, 2023, 2033, 2024, 2140, 2307, 2549, 2586, 556, 1713]"
83,32,F-2021-123,PFAS in food packaging,"Per- and polyfluorinated alkyl substances (PFAS) are industrial chemicals that are used in numerous industrial processes and consumer products, such as fire extinguishing materials. They are also popular in food packaging because the substances are water and fat repellent. However, in animal studies, some of them have been shown to be liver-damaging, toxic to reproduction and probably carcinogenic. PFAS are of particular concern because, unlike other common contaminants that pass quickly through the human body, they can linger for years and thus accumulate cumulatively. This property has given them the name ""forever chemicals"". PFASs can also enter the food chain through environmental pollution, for example when plants are supplied with contaminated water or grown in contaminated soil, such as near factories or places where products containing PFASs have been used for firefighting. From mid-2020, Denmark will be the first country to ban the use of all PFASs in food packaging.",False,2021-06-17T00:00:00,2024-10-08T08:29:00,1.44,49.0,"[284, 302, 313, 315, 721, 733, 742, 822, 908, 1753, 389, 2426, 552, 1015, 350, 246, 628, 1126, 1795, 390, 852, 931, 1239, 1878, 2151, 301, 277, 457, 952, 1345, 674, 170]"
21,24,F-2019-039,Nanoplastics,"Nanoplastics, the smaller fraction than microplastics, appear to be able to cross the blood-brain barrier in fish. It is therefore probably of greater human toxicological significance than microplastics.",False,2019-01-30T00:00:00,2025-11-06T09:49:22,1.58,15.0,"[137, 1215, 1031, 2175, 2193, 2408, 2456, 2513, 657, 1030, 81, 1885, 2358, 85, 720, 1008, 1342, 1477, 1951, 209, 2331, 2495, 2413, 2518]"
36,20,F-2019-056,Climate change and its impact on food safety,"Climate change is likely to have a considerable impact on food safety, both direct and indirect, putting public health at risk. With changing rainfall patterns and increases in extreme weather conditions and the annual average temperature, we will begin to face the impacts of climate change. These impacts will affect the persistence and occurrence of bacteria, viruses, parasites, harmful algae, fungi and their vectors, and the patterns of their corresponding food-borne diseases and risk of toxic contamination. Alongside these impacts, chemical residues of pesticides and veterinary medicines in plant and animal products will be affected by changes in pest pressure. The risk of food contamination with heavy metals and persistent organic pollutants following changes in crop varieties cultivated, cultivation methods, soils, redistribution of sediments and long-range atmospheric transport, is increased because of climate change. Climate-sensitive risk factors and illnesses will be among the largest contributors to the global burden of food-related disease and mortality, including malnutrition, communicable, non-communicable, and diarrheal- and vector-borne diseases.",False,2019-03-05T00:00:00,2025-09-08T13:38:04,1.3,47.0,"[636, 765, 1673, 1925, 1562, 2562, 218, 2325, 1085, 2573, 1715, 2321, 2273, 988, 989, 1338, 2183, 2383, 941, 1927]"
35,19,F-2019-055,Nanoparticles in foods,"Nanotechnology opens up new possibilities for the food industry to modulate various aspects of food. As a result, man-made nanoparticles are increasingly being used as functional ingredients in foods and beverages. They already serve a wide variety of purposes: they give chewing gum its white colour and keep instant coffee from clumping.As far as health concerns go, something is particularly questionable with regard to these substances: can the particles, due to their small size, penetrate barriers that are actually supposed to protect against intruders? An American study has shown that manganese oxide nanoparticles were able to penetrate the brain via the nose of test animals.Consumers are concerned about the possibly carcinogenic and in the long run harmful substances.On the other hand, the targeted use of nanoparticles for health promotion is being discussed. One study shows how nanoparticles can positively influence bacteria of the digestive tract. They speak of ""probiotic nanoparticles"". Nanoparticles are also already being used in pharmacy, for example to precisely transport substances to where they are needed.",True,2019-10-18T00:00:00,2025-07-11T06:41:30,1.37,23.0,"[137, 308, 887, 1041, 1882, 2189, 2169, 2313, 2503, 1586, 479, 147, 81, 2214, 85, 209, 488, 2413, 1893]"
51,16,F-2019-083,Surrogate meat and meat alternatives,"The consumption of meat is coming under heightened pressure, be that for religious, environmental or health reasons. Numerous publications have appeared on this topic. But what does this mean in terms of opportunities and risks in terms of food safety?Alternative protein sources, mostly not animal-based, are an upward trend. Increasing interest in vegetarian or vegan diets is only one reason for this development, concerns about the environmental and climate impacts of animal agriculture, as well as the question of how to feed a growing world population in the future, also support the search for alternative protein sources. Here are some examples: Moringa tree: a Thurgau-based company wants to extract protein from the leaves of the Moringa tree and use it for the food and feed industry. Interview in the Tagblatt. (April 2020). Algae directly consumed and processed. Insects directly consumed and processed. Fermentation: see ADURA ID 129 'Animal-free food'.",True,2019-05-27T00:00:00,2025-09-11T08:17:15,1.88,113.0,"[120, 591, 1395, 1159, 124, 1897, 2329, 967, 863, 1140, 1138, 1220, 989, 1373, 141, 1386]"
93,16,F-2021-133,"Cannabinoids CBD,CBG,CBN,Δ-8 THC in foods","Foods containing extracts of hemp or cannabinoids (such as CBD) represent the current trend in Switzerland (FSVO, leaflet). The product range containing CBD includes various product categories, which are mainly sold on the internet. CBD, unlike THC (tetrahydrocannabinol), is not subject to the Federal Act on Narcotics (BetmG, SR 812.121) because it has no similar psychoactive effect. However, cannabinoids and hemp extracts are essentially novel foods, which is why they cannot be added to food as one pleases. In the USA, for a long time, the FDA had classified CBD as GRAS ('generally recognised as safe'), i.e. as a food additive, the substance was deemed to be harmless. However, this classification has now been revised and the FDA warns of possible side effects, such as liver damage, interactions with other drugs, fatigue, diarrhea and mood swings. Cannabigerol (CBG) is - similar to CBD - a non-psychoactive cannabinoid found in various cannabis species. It has a relaxing effect but does not cause drowsiness; instead, it has an energising effect. CBG is thought to have medicinal potential, for example as an anti-inflammatory or when treating pain and nausea. However, cannabinoid research has not progressed enough to support the definitive treatment potential of cannabinoids. The FOPH writes: ""Regarding the effects attributed to CBD, research is still in its infancy and it is quite impossible to confirm or deny its effects and its usefulness for clinical practice. In general, it remains to be said that its efficacy is claimed to be more promising than what has been proven, but CBD is likely to be effective for certain symptoms and disorders"".In its 2019 European Food Trends Report, the GDI states that the market for 'drinkables' and 'edibles' - foods and beverages containing cannabis - is booming. Other cannabinoids are entering the market, such as cannabigerol (CBG) . CBD is the hype of the decade - according to New Food 2020 - but with the market for cannabidiol oversaturated in the U.S., product companies will introduce other cannabinoids such as cannabinol (CBN) and cannabigerol (CBG), which are said to have functional benefits regarding sleep and appetite manipulation. According to Food News, the FDA is expected to voice its concerns about these 'cannabis-derived compounds'. However, it is still expected that they will be marketed. Inquiries about this have already reached the FSVO. Since CBD is currently becoming a trend product and is offered in various forms (as drops, as food ingredient, in cosmetics, etc.), it is quite possible that other cannabinoids such as CBG will also become popular in the future. In Ireland, poisoning in children has occured 1) after the consumption of sweets (Ir Med J Vol. 2021 Vol.114, No. 8 p446). It is also suspected that synthetic cannabinoids were used. Hence, synthetic cannabinoids are likely to pose a new risk.",True,2021-07-19T00:00:00,2025-03-25T07:21:16,1.25,54.0,"[845, 467, 1672, 2247, 656, 1249, 32, 100, 353, 1169, 1636, 199, 519, 1176, 298, 838]"
95,10,F-2020-135,Ultraprocessed food,"Since 1980, scientific literature has reported on the links between the prevalence of certain health conditions and the high consumption of ultra-processed food (see NOVA Klassifikation for definition of ultraprocessed food). The increased consumption of this type of food may be responsible for the increase in incidence of many health conditions such as obesity, type 2 diabetes, hypertension, dyslipidaemia, loss of microbial diversity, dysbiosis, other inflammation-related diseases of the digestive system, increased risk of ischaemic heart disease, coronary heart disease and cancer. Ultra-processed foods have high energy density (energy per volume) and low nutrient density (nutrient per unit energy), making them nutritionally unbalanced. Additives are often used to improve shelf life and taste, and chemical contaminants can result from processing methods. Maximum permitted levels for food additives and contaminants are set to protect consumers, but their cumulative effects are largely unknown.",False,2020-01-06T00:00:00,2025-08-11T08:31:58,1.3,87.0,"[662, 1154, 1225, 2172, 1163, 2385, 1136, 1408, 1191, 825]"
86,10,F-2019-126,Mercury in permafrost,"New studies reveal that permafrost is the largest natural source of mercury on Earth - with mercury levels twice as high as all other soils, the ocean and the atmosphere combined. Climate warming threatens to melt this permafrost and gradually release mercury into the food chain. Mercury enters permafrost naturally, as part of the global mercury cycle, but also as a result of anthropogenic activities such as burning coal and petroleum. Once inorganic mercury is released, it can be converted by microbes into methylmercury, a potent neurotoxin. Eating fish from mercury-contaminated water therefore often leads to damage to the central nervous system and birth defects in humans. Released mercury can also enter the atmosphere and thus be distributed to other parts of the world, where it usually settles in rivers, lakes and seas.",True,2019-11-18T00:00:00,2024-10-18T07:04:04,1.1,66.0,"[533, 321, 1095, 1908, 273, 1715, 1772, 1022, 1927, 1913]"
188,7,F-2022-344,Trifluoroacetate (TFA) in water,"Trifluoroacetate (TFA) is a mobile and persistent substance that is primarily introduced into the water cycle through the degradation of various fluorochemicals and remains there for an unforeseeable period of time. There is already a high baseline load of TFA in many water bodies with some regional hotspots. This background paper presents current data and estimates on sources, input pathways, loads, impacts and measures on TFA. It gives an outlook on first activities and options to comprehensively minimise TFA inputs to the environment. Despite gaps in knowledge, it becomes clear that consistent regulation and an overarching minimisation strategy must be initiated in the short term.",False,2022-05-03T00:00:00,2025-07-24T07:51:40,1.29,9.0,"[1496, 1854, 2481, 2437, 2561, 2204, 2598]"
273,7,F-2024-021,Psychotropic Substances in Food – Legal Classification (Microdosing candies),"The Food and Drug Administration is investigating nearly 50 illnesses—including one possible death—that might be linked to microdosing candies available online and at retailers nationwide. These chocolate bars and gummies showed higher than normal amounts of muscimol, a chemical found in mushrooms of the genus amanita, wich could be a potential cause of symptoms consistent with those observed in persons who became ill after eating the products",True,2024-07-04T08:58:03,2025-10-09T09:13:25,1.57,33.0,"[1672, 2070, 1590, 2125, 1915, 1475, 2135]"
25,7,F-2019-045,Insects for human consumption,The microbiological safety of insects approved for consumption is the subject of various studies. These products are relatively new on the market and corresponding experience is lacking.,False,2019-01-31T00:00:00,2025-07-07T06:37:16,1.86,27.0,"[169, 1147, 1271, 1069, 2367, 1526, 1386]"
165,6,F-2022-316,Marine toxins: an emerging risk in Europe?,"Ciguatera is the most common form of marine biotoxin food poisoning in the world, with between 10,000 and 50,000 cases reported each year, a figure that is probably far from the reality. Ciguatera poisoning (CTXs) is endemic in tropical and subtropical areas, particularly in the Pacific and Caribbean (West Indies). Ciguatera is a complex syndrome with gastrointestinal, neurological and cardiovascular effects. The symptoms appear two to twelve hours after the contaminating meal. The question of a possible emergence of indigenous European cases is raised in view of the potential impact of climate change on the contamination of the food chain.",False,2022-07-21T00:00:00,2025-02-17T07:18:01,1.33,9.0,"[1097, 1783, 89, 722, 96, 2019]"
143,5,F-2021-291,Circular economy,"The Circular Economy (CE) is an approach that decouples economic activity from the consumption of finite resources, avoids waste, opposes the linear economic model of 'take-produce-consume-waste' and replaces it with an economic model based on sharing, leasing, reusing, repairing, refurbishing and recycling in an (almost) closed loop. Such a shift from a linear economy to a circular economy is expected to significantly support the achievement of the UN Sustainable Development Goals (SDGs), in particular SDG 12 (Responsible Consumption and Production). However, the design and implementation of the circular economy requires careful consideration of the numerous trade-offs that may arise. This is a prerequisite for achieving SDG 3 (Good health and well-being).In the transition to a circular economy, it will be crucial to identify potentially emerging risks to the environment and food and feed safety in a holistic and integrated manner in order to achieve an optimal balance between opportunities, benefits and risks. It is important to ensure that food and feed safety and environmental health considerations are included at an early stage of research or policy initiatives related to recycling and the circular economy.",False,2021-12-18T00:00:00,2024-10-14T08:57:22,1.6,7.0,"[247, 62, 1630, 1774, 2349]"
196,5,F-2022-352,PFOS in meat,"Perfluorooctanesulfonic acid (PFOS) (conjugate base perfluorooctanesulfonate) is an anthropogenic (man-made) fluorosurfactant, now regarded as a global pollutant. There is a major focus on PFOS hotspot contaminations in DK right now. During the spring and summer a site previously used for training fires and firefighting has been investigated. A field close to the site was used for grassing by cows owned by 20 families. Five cows each summer has been grassing there. PFOS is analysed in the meat at concentrations from 156 to 230 ng/g in four samples from four cows. Also grass was analyzed from the area up to 165 ng/g and water in the stream showed very high levels. The theory is that rainwater is running off in the direction of the field and the stream. So the cows have had the intake both from the water in the stream and from the grass. About 187 local consumers, that have eaten the meat through the years, have had the blood analyzed for PFOS. There are a big variation of PFOS in the blood. From 1,1 ng/ml up to 500 ng/ml. Doctors at the nearby hospital will follow the people who has high levels in the blood and try to help them. They will now try to use a type of cholesterol-lowering medicine that is thought to increase the secretion of PFOS. 145 other areas around DK, where use of PFOS has been going on, will now be investigated.",False,2022-07-13T00:00:00,2025-06-05T08:48:24,1.8,7.0,"[822, 1725, 58, 246, 1713]"
222,5,F-2023-005,Protein supplements : effects of a (too) high protein diet,"""A high protein intake is great for losing weight, but it's also great for athletes."" With such and similar statements, the importance of proteins in the diet is advertised. At the same time, more and more ""high protein"" foods are available, which - as the name suggests - have a higher protein content than their conventional counterparts. Proteins are essential for many functions in the body. But what are the consequences if the recommended daily intake is chronically exceeded? People who follow this ""high protein"" trend are particularly affected.A chronic excess of protein can have negative consequences in the long term. However, these health risks are only discussed in the specialist literature; the general population is insufficiently informed about them. On the contrary, protein-enriched products are now widely available in shops, and big advertising campaigns by the industry promise health benefits thanks to these (expensive) trendy products. The lack of information about the possible negative effects of too much protein gives the false impression that the ""healthy"" amount of protein is unlimited, in the sense of ""if it doesn't help, it doesn't hurt"".Delimaris et al. (2013) conclude in their article that extra protein is not efficiently utilised by the body and can put a strain on the metabolism of bones, kidneys and liver. According to the authors, there is currently no reasonable scientific basis in the literature for recommending consumption above the RDA for healthy adults (= recommended daily allowance). Disorders of bone and calcium homeostasis, disorders of kidney function, increased risk of cancer, disorders of liver function and accelerated progression of coronary heart disease are mentioned as health risks associated with long-term intake of (too) much protein in humans. Barzel et al. (1998) also describe the effect of over-acidification of the body through excessive protein intake and the associated compensation through bone loss and thus calcium loss.In connection with protein diets for weight reduction, St. Jeor et al. (2001) write that there are no scientific long-term studies that prove the effectiveness and safety of such diets. High-protein diets even prevent the necessary requirements of important vitamins and minerals from being met due to the restriction of certain groups of nutrients. LM groups. Furthermore, there is a general risk - despite ""high protein"" - of a deficiency of essential amino acids if the biological value of the proteins is not taken into account and the foods are combined accordingly.  In summary, the excessive intake of proteins does not represent an acute danger for the Swiss population, but long-term damage is to be expected.",True,2023-01-27T13:00:59,2025-09-16T07:10:35,1.4,24.0,"[1486, 1157, 263, 2478, 1917]"
242,5,F-2023-025,Sweet and acidic drinks: Risk of tooth erosion,"Consumption of energy drinks has been increasing dramatically in the last two decades, particularly amongst adolescents and young adults. Energy drinks are aggressively marketed with the claim that these products give an energy boost to improve physical and cognitive performance. However, studies supporting these claims are limited. In fact, several adverse health effects have been related to energy drink; this has raised the question of whether these beverages are safe.",True,2023-10-02T16:56:51,2025-03-07T08:39:36,1.2,21.0,"[833, 693, 747, 1431, 832]"
211,5,F-2022-367,Surrogate dairy products,"Vegan nutrition is very much in vogue. Companies are responding to this trend by developing new milk substitutes to replace drinking milk, butter and cheese. To date, there are various milk substitutes with very different compositions. The impact on food safety of foods derived from plants depends on the soil, the agricultural inputs used to grow the source plants, but also on how the plants are harvested, stored, transported and processed. The process engineering methods used to treat and process the proteins are then decisive (FAO, 2021). Plant-based dairy products generally have a greater variety of ingredients than animal products and therefore potentially offer a wide range of sources from which hazards can arise. Compared to dairy products, dairy substitutes occupy a niche position. However, according to the FOAG, their market share in the retail trade is steadily increasing, from 2.7 per cent in 2017 to 4.2 per cent in 2021. Although there are numerous products on the market, only generic approaches for risk assessment of such products can be found. Banach et al. (2022) provide a general overview of potential hazards of alternative proteins for milk substitutes, based on the different protein sources. It shows that such products may be contaminated with pathogens on the market or have led to outbreaks. At present, there are hardly any results from microbiological analyses (monitoring ring data) of such products.",False,2022-10-10T08:40:39,2025-01-31T07:19:58,1.2,42.0,"[119, 1556, 1920, 863, 1886]"
238,5,F-2023-021,"The use of AI in nutrition, food production and food safety","The Global Food and Retail Managing director of British Standards International stressed during a Forum that there are three major areas of consideration where caution is needed regarding the use of Artificial Intelligence (AI) in food production. These are : bias and discriminations linked to the data used, privacy and security, and finally how AI-led world would impact people's lives.",False,2023-07-12T06:56:16,2025-11-10T08:35:26,1.6,68.0,"[2315, 1472, 868, 2430, 2075]"
