id,count,code,titel,kurzinfo,signal,erf_date,mut_date,mean_sterne,count_mut,meldung_ids
136,1,F-2021-283,<em>Asparagopsis taxiformis</em> as a fodder,"Cows exhale the powerful greenhouse gas methane. One of the ways to limit methane emissions from cows is to feed them the seaweed<em> Asparagopsis taxiformis</em>. This seaweed contains high concentrations of bromoform, a substance that counteracts the formation of methane in the cow's rumen. Studies by Wageningen University &amp; Research show that bromoform can get into the cow's milk and urine. Bromoform in its pure form is harmful to health. There are limits to the maximum amount of bromoform in drinking water, but no such limits for food.",False,2021-05-12T00:00:00,2022-08-26T14:56:34,1.0,5.0,[2525]
297,1,F-2025-014,Lack of legal protection for whistleblowers is a <strong>significant barrier</strong> to effective food safety management,"The unsafe, illegal, and unethical practices, especially food fraud, by various actors along the food supply chain are old problems that have been made even more challenging by today’s international agri-food network. To combat these practices, the internal reporting to upper management or the external disclosure to regulators or media by persons who become aware of such practices is essential. These persons are colloquially known as whistleblowers. However, a number of impediments to whistleblowing, especially retribution by employers, have limited their contribution to ensuring the safety and integrity of the food supply.The absence or weakness of legal protection for whistleblowers directly undermines food safety management by discouraging individuals from reporting unsafe, illegal, or unethical practices within the food supply chain. <strong>Fear of retaliation, job loss, or legal consequences</strong> often prevents employees from coming forward, allowing food safety risks and fraud to persist undetected.",False,2025-11-13T07:12:59,2025-11-17T07:41:01,1.0,8.0,[2530]
75,1,F-2019-115,<em>Cyanobacteria</em>,"<em>Cyanobacteria</em> are microorganisms found mainly in eutrophic freshwaters, i.e. waters enriched with nutrients. While the impact of climate change has an impact on the spread of cyanobacteria, human activity, both urban and rural (fertiliser runoff, sewage, etc.) is also crucial. <em>Cyanobacteria</em> can release toxins some of which are very dangerous to humans. The main circumstances and routes of exposure to these toxins are ingestion of contaminated water, inhalation, or skin contact during recreational water activities (swimming, water sports). Consumption of fruits or vegetables irrigated with contaminated water or consumption of fish and shellfish can also be a source of exposure to cyanotoxins. The effects of cyanotoxins on human health are varied. Fever and gastrointestinal symptoms (nausea, vomiting) are most commonly reported, but eye or skin damage (irritation and rash), myalgia, liver and kidney damage are also often described. On the other hand, the involvement of these toxins in the development of chronic diseases, especially neurological diseases, remains the subject of scientific controversy.",True,2019-10-17T00:00:00,2025-10-08T07:15:13,2.0,36.0,[2026]
87,1,F-2019-127,Cyanide in foods,"Bitter apricot kernels, flax seeds, and cassava contain cyanogenic glycosides in comparatively high concentrations as natural plant constituents. Cyanide is released by the enzyme ss-glucosidase, which is also contained in the plants, when they are eaten. After ingestion of a correspondingly high dose, cyanides can lead to acute poisoning by blocking energy production.Bitter apricot kernels are of particular concern as they can lead to poisoning even in small amounts.The consumption of flax seeds is harmless to health if the common consumption recommendations of up to 15 g per meal are adhered to. According to the BfR (Federal Institute for Drugs and Medical Devices), there is no cyanide risk when eating marzipan and persipan.",False,2019-11-19T00:00:00,2022-09-01T15:36:30,1.0,3.0,[2636]
160,1,F-2021-309,Human milk donation and associated health risks,"In the absence of a lactarium in French-speaking Switzerland, young mothers give, sell, buy, or receive breast milk. There are platforms for these exchanges on social networks, but they do not seem to be supervised by health professionals. The journalist in this article raises the microbiological and toxicological risks that the failure to respect certain basic sanitary rules (use of medication and bacterial contamination by <em>Salmonella, Streptococcus, Staphylococcus</em>) may represent for breast milk and therefore for the newborn. In 2022, a first lactarium will be opened, it is possible that these platforms will or will not cease to exist, but the question concerning the professional supervision of this issue remains if they continue to exist.",False,2021-08-10T00:00:00,2023-01-13T15:13:17,1.0,8.0,[2330]
40,1,F-2019-060,<em>Cronobacter sakazakii</em>,"<em>Cronobacter sakazakii </em>is a motile, gram-negative, rod-shaped bacterium from the Enterobacteriaceae family. The bacterium has so far been detected in domestic environments and food production sites, in clinical sample material such as cerebrospinal fluid (CSF), blood or sputum, as well as in food (e.g., cheese, meat and vegetables) and animals (e.g., rats and flies). The bacterium <em>Cronobacter sakazakii </em>can cause life-threatening infections, especially in newborns. A Europe-wide study led by AGES has determined how frequently infections with this pathogen occur. In the process, 77 human<em> C. sakazakii</em> isolates from sick people from eleven European countries, of which 36 isolates were from 2017 and 41 isolates from the years before 2017, were evaluated by AGES.",False,2019-03-12T00:00:00,2025-10-13T10:26:01,1.0,10.0,[1974]
30,1,F-2019-050,Microalgae as food,"Algae have great potential as a new food source. They grow quickly, can be produced in a water-saving way and do not require fertile soil. They are rich in protein, high in omega-3 fatty acids and contain essential vitamins and minerals. They could one day replace meat and fish. Currently, chlorella and spirulina are the main food supplements on the market.",False,2019-02-22T00:00:00,2024-02-29T08:17:23,1.0,5.0,[2280]
25,1,F-2019-045,Insects for human consumption,The microbiological safety of insects approved for consumption is the subject of various studies. These products are relatively new on the market and corresponding experience is lacking.,False,2019-01-31T00:00:00,2025-07-07T06:37:16,1.0,27.0,[2367]
27,1,F-2019-047,Dietary supplements,"According to Menu CH, around 50% of Swiss people regularly consume food supplements containing vitamins, minerals, trace elements or other substances. The focus of this briefing note is primarily on food supplements containing plant extracts or endogenous substances (amino acids, coenzymes, etc.) in concentrated doses, which are notyet specifically regulated in Switzerland (see legal framework). Food supplements are foods and as such must be safe and not deceptive, they must also not be pharmacologically active. This responsibility primarily lies with the manufacturers/distributors within the framework of their self-regulation. As they are available as capsules, pills, powder, etc., the presentation of food supplements is similar to that of drugs; more concretely, they are sometimes advertised similarly to drugs namely, as improving health/quality of life or are at least perceived as such by consumers. On the internet, but also in supermarkets and health food shops, products are also offered as food supplements which are to be classified as non-approved novel foods or drugs. Novel foods and medicinal products undergo an official approval procedure in which their safety to health must be proven before they can be marketed. For the other food supplements, which are not considered novel foods, no approval procedure is required. Practice shows that the specifications of such products are often unclear and the toxicity (main substance, residual extracts, contaminants) is not clarified by experts. In literature, through nutrivigilance systems and through official warnings (e.g., from the US FDA), case studies of adverse effects, of up to serious liver or kidney damage are described (e.g., with certain green tea extracts), or also interactions with drugs taken simultaneously. The number of undesirable effects that go unnoticed is estimated to be high; as the effects are often not immediately visible and thus the causal connection to previous consumption goes unnoticed. Consumers do not necessarily consult a doctor or a poison control centre, and there is no nutrivigilance system in Switzerland.Legal framework Switzerland: Most important: General food law provisions on safety and protection against deception, VNem, Ordinance on Novel Food, certain plants and substances may not be used in food (VLpH and VZVM). No nutrivigilance system (unlike France), no notification legal framework EU: Largely non-harmonised. Certain countries have specific regulations (maximum quantities, plant lists), some notification, few countries with nutrivigilance systems.",True,2019-02-11T00:00:00,2024-06-11T07:55:09,1.0,18.0,[2136]
222,1,F-2023-005,Protein supplements : effects of a (too) high protein diet,"""A high protein intake is great for losing weight, but it's also great for athletes."" With such and similar statements, the importance of proteins in the diet is advertised. At the same time, more and more ""high protein"" foods are available, which - as the name suggests - have a higher protein content than their conventional counterparts. Proteins are essential for many functions in the body. But what are the consequences if the recommended daily intake is chronically exceeded? People who follow this ""high protein"" trend are particularly affected.A chronic excess of protein can have negative consequences in the long term. However, these health risks are only discussed in the specialist literature; the general population is insufficiently informed about them. On the contrary, protein-enriched products are now widely available in shops, and big advertising campaigns by the industry promise health benefits thanks to these (expensive) trendy products. The lack of information about the possible negative effects of too much protein gives the false impression that the ""healthy"" amount of protein is unlimited, in the sense of ""if it doesn't help, it doesn't hurt"".Delimaris et al. (2013) conclude in their article that extra protein is not efficiently utilised by the body and can put a strain on the metabolism of bones, kidneys and liver. According to the authors, there is currently no reasonable scientific basis in the literature for recommending consumption above the RDA for healthy adults (= recommended daily allowance). Disorders of bone and calcium homeostasis, disorders of kidney function, increased risk of cancer, disorders of liver function and accelerated progression of coronary heart disease are mentioned as health risks associated with long-term intake of (too) much protein in humans. Barzel et al. (1998) also describe the effect of over-acidification of the body through excessive protein intake and the associated compensation through bone loss and thus calcium loss.<br>In connection with protein diets for weight reduction, St. Jeor et al. (2001) write that there are no scientific long-term studies that prove the effectiveness and safety of such diets. High-protein diets even prevent the necessary requirements of important vitamins and minerals from being met due to the restriction of certain groups of nutrients. LM groups. Furthermore, there is a general risk - despite ""high protein"" - of a deficiency of essential amino acids if the biological value of the proteins is not taken into account and the foods are combined accordingly.  <br>In summary, the excessive intake of proteins does not represent an acute danger for the Swiss population, but long-term damage is to be expected.",True,2023-01-27T13:00:59,2025-09-16T07:10:35,1.0,24.0,[2478]
12,1,F-2018-028,Azole resistance in <em>Aspergillus spp.</em>,"Infections with <em>Aspergillus spp. </em>show a high morbidity and mortality rate in risk groups. Over 30 different species are responsible for this, but the species<em> Aspergillus fumigatus (A. fumigatus)</em> is the most common. Azoles, mainly triazoles, are used to prevent or treat <em>Aspergillus spp.</em> infections in humans and plants. Resistance of <em>Aspergillus</em> usually results from long-term treatments with triazoles. However,<em> A. fumigatus</em> has been isolated from patients who have never been treated with such drugs. It is therefore suspected that resistant strains spread in the environment. These strains may have acquired their resistance through the use of triazole-based fungicides. Azole resistance is therefore described as an emerging problem. In Germany, an increased number of <em>aspergilloses</em> have been observed in the last 5 years. In agriculture, resistance to <em>Aspergillus </em>also seems to be increasing, probably due to changes in cultivation techniques (minimum tillage) which may promote contamination and the growth of<em> Aspergillus.</em> Another risk is the emergence of cross-resistance. Studies have shown that resistant <em>Aspergillus spp.</em> are also resistant to medicinal azoles, emerging from fungicides.",True,2018-04-13T00:00:00,2024-09-05T16:22:19,1.0,16.0,[1977]
49,1,F-2019-081,Pyrrolizidine alkaloids,"Pyrrolizidine alkaloids (PA) are natural constituents that have been identified in more than 350 plant species worldwide and are suspected in more than 6,000. Plants produce them as defensive substances against predators. Of more than 660 known PAs and similar compounds, the 1,2-unsaturated PAs in particular have a potential to be harmful to health. They are therefore undesirable in feed and food. In food, PAs can occur above all in tea, honey, dried herbs and spices. Studies have shown that pollen products sold as food supplements (NEM) and used in apitherapy may also contain toxic PAs.",False,2019-10-28T00:00:00,2023-09-27T07:25:54,1.0,4.0,[2507]
180,1,F-2022-336,Nano coating of foods,"There is currently a lot of investment in research to develop new types of food packaging and a trend towards sustainable and also edible forms of packaging. Edible packaging is usually made of sustainable, biodegradable material. On the one hand, this includes packaging such as yoghurt pots that can be eaten, but also edible coatings that are placed around the food. In Switzerland, edible coatings of fruits and some vegetables are permitted, e.g. beeswax (E 901) as a coating for apples. Provided that the substances are approved as food additives for the respective food. What is new is that more and more packaging or coating agents are now being developed in nano form. Depending on the application, these are nanofibres, nanoparticles, nanoemulsions or even nanoencapsulations. A current example is the development of a nano-cellulose layer for fruits and vegetables, which is made from pomace (pressed out fruit and vegetable peels). The project is a collaboration between Lidl and researchers at EMPA. The reason for using nano-forms is manifold. Nano-form coatings allow thin edible layers on the food (about 5nm thickness). Coatings based on nanotechnology usually also allow better regulation of moisture in the food and better gas exchange for longer shelf life. In addition, nanocoatings can enable other functions such as the incorporation of so-called nanosensors in food, which indicate the spoilage of food (so-called ""smart packaging""). Various legal and health issues arise in the application. For example, in the case of the cellulose developed by EMPA, it is not clear whether the already approved coating agents (celluloses E 460-469) cover the newly developed cellulose or whether it would need a new approval. Secondly, there are questions about the toxicity of the nanoparticles through the consumption of the edible layers, which need to be carefully clarified before new nanoforms can be put on the market. A report by the RIVM in the Netherlands, for example, points out that specific risk assessments are needed for nanocellulose applications in the food sector, and that these might even have to be considered as novel foods. Retailers and Empa (Swiss Federal Laboratories for Materials Science and Technology) are researching protective cellulose coating for fruit and vegetable products. The innovative coating is made from so-called pomace (press residue) and in the future, is to be used for retailers' products. The innovative project can reduce packaging and avoid food waste. No fresh vegetables are to be used for the novel protective coating, only organic residues. At Empa's Cellulose &amp; Wood Materials lab, commissioned by a retailer, researchers developed a special protective cellulose layer that can be applied to fruit and vegetables within a year's time. The result: the coated fruits and vegetables stay significantly longer fresh. In tests, for example, the shelf life of bananas could be extended by more than a week.Other materials for alternative packaging and substitutes for plastics are being researched, including silk, for example.",True,2022-03-16T00:00:00,2024-09-05T10:59:16,1.0,30.0,[2004]
165,1,F-2022-316,Marine toxins: an emerging risk in Europe?,"Ciguatera is the most common form of marine biotoxin food poisoning in the world, with between 10,000 and 50,000 cases reported each year, a figure that is probably far from the reality. Ciguatera poisoning (CTXs) is endemic in tropical and subtropical areas, particularly in the Pacific and Caribbean (West Indies). Ciguatera is a complex syndrome with gastrointestinal, neurological and cardiovascular effects. The symptoms appear two to twelve hours after the contaminating meal. The question of a possible emergence of indigenous European cases is raised in view of the potential impact of climate change on the contamination of the food chain.",False,2022-07-21T00:00:00,2025-02-17T07:18:01,1.0,9.0,[2019]
128,1,F-2022-275,Bioplastic as packaging material,"As the environmental impact of the growing tide of plastic in the oceans and on land becomes more apparent, scientists are scrambling to create alternatives to petroleum-based plastics. But it has proven tricky to make bioplastics that are cheap, strong, water-resistant and break down quickly when their use is over. The race for renewable plastics has led to bioplastics made from corn starch, sugar cane, potatoes, coffee grounds, food waste, algae and wood waste powder.",False,2022-01-07T00:00:00,2022-09-06T13:17:32,2.0,3.0,[2156]
143,1,F-2021-291,Circular economy,"The Circular Economy (CE) is an approach that decouples economic activity from the consumption of finite resources, avoids waste, opposes the linear economic model of 'take-produce-consume-waste' and replaces it with an economic model based on sharing, leasing, reusing, repairing, refurbishing and recycling in an (almost) closed loop. Such a shift from a linear economy to a circular economy is expected to significantly support the achievement of the UN Sustainable Development Goals (SDGs), in particular SDG 12 (Responsible Consumption and Production). However, the design and implementation of the circular economy requires careful consideration of the numerous trade-offs that may arise. This is a prerequisite for achieving SDG 3 (Good health and well-being).<br>In the transition to a circular economy, it will be crucial to identify potentially emerging risks to the environment and food and feed safety in a holistic and integrated manner in order to achieve an optimal balance between opportunities, benefits and risks. It is important to ensure that food and feed safety and environmental health considerations are included at an early stage of research or policy initiatives related to recycling and the circular economy.",False,2021-12-18T00:00:00,2024-10-14T08:57:22,1.0,7.0,[2349]
148,1,F-2021-296,Food supplements - Nootropics,"The category of performance-enhancing food supplements has undergone a significant change in the last ten years. For a long time, the market was dominated by products that were intended to increase athletic performance (e.g. through building muscle).<br>In recent years, however, another market segment has established itself, that of so-called nootropics (substances with an effect on the central nervous system). These nutraceuticals (traditional/herbal remedies, food supplements, functional food) focus on increasing cognitive performance. Thus, physical and, above all, mental performance is to be increased by these products.",False,2021-06-21T00:00:00,2022-09-15T11:39:44,1.0,3.0,[2299]
227,1,F-2023-010,Irrigation with wastewater,"As climatic changes are increasing the pressure on water resources and more fresh fruits and vegetables are needed to meet the demands of a growing population, growers may need to start depending on more varied sources of water for irrigation, including environmental, recycled, and reclaimed wastewaters. Additionally, the wastewater draining from massive pools of sewage sludge has the potential to play a role in more sustainable agriculture (Science of The Total Environment, 20.01.2023). However, this practice is not without risks as some of some of these wastewater sources might be susceptible to contamination with microbial pathogensFor instance, surveys have found <em>Listeria monocytogenes</em> in water, soil, vegetation, and farm animal feces around the world. The frequency at which this pathogen is present in water sources is dependent on multiple factors, including the season, surrounding land use, presence of animals, and physicochemical water parameters. Understanding the survival duration of <em>L. monocytogenes </em>in specific water sources is important, but studies are limited concerning this environment and the impact of these highly variable factors. Understanding the pathogen’s ability to remain infectious is key to understanding how <em>L. monocytogenes</em> impacts produce outbreaks and, ultimately, consumers’ health.Moreover, the German federal institute for risk assessment (BfR) has published a risk assessment of transmission of <em>Cryptosporidium </em>spp., <em>Giardia duodenalis</em> and <em>Toxoplasma gondii </em>to humans related to using reclaimed wastewater in agriculture where they recommend to only use irrigation water of a quality comparable to drinking water for watering plants that are usually consumed raw.",True,2023-02-28T11:35:21,2025-07-24T07:08:52,1.0,32.0,[2243]
250,1,F-2023-033,Dimethylated Thioarsenates in rice,"Arsenic (As) occurrence in rice is a serious human health threat. Worldwide, regulations typically limit only carcinogenic inorganic As, but not possibly carcinogenic dimethylated oxyarsenate (DMA). However, there is emerging evidence that “DMA”, determined by routine acid-based extraction and analysis, hides a substantial share of dimethylated thioarsenates that have similar or higher cytotoxicities than arsenite. Risk assessments characterizing the in vivo toxicity of rice-derived dimethylated thioarsenates are urgently needed. In the meantime, either more sophisticated methods based on enzymatic extraction and separation of dimethylated oxy- and thioarsenates have to become mandatory or total As should be regulated.Since the publication of the 2009 EFSA opinion on arsenic in food new studies have become available on the toxic effects of organic arsenic. Furthermore it has become clear that dimethylmonothioarsenate (DMMTA) is formed from methyl arsenate due to the application of sulphate fertilisers, and that this substance could be more toxic than methylarsenate. It is therefore appropriate to update the hazard identification and characterisation of organic arsenic. On the basis of the available occurrence data for organic arsenic or literature information on organic arsenic in food, the exposure could be estimated in order to carry out an assessment for the risks for human health related to organic arsenic in food. In view of different properties of the methylated arsenic species, arsenobetaine, arsenolipids and arsenosugars, it is appropriate to assess the organic arsenic species in 2 separate opinions: an opinion on methylated arsenic species and an opinion on arsenobetaine, arsenolipids and the arsenosugars, which should also include any other possible organic arsenic species. After finalising the risk assessments on inorganic and organic arsenic, also the combined exposure to inorganic and organic arsenic should be assessed (source: <a href=""https://open.efsa.europa.eu/questions/EFSA-Q-2021-00496"" target=""_blank"" rel=""noopener"">Open EFSA (europa.eu)</a>)",False,2023-11-09T07:40:13,2024-01-23T07:04:35,1.0,9.0,[2180]
267,1,F-2024-015,Avian flu: WHO warns of a high concentration of the HPAI (H5N1) virus in milk from contaminated cows,"The World Health Organization (WHO) has reported 889 human cases of <strong>avian flu</strong> in 23 countries between 2023 and April 1, 2024, with a <strong>case fatality</strong> rate of <strong>52%</strong>. Traces of the H5N1 virus were found in <strong>cow's milk</strong> in the United States, prompting the WHO to recommend the <strong>consumption of pasteurized milk</strong> and to conduct studies on the virus's survival in milk. The virus has been found to spread to mammals, including cows and goats, and there has been a case of cow-to-human transmission in Texas. While human infections remain rare and there is no evidence of human-to-human transmission, health officials are concerned about the potential for the virus to mutate and spread more easily among humans.",False,2024-04-25T08:27:48,2026-01-21T07:14:20,2.0,80.0,[2566]
