id,count,code,titel,kurzinfo,signal,erf_date,mut_date,mean_sterne,count_mut,meldung_ids
8,2,F-2018-024,Microplastics,"Microplastics are ubiquitous in various bodies of water. It is estimated that 4.8-12.7 million tonnes of plastic entered the oceans in 2010. Plastic pollution is classified as an emerging risk and poses a global threat to marine ecosystems. Various studies (and subsequent media reports) report contamination of microplastics in table salt and drinking water. The amounts vary, but there is agreement that microplastics are found in table salt in different countries. Inorganic and organic particles can adhere to microplastics, which are then absorbed by the human body through consumption of contaminated salt. In addition, various types of plastic contain plasticisers, which can have a negative impact on health.",True,2018-09-25T00:00:00,2026-03-04T07:58:33,1.5,69,"[2789, 2783]"
25,1,F-2019-045,Insects for human consumption,The microbiological safety of insects approved for consumption is the subject of various studies. These products are relatively new on the market and corresponding experience is lacking.,False,2019-01-31T00:00:00,2025-07-07T06:37:16,1.0,27,[2795]
36,1,F-2019-056,Climate change and its impact on food safety,"Climate change is likely to have a considerable impact on food safety, both direct and indirect, putting public health at risk. With changing rainfall patterns and increases in extreme weather conditions and the annual average temperature, we will begin to face the impacts of climate change. These impacts will affect the persistence and occurrence of bacteria, viruses, parasites, harmful algae, fungi and their vectors, and the patterns of their corresponding food-borne diseases and risk of toxic contamination. Alongside these impacts, chemical residues of pesticides and veterinary medicines in plant and animal products will be affected by changes in pest pressure. The risk of food contamination with heavy metals and persistent organic pollutants following changes in crop varieties cultivated, cultivation methods, soils, redistribution of sediments and long-range atmospheric transport, is increased because of climate change. Climate-sensitive risk factors and illnesses will be among the largest contributors to the global burden of food-related disease and mortality, including malnutrition, communicable, non-communicable, and diarrheal- and vector-borne diseases.",False,2019-03-05T00:00:00,2026-01-19T07:21:22,2.0,51,[2784]
47,1,F-2019-077,Organochlorines when heating sucralose,"When foods containing sucralose are heated above 120°C, harmful substances such as organochlorines (e.g., polychlorinated dibenzodioxins, dibenzofurans, chloropropanols) can be formed through dechlorination and decomposition. The sweetener sucralose (E955) was internationally deemed as safe within the framework of the authorisation of additives and will be re-evaluated by the EFSA by the end of 2020 at the latest. The current state of knowledge (see BfR 2019) on the stability of sucralose and the decomposition products formed during heating should be taken into account. There are still many data gaps on the identity and concentration concerning these substances and the exposure estimation, and the BfR ( German Federal Institute for Risk Assessment) was not able to make a conclusive risk assessment in its statement (2019). The question arises whether measures should be taken in the meantime.",True,2019-04-16T00:00:00,2026-02-27T07:44:28,2.0,14,[2782]
34,1,F-2018-054,Mycotoxins in foods,"Mycotoxins are metabolites formed from certain moulds. Mould – and hence mycotoxins – can form on vulnerable foods in warm and humid conditions, either whilst crops are still growing or post-harvest during storage, drying and transport. Most mycotoxins have toxic effects in humans, and some of the better characterised mycotoxins have regulatory limits in food. Certain foods are at particular risk. These include nuts and peanuts (primarily for aflatoxins) and raisins (primarily for ochratoxin A). Horizon Scan (a non-public database) has compiled a list of the most important products and has noted an increase in recalls. These findings are also supported by other stakeholders across the food chain (e.g., Biomin World Mycotoxin Survey 2018).",True,2018-12-11T00:00:00,2026-02-17T08:01:32,1.0,64,[2794]
273,1,F-2024-021,Psychotropic Substances in Food – Legal Classification (Microdosing candies),"The Food and Drug Administration is investigating nearly 50 illnesses—including one possible death—that might be linked to microdosing candies available online and at retailers nationwide. These chocolate bars and gummies showed higher than normal amounts of muscimol, a chemical found in mushrooms of the genus amanita, wich could be a potential cause of symptoms consistent with those observed in persons who became ill after eating the products",True,2024-07-04T08:58:03,2025-10-09T09:13:25,1.0,33,[2802]
