id,count,code,titel,kurzinfo,signal,erf_date,mut_date,mean_sterne,count_mut,meldung_ids
271,1,F-2024-019,Potential hazards associated with new species of freshwater molluscs,"New species, whether invasive or newly imported, are appearing in Switzerland. This goes hand in hand with the emergence of new trendy recipes or harvests. As these shellfish are not well known, they could harbour new pathogens and become a new threat to the population. For instance, in a study conducted in China, C. perfringens from aquatic source showed a high isolation rate, notably in cooked clams. C. perfringens toxin type G in clams was detected for the first time and the toxin genes cpb, cpe, and netB were detected for the first time in cooked clams.  The average antibiotic resistance rates of the strains to tetracycline, clindamycin, and ampicillin were 45 %, 20 %, and 16 % respectively.",True,2024-07-02T16:34:32,2024-09-05T10:29:17,3.0,11.0,[1477]
215,1,F-2022-371,Impact of rising gas prices on CO2 availability and electricity used in food industry,"There is likely to be a shortage of CO2 throughout Europe over the next months, which is likely to have an impact on the food and beverage industry. This appears to be arising due to reductions in fertiliser manufacture (due to gas price increases) of which carbon dioxide is a by-product. This fact sheet will highlight the food safety issues which may arise as food business operators try to manage their CO2 and electricity supply. CO2 is a gas that is used extensively in the food and beverage industry for a variety of food purposes, such as adding bubbles to beer and soft drinks, drinks dispensing systems, livestock stunning gas and extension of shelf-life of foods with modified atmosphere packaging (MAP). The potential impact of the sharp increase in electricity prices and possible supply shutdowns on food safety are also discussed.

Potential issues emerging from a reduction in CO2 availability: I. Shelf life , II.Animal welfare, III.Product ranges , IV.Risks from Alternative Gases
Potential issues to emerge from the increased price of electricity: I.Cold stores, II.FBOs businessess,  III. Cleaning, IV. Cooling, V. Drying   
",False,2022-12-19T11:26:32,2024-01-19T10:37:13,1.0,6.0,[943]
196,1,F-2022-352,PFOS in meat,"Perfluorooctanesulfonic acid (PFOS) (conjugate base perfluorooctanesulfonate) is an anthropogenic (man-made) fluorosurfactant, now regarded as a global pollutant. There is a major focus on PFOS hotspot contaminations in DK right now. During the spring and summer a site previously used for training fires and firefighting has been investigated. A field close to the site was used for grassing by cows owned by 20 families. Five cows each summer has been grassing there. PFOS is analysed in the meat at concentrations from 156 to 230 ng/g in four samples from four cows. Also grass was analyzed from the area up to 165 ng/g and water in the stream showed very high levels. The theory is that rainwater is running off in the direction of the field and the stream. So the cows have had the intake both from the water in the stream and from the grass. About 187 local consumers, that have eaten the meat through the years, have had the blood analyzed for PFOS. There are a big variation of PFOS in the blood. From 1,1 ng/ml up to 500 ng/ml. Doctors at the nearby hospital will follow the people who has high levels in the blood and try to help them. They will now try to use a type of cholesterol-lowering medicine that is thought to increase the secretion of PFOS. 145 other areas around DK, where use of PFOS has been going on, will now be investigated.",False,2022-07-13T00:00:00,2024-09-04T06:40:26,1.0,6.0,[1713]
