id,count,code,titel,kurzinfo,signal,erf_date,mut_date,mean_sterne,count_mut,meldung_ids
8,30,F-2018-024,Microplastics,"Microplastics are ubiquitous in various bodies of water. It is estimated that 4.8-12.7 million tonnes of plastic entered the oceans in 2010. Plastic pollution is classified as an emerging risk and poses a global threat to marine ecosystems. Various studies (and subsequent media reports) report contamination of microplastics in table salt and drinking water. The amounts vary, but there is agreement that microplastics are found in table salt in different countries. Inorganic and organic particles can adhere to microplastics, which are then absorbed by the human body through consumption of contaminated salt. In addition, various types of plastic contain plasticisers, which can have a negative impact on health.",True,2018-09-25T00:00:00,2026-01-15T07:15:46,1.1,66.0,"[2284, 2099, 2122, 2069, 2175, 2201, 2194, 2249, 2392, 2456, 2490, 2573, 2601, 1991, 2546, 2121, 1992, 2086, 2348, 2389, 2417, 2476, 2495, 2148, 2232, 2331, 2533, 2543, 2037, 2022]"
34,21,F-2018-054,Mycotoxins in foods,"Mycotoxins are metabolites formed from certain moulds. Mould – and hence mycotoxins – can form on vulnerable foods in warm and humid conditions, either whilst crops are still growing or post-harvest during storage, drying and transport. Most mycotoxins have toxic effects in humans, and some of the better characterised mycotoxins have regulatory limits in food. Certain foods are at particular risk. These include nuts and peanuts (primarily for aflatoxins) and raisins (primarily for ochratoxin A). Horizon Scan (a non-public database) has compiled a list of the most important products and has noted an increase in recalls. These findings are also supported by other stakeholders across the food chain (e.g., <a href=""https://www.biomin.net/en/articles/biomin-world-mycotoxin-survey-report-2018/"" target=""_blank"" rel=""noopener"">Biomin World Mycotoxin Survey 2018</a>).",True,2018-12-11T00:00:00,2025-12-23T07:35:47,1.19,61.0,"[2066, 2186, 2213, 2282, 2450, 2631, 2090, 2017, 2176, 2350, 2222, 2273, 2363, 2427, 2366, 1979, 2397, 2306, 2593, 1998, 2246]"
234,17,F-2023-017,PFAS in water and soils,"During the last 20 years, <strong>guideline values </strong>for Per- and polyfluoroalkyl substances (<strong>PFAS</strong>) in <strong>drinking water</strong>, <strong>surface waters</strong>, and soils have <strong>decreased dramatically</strong> due to new insights into their toxicity. As a result, levels in environmental media are now <strong>ubiquitously above guideline levels</strong>.",False,2023-03-15T08:32:44,2025-05-22T08:55:29,1.29,35.0,"[2129, 2262, 2440, 2406, 2372, 2398, 2605, 2586, 2151, 2003, 2023, 2033, 2024, 2140, 2307, 2549, 2602]"
21,10,F-2019-039,Nanoplastics,"Nanoplastics, the smaller fraction than microplastics, appear to be able to cross the blood-brain barrier in fish. It is therefore probably of greater human toxicological significance than microplastics.",False,2019-01-30T00:00:00,2025-11-06T09:49:22,1.3,15.0,"[2175, 2193, 2408, 2456, 2513, 2358, 2331, 2495, 2413, 2518]"
36,8,F-2019-056,Climate change and its impact on food safety,"Climate change is likely to have a considerable impact on food safety, both direct and indirect, putting public health at risk. With changing rainfall patterns and increases in extreme weather conditions and the annual average temperature, we will begin to face the impacts of climate change. These impacts will affect the persistence and occurrence of bacteria, viruses, parasites, harmful algae, fungi and their vectors, and the patterns of their corresponding food-borne diseases and risk of toxic contamination. Alongside these impacts, chemical residues of pesticides and veterinary medicines in plant and animal products will be affected by changes in pest pressure. The risk of food contamination with heavy metals and persistent organic pollutants following changes in crop varieties cultivated, cultivation methods, soils, redistribution of sediments and long-range atmospheric transport, is increased because of climate change. Climate-sensitive risk factors and illnesses will be among the largest contributors to the global burden of food-related disease and mortality, including malnutrition, communicable, non-communicable, and diarrheal- and vector-borne diseases.",False,2019-03-05T00:00:00,2026-01-19T07:21:22,1.38,50.0,"[2562, 2573, 2631, 2325, 2321, 2273, 2183, 2383]"
35,7,F-2019-055,Nanoparticles in foods,"Nanotechnology opens up new possibilities for the food industry to modulate various aspects of food. As a result, man-made nanoparticles are increasingly being used as functional ingredients in foods and beverages. They already serve a wide variety of purposes: they give chewing gum its white colour and keep instant coffee from clumping.As far as health concerns go, something is particularly questionable with regard to these substances: can the particles, due to their small size, penetrate barriers that are actually supposed to protect against intruders? An American study has shown that manganese oxide nanoparticles were able to penetrate the brain via the nose of test animals.Consumers are concerned about the possibly carcinogenic and in the long run harmful substances.On the other hand, the targeted use of nanoparticles for health promotion is being discussed. One study shows how nanoparticles can positively influence bacteria of the digestive tract. They speak of ""probiotic nanoparticles"". Nanoparticles are also already being used in pharmacy, for example to precisely transport substances to where they are needed.",True,2019-10-18T00:00:00,2025-07-11T06:41:30,1.43,23.0,"[2189, 2169, 2313, 2503, 2627, 2214, 2413]"
188,5,F-2022-344,Trifluoroacetate (TFA) in water,"Trifluoroacetate (TFA) is a mobile and persistent substance that is primarily introduced into the water cycle through the degradation of various fluorochemicals and remains there for an unforeseeable period of time. There is already a high baseline load of TFA in many water bodies with some regional hotspots. This background paper presents current data and estimates on sources, input pathways, loads, impacts and measures on TFA. It gives an outlook on first activities and options to comprehensively minimise TFA inputs to the environment. Despite gaps in knowledge, it becomes clear that consistent regulation and an overarching minimisation strategy must be initiated in the short term.",False,2022-05-03T00:00:00,2025-07-24T07:51:40,1.4,9.0,"[2481, 2437, 2561, 2204, 2598]"
220,4,F-2023-003,PFAS in freshwater fish,"<strong>Per- and polyfluoroalkyl substances (PFAS)</strong> are widely detected in <strong>freshwater fish</strong> across the United States. A study from the US concludes, that locally caught freshwater fish are likely a significant <strong>source of exposure</strong> to <strong>perfluorooctane sulfonic acid (PFOS)</strong> and other perfluorinated compounds.  U.S. Environmental Protection Agency fish testing in 2013–2015 had a median PFAS concentration of 11,800 ng/kg.",False,2023-01-23T09:19:51,2026-01-21T07:32:18,1.25,18.0,"[2616, 2398, 2647, 2151]"
147,3,F-2021-295,Plant-based substitutes - nutrients,"Milk is the main source of iodine in the UK; however, the consumption and popularity of plant-based milk alternatives is increasing. Consumers may be at risk of iodine deficiency as milk alternatives, unless fortified, have low iodine concentrations.Agroscope has also conducted a study on the nutritional quality of plant-based beverages. This revealed major differences in macro- and micronutrient composition compared to cow's milk. Many of the milk alternatives are therefore fortified with micronutrients.",False,2021-07-20T00:00:00,2024-02-26T08:33:16,1.33,10.0,"[2042, 2142, 2576]"
273,3,F-2024-021,Psychotropic Substances in Food – Legal Classification (Microdosing candies),"The Food and Drug Administration is investigating nearly 50 illnesses—including one possible death—that might be linked to <strong>microdosing candies</strong> available online and at retailers nationwide. These chocolate bars and gummies showed higher than normal amounts of <strong>muscimol</strong>, a chemical found in mushrooms of the genus amanita, wich could be a potential cause of symptoms consistent with those observed in persons who became ill after eating the products",True,2024-07-04T08:58:03,2025-10-09T09:13:25,1.0,33.0,"[2070, 2125, 2135]"
51,3,F-2019-083,Surrogate meat and meat alternatives,"The consumption of meat is coming under heightened pressure, be that for religious, environmental or health reasons. Numerous publications have appeared on this topic. But what does this mean in terms of opportunities and risks in terms of food safety?Alternative protein sources, mostly not animal-based, are an upward trend. Increasing interest in vegetarian or vegan diets is only one reason for this development, concerns about the environmental and climate impacts of animal agriculture, as well as the question of how to feed a growing world population in the future, also support the search for alternative protein sources. Here are some examples: Moringa tree: a Thurgau-based company wants to extract protein from the leaves of the Moringa tree and use it for the food and feed industry. <a href=""https://www.tagblatt.ch/wirtschaft/das-ist-die-protein-pflanze-der-zukunft-thurgauer-unternehmer-ueber-den-wunderbaum-mit-potenzial-ld.1215367"" target=""_blank"" rel=""noopener"">Interview in the Tagblatt</a>. (April 2020). Algae directly consumed and processed. Insects directly consumed and processed. Fermentation: see <a href=""https://www.adura.blv.admin.ch/de/FoodSafety/Factsheet/Detail/c87a1e8c-4559-491a-9605-08d77a25b7ac/Unreleased?&amp;Orderby=Default&amp;Sort=Descending&amp;ItemsPerPage=Five&amp;Page=5"" target=""_blank"" rel=""noopener"">ADURA ID 129 </a>'Animal-free food'.",True,2019-05-27T00:00:00,2026-01-08T08:03:47,1.0,114.0,"[2329, 2639, 2632]"
238,3,F-2023-021,"The use of AI in nutrition, food production and food safety","The Global Food and Retail Managing director of British Standards International stressed during a Forum that there are <strong>three major areas of consideration</strong> where caution is needed regarding the use of <strong>Artificial Intelligence</strong> (AI) in food production. These are : <strong>bias and discriminations</strong> linked to the data used, <strong>privacy and security</strong>, and finally how AI-led world would <strong>impact people's lives</strong>.",False,2023-07-12T06:56:16,2025-11-10T08:35:26,1.33,68.0,"[2315, 2430, 2075]"
298,3,F-2026-001,Chemical water quality in agrifood systems,"Reliable access to safe and sufficient water is critical to food security and protecting public health. However, water systems face unprecedented pressure from climate change and rising demand. Agriculture, the largest user of freshwater globally, increasingly relies on alternative water sources, some of which may contain chemical contaminants that pose potential risks to food safety. While progress has been made on identifying microbial risks in agrifood water sources, guidance on chemical hazards remains limited. Prioritizing food safety hazards related to chemical water quality in agrifood systems identifies high-priority waterborne chemical hazards through a three-stage process: compiling examples of reported chemical hazards in water sources, assessing their potential uptake into food production systems, and evaluating their dietary exposure. This flexible, science-based approach can be tailored to local contexts, helping to ensure food safety against a backdrop of rapidly evolving water uses. By outlining approaches for assessing and managing waterborne chemical hazards, this publication addresses gaps in food safety risk management and offers guidance on many of these contaminants. Emerging issues, such as new technologies, the use of alternative water sources, and chemical mixtures, further complicate the landscape, highlighting the need for continuous adaptation of risk assessment frameworks.",False,2026-01-06T09:02:22,2026-01-12T07:26:13,1.33,11.0,"[2026, 2569, 2243]"
125,3,F-2021-257,Melatonin for pre- and post-harvest treatment,"Melatonin (<em>N-acetyl-5-methoxytryptamine</em>) is known as a potential free radical. In a study by <a href=""https://www.sciencedirect.com/science/article/pii/S0308814620316952?dgcid=raven_sd_via_email"" target=""_blank"" rel=""noopener"">Li et al. (2021)</a>, the prolonged effect of the shelf life of white champignons was investigated. These had a significantly longer shelf life depending on the treatment. Melatonin also delays the leaf senescence of Chinese cabbage (<a href=""https://www.sciencedirect.com/science/article/pii/S0963996920308152"" target=""_blank"" rel=""noopener"">Tan et al. 2020</a>) or the yellowing of broccoli (<a href=""https://www.sciencedirect.com/science/article/pii/S0925521420309509"" target=""_blank"" rel=""noopener"">Wu et al. 2021</a> or <a href=""https://pubmed.ncbi.nlm.nih.gov/32169761/"" target=""_blank"" rel=""noopener"">Miao et al. 2020)</a>. It is also employed in the ripening of fruit (such as tomatoes; <a href=""https://pubmed.ncbi.nlm.nih.gov/32771141/"" target=""_blank"" rel=""noopener"">Sun et al. 2020</a>) or to increase the resistance of grapes (<a href=""https://pubmed.ncbi.nlm.nih.gov/32448301/"" target=""_blank"" rel=""noopener"">Gao et al. 2020</a>). Melatonin is found in plant-based foods and in very small doses also in animal foods. The highest melatonin content is found in cranberries (up to 9,600 µg/100g dry weight). Other sources of melatonin are some types of mushrooms (saffron milk cap, common boletus, agaricus bisporus, chanterelle), some types of cereals (corn, rice, wheat, oat, barley), mustard seeds, dried tomatoes and peppers, and some types of wine (<a href=""https://de.wikipedia.org/wiki/Melatonin"" target=""_blank"" rel=""noopener"">wikipedia</a>).",True,2021-02-25T00:00:00,2025-10-08T08:02:56,1.0,28.0,"[1993, 2004, 2342]"
126,2,F-2021-273,"6PPD-Chinon - car tire abrasion, artificial turf","Exposure of coho salmon (<em>Oncorhynchus kisutch</em>) in the Pacific Northwest of the United States to stormwater causes unexplained acute annual mortality when adult salmon migrate to urban streams to reproduce. Investigating this phenomenon, researchers identified a highly toxic quinone transformation product of N-(1,3-dimethylbutyl)-N′-phenyl-p-phenylenediamine (6PPD), a ubiquitous antioxidant found in tyre rubber worldwide. Retrospective analyses of representative U.S. West Coast road runoff and stormwater-influenced streams revealed the widespread occurrence of 6PPD quinone (&lt;0.3 to 19 micrograms per liter) at toxic concentrations (median lethal concentration of 0.8 ± 0.16 micrograms per liter). These results reveal unexpected risks of 6PPD antioxidants to this aquatic species and imply toxicological relevance for residues derived from tyre rubber.",True,2021-03-01T00:00:00,2026-01-06T12:48:42,2.0,51.0,"[2611, 2413]"
95,2,F-2020-135,Ultraprocessed food,"Since 1980, scientific literature has reported on the links between the prevalence of certain health conditions and the high consumption of ultra-processed food (see <a href=""https://world.openfoodfacts.org/nova"" target=""_blank"" rel=""noopener"">NOVA Klassifikation</a> for definition of ultraprocessed food). The increased consumption of this type of food may be responsible for the increase in incidence of many health conditions such as obesity, type 2 diabetes, hypertension, dyslipidaemia, loss of microbial diversity, dysbiosis, other inflammation-related diseases of the digestive system, increased risk of ischaemic heart disease, coronary heart disease and cancer. Ultra-processed foods have high energy density (energy per volume) and low nutrient density (nutrient per unit energy), making them nutritionally unbalanced. Additives are often used to improve shelf life and taste, and chemical contaminants can result from processing methods. Maximum permitted levels for food additives and contaminants are set to protect consumers, but their cumulative effects are largely unknown.",False,2020-01-06T00:00:00,2025-08-11T08:31:58,1.0,87.0,"[2172, 2385]"
83,2,F-2021-123,PFAS in food packaging,"Per- and polyfluorinated alkyl substances (PFAS) are industrial chemicals that are used in numerous industrial processes and consumer products, such as fire extinguishing materials. They are also popular in food packaging because the substances are water and fat repellent. However, in animal studies, some of them have been shown to be liver-damaging, toxic to reproduction and probably carcinogenic. PFAS are of particular concern because, unlike other common contaminants that pass quickly through the human body, they can linger for years and thus accumulate cumulatively. This property has given them the name ""forever chemicals"". PFASs can also enter the food chain through environmental pollution, for example when plants are supplied with contaminated water or grown in contaminated soil, such as near factories or places where products containing PFASs have been used for firefighting. From mid-2020, Denmark will be the first country to ban the use of all PFASs in food packaging.",False,2021-06-17T00:00:00,2024-10-08T08:29:00,2.0,49.0,"[2426, 2151]"
211,2,F-2022-367,Surrogate dairy products,"Vegan nutrition is very much in vogue. Companies are responding to this trend by developing new milk substitutes to replace drinking milk, butter and cheese. To date, there are various milk substitutes with very different compositions. The impact on food safety of foods derived from plants depends on the soil, the agricultural inputs used to grow the source plants, but also on how the plants are harvested, stored, transported and processed. The process engineering methods used to treat and process the proteins are then decisive (FAO, 2021). Plant-based dairy products generally have a greater variety of ingredients than animal products and therefore potentially offer a wide range of sources from which hazards can arise. Compared to dairy products, dairy substitutes occupy a niche position. However, according to the FOAG, their market share in the retail trade is steadily increasing, from 2.7 per cent in 2017 to 4.2 per cent in 2021. Although there are numerous products on the market, only generic approaches for risk assessment of such products can be found. <a href=""https://www.tandfonline.com/doi/pdf/10.1080/10408398.2022.2089625?needAccess=true"" target=""_blank"" rel=""noopener"">Banach et al. (2022) </a>provide a general overview of potential hazards of alternative proteins for milk substitutes, based on the different protein sources. It shows that such products may be contaminated with pathogens on the market or have led to outbreaks. At present, there are hardly any results from microbiological analyses (monitoring ring data) of such products.",False,2022-10-10T08:40:39,2025-01-31T07:19:58,1.0,43.0,"[2639, 2648]"
219,2,F-2023-002,Risk of allergic reaction and sensitization to antibiotics in foods,"The use of antibiotics in the agro-food industry is globally widespread also as pesticides in fruits, with a clear effect on the human microbiome. Although a common concern is the emergence of antibiotic multiresistant bacterial strains, <strong>allergic reaction to antibiotic residues in foods</strong> is an underrecognized risk that been described. This study links an <strong>allergic reaction to fruits treated with antibiotic pesticides (streptomycin)</strong>.",False,2023-01-13T14:25:04,2026-01-21T07:32:19,1.0,7.0,"[2041, 2118]"
122,1,F-2021-240,Feed additive: 3-NOP in foods?,"Methane — a natural byproduct of digestion in ruminants — is released by cows into the atmosphere mostly through belching . The addition of 3-Nitrooxypropanol (3-NOP) to the feed of dairy cows reduced their enteric methane emissions by about 25%.The compound inhibits an enzyme that is crucial to the final stage of methane synthesis in a cow’s rumen. When 3-NOP is fed to cattle, their methane production is inhibited.",False,2021-02-03T00:00:00,2022-09-16T11:04:54,1.0,5.0,[2646]
93,1,F-2021-133,"Cannabinoids CBD,CBG,CBN,Δ-8 THC in foods","Foods containing extracts of hemp or cannabinoids (such as CBD) represent the current trend in Switzerland (<a href=""https://www.blv.admin.ch/blv/en/home/lebensmittel-und-ernaehrung/rechts-und-vollzugsgrundlagen/bewilligung-und-meldung/bewilligung/cannabis-cannabidiol.html"" target=""_blank"" rel=""noopener"">FSVO</a>, <a href=""https://www.blv.admin.ch/dam/blv/de/dokumente/lebensmittel-und-ernaehrung/rechts-und-vollzugsgrundlagen/merkblatt-produkte-cannabidiol.pdf.download.pdf/cannabidiol-merkblatt-vollzugshilfe-final-de.pdf"" target=""_blank"" rel=""noopener"">leaflet</a>). The product range containing CBD includes various product categories, which are mainly sold on the internet. CBD, unlike THC (<em>tetrahydrocannabinol</em>), is not subject to the Federal Act on Narcotics (BetmG, SR 812.121) because it has no similar psychoactive effect. However, cannabinoids and hemp extracts are essentially novel foods, which is why they cannot be added to food as one pleases. In the USA, for a long time, the FDA had classified CBD as GRAS ('generally recognised as safe'), i.e. as a food additive, the substance was deemed to be harmless. However, this classification has now been revised and the <a href=""https://www.fda.gov/consumers/consumer-updates/what-you-need-know-and-what-were-working-find-out-about-products-containing-cannabis-or-cannabis"" target=""_blank"" rel=""noopener"">FDA warns</a> of possible side effects, such as liver damage, interactions with other drugs, fatigue, diarrhea and mood swings. <em>Cannabigerol</em> (CBG) is - similar to CBD - a non-psychoactive cannabinoid found in various cannabis species. It has a relaxing effect but does not cause drowsiness; instead, it has an energising effect. CBG is thought to have medicinal potential, for example as an anti-inflammatory or when treating pain and nausea. However, cannabinoid research has not progressed enough to support the definitive treatment potential of cannabinoids. The FOPH writes: ""Regarding the effects attributed to CBD, research is still in its infancy and it is quite impossible to confirm or deny its effects and its usefulness for clinical practice. In general, it remains to be said that its efficacy is claimed to be more promising than what has been proven, but CBD is likely to be effective for certain symptoms and disorders"".In its <a href=""https://gdi.ch/"" target=""_blank"" rel=""noopener"">2019 European Food Trends Report</a>, the GDI states that the market for 'drinkables' and 'edibles' - foods and beverages containing cannabis - is booming. Other cannabinoids are entering the market, such as cannabigerol (CBG) . CBD is the hype of the decade - according to <a href=""https://object.gever.admin.ch/web/?ObjectToOpenID=%24ActaNovaDocument%7cCOO.2101.102.7.988062_COO.2101.102.1.988061&amp;TenantID=181&amp;OpenContentOfProperty=UnifiedIDocument"" target=""_blank"" rel=""noopener"">New Food 2020 </a>- but with the market for cannabidiol oversaturated in the U.S., product companies will introduce other cannabinoids such as <em>cannabinol</em> (CBN) and <em>cannabigerol </em>(CBG), which are said to have functional benefits regarding sleep and appetite manipulation. According to Food News, the FDA is expected to voice its concerns about these 'cannabis-derived compounds'. However, it is still expected that they will be marketed. Inquiries about this have already reached the FSVO. Since CBD is currently becoming a trend product and is offered in various forms (as drops, as food ingredient, in cosmetics, etc.), it is quite possible that other cannabinoids such as CBG will also become popular in the future. In Ireland, poisoning in children has occured 1) after the consumption of sweets (<a href=""https://imj.ie/edible-cannabis-toxicity-in-young-children-an-emergent-serious-public-health-threat/"" target=""_blank"" rel=""noopener"">Ir Med J Vol. 2021 Vol.114, No. 8 p446</a>). It is also suspected that synthetic cannabinoids were used. Hence, synthetic cannabinoids are likely to pose a new risk.",True,2021-07-19T00:00:00,2025-03-25T07:21:16,1.0,54.0,[2247]
64,1,F-2019-103,Milk substitutes made from cashews,"Vegan nutrition is in vogue. Companies are responding by creating new milk substitutes, including cashew nut-based ones. In Switzerland, cheese has been made from cashew nuts since 2015. 50 to 60 tonnes of organic cashews are imported from Vietnam every year. The cashew milk is processed raw and not pasteurised, only the ""ricotta"" and the products sold in the retail trade are thermised at 65 degrees to make them last longer. The concern here is that products are not necessarily pasteurised, especially as nuts can be contaminated by micro-organisms and/or pesticides. In many countries, nuts are harvested by hand and dried in the sun. Contamination can occur through insects, birds, rodents, but also through air and soil. Wet, humid conditions also pose a significant risk for the formation of aflatoxins. Nuts and seeds are known sources of <em>salmonella</em>, but <em>E. coli O157</em> can also be frequently detected.",True,2019-10-17T00:00:00,2024-09-05T16:25:10,1.0,14.0,[2433]
