id,count,code,titel,kurzinfo,signal,erf_date,mut_date,mean_sterne,count_mut,meldung_ids
86,2,F-2019-126,Mercury in permafrost,"New studies reveal that permafrost is the largest natural source of mercury on Earth - with mercury levels twice as high as all other soils, the ocean and the atmosphere combined. Climate warming threatens to melt this permafrost and gradually release mercury into the food chain. Mercury enters permafrost naturally, as part of the global mercury cycle, but also as a result of anthropogenic activities such as burning coal and petroleum. Once inorganic mercury is released, it can be converted by microbes into methylmercury, a potent neurotoxin. Eating fish from mercury-contaminated water therefore often leads to damage to the central nervous system and birth defects in humans. Released mercury can also enter the atmosphere and thus be distributed to other parts of the world, where it usually settles in rivers, lakes and seas.",True,2019-11-18T00:00:00,2024-09-25T08:15:12,1.0,59.0,"[1095, 1022]"
140,2,F-2021-287,Human gut microbiome,"The human gut microbiome is a diversified, resilient, immunostabilised, metabolically active and physiologically essential component of the human body. Scientific investigations have been conducted to explore detailed information on the establishment of the human gut microbiome, the functioning of the microbiome, the succession of the microbiome, factors influencing microbial community dynamics and the role of the gut microbiome in health and disease. Extensive research has suggested microbiome therapeutics as a futuristic medicine for various physiological and metabolic disorders. A comprehensive review of microbial colonisation, host-microbe interactions, microbial adaptation, commensal selection and immune survivability is still required to catalogue the essential genetic and physiological features for commensal engagement. The evolution of a structured human gut microbiome relies on microbial flexibility for genetic, immunological and physiological adaptation in the human gut. The key features for commensalism could be used in the development of a tailored microbiome-based therapy to overcome various physiological and metabolic disorders.The influence of the gut microbiome on human health has come increasingly into focus in recent years. The microbiome in the gut has an important function in the metabolism of food components and chemicals and also serves as a barrier against harmful effects from the environment. The microbiome is a highly diverse community of microorganisms and includes bacteria, archaea, eukaryotes, and viruses. Ongoing studies show that microbiome structure and dynamics can have both a direct (e.g., direct metabolic conversion of chemicals) and indirect (e.g., regulation of gut barrier function) impact on human and animal health. The microbiome structure and dynamics are in turn influenced by external influences, such as food or chemicals. There are now a number of studies showing an effect of additives such as artificial sweeteners or emulsifiers on the microbiome, often resulting in impaired glucose metabolism or gut inflammation (Laudisi et al. 2019, Roca-Saavedra et al. 2018). There is evidence from studies with mice that emulsifiers, for example, can disrupt gut homeostasis and lead to inflammation in the gut (Chassaing et al. 2015). Recent data also show that artificial sweeteners favour horizontal gene transfer in intestinal bacteria and thus promote the spread of antimicrobial resistance genes (Yu et al. 2021).",True,2021-11-16T00:00:00,2024-09-05T16:20:51,1.0,27.0,"[1154, 1112]"
233,2,F-2023-016,Social media and food safety risk,"Food and nutrition are popular topics in the media and on social networks. The ubiquity of social media has created new opportunities for qualified or accredited experts from the scientific community to connect with customers and the public. It has also created challenges. Health and wellness gurus, or self-proclaimed experts, use social media platforms to attract attention with compelling narratives, build an audience and influence public opinion by sharing (often) misleading information about food and nutrition. This can result in the perpetuation of misinformation, which not only undermines the proper functioning of democracy, but also diminishes support for science-based or evidence-based policies. In addition, ephemeral types of content that attract the attention of a large audience (trends) can quickly spread across major social media platforms and be replicated by more or less aware users. The use of social media can be both a threat and an opportunity for public health.",True,2023-03-13T13:01:19,2024-09-17T09:01:57,1.0,47.0,"[1324, 1107]"
225,2,F-2023-008,Change of consumer behaviour due to energy costs,"A worrying fifty percent of consumers in Scotland have admitted to eating food which has passed its ‘use-by’ date in order to save money, research by Food Standards Scotland (FSS) reveals. Around 10% of respondents had changed the temperature of the thermostat in their fridge, with a further 2% turning their fridges off for a period of time to reduce energy bills. This survey of the Food Standards Scotland shows that the cost of living crisis is driving consumer behaviour with the potential to negatively impact public health.",True,2023-02-14T07:45:42,2024-08-07T10:58:30,1.0,32.0,"[1017, 943]"
224,2,F-2023-007,Ukraine war: long-term effects on food safety,"Armed conflict is inherently destructive. Environmental damage that arises during conflict brings devastating  consequences for natural resources, critical ecosystems and people’s health, livelihoods and security. The  containment, mitigation and remediation of environmental impacts is, therefore, an essential part of response to and  recovery from conflict. These impacts may also endanger food safety, be it directly, be it indirectly.Initial information shows that Ukraine, already burdened by a host of legacy environmental challenges, is now facing a compounded, multi-dimensional environmental crisis that has either exacerbated existing issues or added new ones.  The country and the region risk being burdened with a toxic legacy long after the conflict ends.",True,2023-01-31T14:20:15,2024-08-09T07:40:17,1.5,39.0,"[1604, 943]"
160,2,F-2021-309,Human milk donation and associated health risks,"In the absence of a lactarium in French-speaking Switzerland, young mothers give, sell, buy, or receive breast milk. There are platforms for these exchanges on social networks, but they do not seem to be supervised by health professionals. The journalist in this article raises the microbiological and toxicological risks that the failure to respect certain basic sanitary rules (use of medication and bacterial contamination by Salmonella, Streptococcus, Staphylococcus) may represent for breast milk and therefore for the newborn. In 2022, a first lactarium will be opened, it is possible that these platforms will or will not cease to exist, but the question concerning the professional supervision of this issue remains if they continue to exist.",False,2021-08-10T00:00:00,2023-01-13T15:13:17,1.5,5.0,"[1668, 1703]"
222,2,F-2023-005,Protein supplements : effects of a (too) high protein diet,"""A high protein intake is great for losing weight, but it's also great for athletes."" With such and similar statements, the importance of proteins in the diet is advertised. At the same time, more and more ""high protein"" foods are available, which - as the name suggests - have a higher protein content than their conventional counterparts. Proteins are essential for many functions in the body. But what are the consequences if the recommended daily intake is chronically exceeded? People who follow this ""high protein"" trend are particularly affected.A chronic excess of protein can have negative consequences in the long term. However, these health risks are only discussed in the specialist literature; the general population is insufficiently informed about them. On the contrary, protein-enriched products are now widely available in shops, and big advertising campaigns by the industry promise health benefits thanks to these (expensive) trendy products. The lack of information about the possible negative effects of too much protein gives the false impression that the ""healthy"" amount of protein is unlimited, in the sense of ""if it doesn't help, it doesn't hurt"".Delimaris et al. (2013) conclude in their article that extra protein is not efficiently utilised by the body and can put a strain on the metabolism of bones, kidneys and liver. According to the authors, there is currently no reasonable scientific basis in the literature for recommending consumption above the RDA for healthy adults (= recommended daily allowance). Disorders of bone and calcium homeostasis, disorders of kidney function, increased risk of cancer, disorders of liver function and accelerated progression of coronary heart disease are mentioned as health risks associated with long-term intake of (too) much protein in humans. Barzel et al. (1998) also describe the effect of over-acidification of the body through excessive protein intake and the associated compensation through bone loss and thus calcium loss.In connection with protein diets for weight reduction, St. Jeor et al. (2001) write that there are no scientific long-term studies that prove the effectiveness and safety of such diets. High-protein diets even prevent the necessary requirements of important vitamins and minerals from being met due to the restriction of certain groups of nutrients. LM groups. Furthermore, there is a general risk - despite ""high protein"" - of a deficiency of essential amino acids if the biological value of the proteins is not taken into account and the foods are combined accordingly.  In summary, the excessive intake of proteins does not represent an acute danger for the Swiss population, but long-term damage is to be expected.",True,2023-01-27T13:00:59,2024-07-29T06:48:44,1.5,18.0,"[1486, 1157]"
165,1,F-2022-316,Marine toxins: an emerging risk in Europe?,"Ciguatera is the most common form of marine biotoxin food poisoning in the world, with between 10,000 and 50,000 cases reported each year, a figure that is probably far from the reality. Ciguatera poisoning (CTXs) is endemic in tropical and subtropical areas, particularly in the Pacific and Caribbean (West Indies). Ciguatera is a complex syndrome with gastrointestinal, neurological and cardiovascular effects. The symptoms appear two to twelve hours after the contaminating meal. The question of a possible emergence of indigenous European cases is raised in view of the potential impact of climate change on the contamination of the food chain.",False,2022-07-21T00:00:00,2024-04-25T08:19:16,1.0,6.0,[1097]
235,1,F-2023-018,Detrimental impact of cellulose derivatives food additive on the gut microbiota,"Additive derivated from cellulose - such as microcrystalline cellulose (E 460), powdered cellulose (E 460), methyl cellulose (E 461), ethyl cellulose (E 462), hydroxypropyl cellulose (E 463), hydroxypropyl methyl cellulose (E 464), ethyl methyl cellulose (E 465), sodium carboxy methyl cellulose (E 466) and enzymatically hydrolysed carboxy methyl cellulose (E 469) - are often used in the food industry because of thier thechnological properties. However, since several years, these additives are controversial because of their potential adverse health effects. The EFSA stated in 2018 that they would be no safety concern at the reported uses and use levels for the unmodified and modified celluloses. However, results of a randomized Controlled-Feeding Study of Dietary Emulsifier Carboxymethylcellulose (CMC) published in 2021 support the notion that the broad use of CMC in processed foods may be contributing to increased prevalence of an array of chronic inflammatory diseases by altering the gut microbiome and metabolome. Because these additives are commonly used in meat-alternatives and regular consumer of these product would be more exposed to these additives, increasing the risk of developing inflammatory diseases.",False,2023-04-20T13:45:41,2024-05-29T16:51:44,1.0,5.0,[1154]
211,1,F-2022-367,Surrogate dairy products,"Vegan nutrition is very much in vogue. Companies are responding to this trend by developing new milk substitutes to replace drinking milk, butter and cheese. To date, there are various milk substitutes with very different compositions. The impact on food safety of foods derived from plants depends on the soil, the agricultural inputs used to grow the source plants, but also on how the plants are harvested, stored, transported and processed. The process engineering methods used to treat and process the proteins are then decisive (FAO, 2021). Plant-based dairy products generally have a greater variety of ingredients than animal products and therefore potentially offer a wide range of sources from which hazards can arise. Compared to dairy products, dairy substitutes occupy a niche position. However, according to the FOAG, their market share in the retail trade is steadily increasing, from 2.7 per cent in 2017 to 4.2 per cent in 2021. Although there are numerous products on the market, only generic approaches for risk assessment of such products can be found. Banach et al. (2022) provide a general overview of potential hazards of alternative proteins for milk substitutes, based on the different protein sources. It shows that such products may be contaminated with pathogens on the market or have led to outbreaks. At present, there are hardly any results from microbiological analyses (monitoring ring data) of such products.",False,2022-10-10T08:40:39,2024-09-17T06:31:21,1.0,39.0,[1556]
188,1,F-2022-344,Trifluoroacetate (TFA) in water,"Trifluoroacetate (TFA) is a mobile and persistent substance that is primarily introduced into the water cycle through the degradation of various fluorochemicals and remains there for an unforeseeable period of time. There is already a high baseline load of TFA in many water bodies with some regional hotspots. This background paper presents current data and estimates on sources, input pathways, loads, impacts and measures on TFA. It gives an outlook on first activities and options to comprehensively minimise TFA inputs to the environment. Despite gaps in knowledge, it becomes clear that consistent regulation and an overarching minimisation strategy must be initiated in the short term.",False,2022-05-03T00:00:00,2022-09-19T10:52:44,1.0,4.0,[1496]
47,1,F-2019-077,Organochlorines when heating sucralose,"When foods containing sucralose are heated above 120°C, harmful substances such as organochlorines (e.g., polychlorinated dibenzodioxins, dibenzofurans, chloropropanols) can be formed through dechlorination and decomposition. The sweetener sucralose (E955) was internationally deemed as safe within the framework of the authorisation of additives and will be re-evaluated by the EFSA by the end of 2020 at the latest. The current state of knowledge (see BfR 2019) on the stability of sucralose and the decomposition products formed during heating should be taken into account. There are still many data gaps on the identity and concentration concerning these substances and the exposure estimation, and the BfR ( German Federal Institute for Risk Assessment) was not able to make a conclusive risk assessment in its statement (2019). The question arises whether measures should be taken in the meantime.",True,2019-04-16T00:00:00,2024-01-30T09:20:20,1.0,10.0,[1632]
227,1,F-2023-010,Irrigation with wastewater,"As climatic changes are increasing the pressure on water resources and more fresh fruits and vegetables are needed to meet the demands of a growing population, growers may need to start depending on more varied sources of water for irrigation, including environmental, recycled, and reclaimed wastewaters. Additionally, the wastewater draining from massive pools of sewage sludge has the potential to play a role in more sustainable agriculture (Science of The Total Environment, 20.01.2023). However, this practice is not without risks as some of some of these wastewater sources might be susceptible to contamination with microbial pathogensFor instance, surveys have found Listeria monocytogenes in water, soil, vegetation, and farm animal feces around the world. The frequency at which this pathogen is present in water sources is dependent on multiple factors, including the season, surrounding land use, presence of animals, and physicochemical water parameters. Understanding the survival duration of L. monocytogenes in specific water sources is important, but studies are limited concerning this environment and the impact of these highly variable factors. Understanding the pathogen’s ability to remain infectious is key to understanding how L. monocytogenes impacts produce outbreaks and, ultimately, consumers’ health.Moreover, the German federal institute for risk assessment (BfR) has published a risk assessment of transmission of Cryptosporidium spp., Giardia duodenalis and Toxoplasma gondii to humans related to using reclaimed wastewater in agriculture where they recommend to only use irrigation water of a quality comparable to drinking water for watering plants that are usually consumed raw.",True,2023-02-28T11:35:21,2024-09-24T07:48:15,1.0,29.0,[1182]
113,1,F-2020-210,Tenuazonic acid (TEA),"Tenuazonic acid (TEA) is a mould toxin (mycotoxin) produced mainly by moulds of the genus Alternaria; more than 70 toxins have been described for this genus. Due to the widespread occurrence of Alternaria spp. on plants used for food production, TEA can often be detected in various foods. Contamination of tomatoes and tomato products (e.g. ketchup) with TEA is a known problem and occurs mainly when already mouldy tomatoes are processed. Accordingly, the detection of TEA can serve as a quality characteristic, as increased toxin contents are an indication that ingredients affected by mould have been processed. In addition to tomatoes and tomato products, cereals and cereal products, sunflower seeds and spices are also among the foods that may be preferentially contaminated with alternariatoxins. Due to a lack of comprehensive toxicological data, there are currently no legal regulations for the assessment of alternariatoxins in food and thus no maximum values for food. However, a scientific opinion of the EFSA from 2011 is available, which is used as a guideline for the risk of alternariatoxins in food. According to this, the TTC (threshold of toxicological concern) for TEA is 1.5 µg/kg body weight per day. Accordingly, a person weighing 60 kg may consume a product containing up to 90 µg/kg TEA every day without suffering health damage.",False,2020-09-01T00:00:00,2024-08-20T06:45:36,1.0,5.0,[1567]
242,1,F-2023-025,The potential dangers of energy drinks,"Consumption of energy drinks has been increasing dramatically in the last two decades, particularly amongst adolescents and young adults. Energy drinks are aggressively marketed with the claim that these products give an energy boost to improve physical and cognitive performance. However, studies supporting these claims are limited. In fact, several adverse health effects have been related to energy drink; this has raised the question of whether these beverages are safe.",True,2023-10-02T16:56:51,2024-09-05T10:47:07,1.0,17.0,[1431]
30,1,F-2019-050,Microalgae as food,"Algae have great potential as a new food source. They grow quickly, can be produced in a water-saving way and do not require fertile soil. They are rich in protein, high in omega-3 fatty acids and contain essential vitamins and minerals. They could one day replace meat and fish. Currently, chlorella and spirulina are the main food supplements on the market.",False,2019-02-22T00:00:00,2024-02-29T08:17:23,1.0,5.0,[1577]
143,1,F-2021-291,Circular economy,"The Circular Economy (CE) is an approach that decouples economic activity from the consumption of finite resources, avoids waste, opposes the linear economic model of 'take-produce-consume-waste' and replaces it with an economic model based on sharing, leasing, reusing, repairing, refurbishing and recycling in an (almost) closed loop. Such a shift from a linear economy to a circular economy is expected to significantly support the achievement of the UN Sustainable Development Goals (SDGs), in particular SDG 12 (Responsible Consumption and Production). However, the design and implementation of the circular economy requires careful consideration of the numerous trade-offs that may arise. This is a prerequisite for achieving SDG 3 (Good health and well-being).In the transition to a circular economy, it will be crucial to identify potentially emerging risks to the environment and food and feed safety in a holistic and integrated manner in order to achieve an optimal balance between opportunities, benefits and risks. It is important to ensure that food and feed safety and environmental health considerations are included at an early stage of research or policy initiatives related to recycling and the circular economy.",False,2021-12-18T00:00:00,2022-09-12T14:24:39,2.0,6.0,[1630]
127,1,F-2021-274,"""Upcycling"" in the food industry","Upcycling is about the valorisation of waste from the food industry. Some initiatives focus on using by-products to produce new foods or functional ingredients. Others are about transforming food waste into entirely new raw materials. Examples that have made headlines range from high-fibre orange by-product flour to plastic-free food packaging based on a natural polymer derived from lobster shells. It's about being more sustainable, reducing 'food waste' and 'food loss'.",False,2021-06-11T00:00:00,2022-09-19T11:09:00,2.0,6.0,[1630]
238,1,F-2023-021,"The use of AI in nutrition, food production and food safety","The Global Food and Retail Managing director of British Standards International stressed during a Forum that there are three major areas of consideration where caution is needed regarding the use of Artificial Intelligence (AI) in food production. These are : bias and discriminations linked to the data used, privacy and security, and finally how AI-led world would impact people's lives.",False,2023-07-12T06:56:16,2024-10-09T07:26:10,2.0,48.0,[1472]
147,1,F-2021-295,Plant-based substitutes - nutrients,"Milk is the main source of iodine in the UK; however, the consumption and popularity of plant-based milk alternatives is increasing. Consumers may be at risk of iodine deficiency as milk alternatives, unless fortified, have low iodine concentrations.Agroscope has also conducted a study on the nutritional quality of plant-based beverages. This revealed major differences in macro- and micronutrient composition compared to cow's milk. Many of the milk alternatives are therefore fortified with micronutrients.",False,2021-07-20T00:00:00,2024-02-26T08:33:16,2.0,9.0,[989]
265,1,F-2024-013,Functional drinks,"There are sodas made with mushrooms that supposedly improve mental clarity and juices packed with bacteria that claim to enhance digestive health. Water infused with collagen carries the promise of better skin, and energy drinks offer to help burn body fat. What started in the late 1980s with caffeine- and vitamin-laced energy drinks has grown into a multi-billion-dollar industry. Hundreds of brands are vying for consumers’ attention with increasingly exotic ingredients and wellness-focused marketing.",False,2024-04-22T12:14:50,2024-07-29T13:21:28,1.0,6.0,[1318]
108,1,F-2021-195,Residues of veterinary drugs in groundwater,"Due to the intensification of food production in Europe, veterinary medicines have become a critical component in animal husbandry. The administration of these products can potentially lead to their presence in environmental waters such as groundwater, which is why they are now considered potential groundwater contaminants. In Ireland, several residues of anthelmintic and anticoccidial veterinary drugs have been detected in groundwater. 22% of 106 sampling sites detected residues of anthelmintics in the range of 1-41 ng/L and anticoccidials in the range of 1-390 ng/L. Residues were higher near intensive farming sites. These veterinary drug compounds are associated with a range of acute as well as chronic side effects, and their degradation products may have additional adverse effects.",True,2021-05-12T00:00:00,2023-12-05T08:51:15,1.0,18.0,[1204]
126,1,F-2021-273,"6PPD-Chinon - car tire abrasion, artificial turf","Exposure of coho salmon (Oncorhynchus kisutch) in the Pacific Northwest of the United States to stormwater causes unexplained acute annual mortality when adult salmon migrate to urban streams to reproduce. Investigating this phenomenon, researchers identified a highly toxic quinone transformation product of N-(1,3-dimethylbutyl)-N′-phenyl-p-phenylenediamine (6PPD), a ubiquitous antioxidant found in tyre rubber worldwide. Retrospective analyses of representative U.S. West Coast road runoff and stormwater-influenced streams revealed the widespread occurrence of 6PPD quinone (<0.3 to 19 micrograms per liter) at toxic concentrations (median lethal concentration of 0.8 ± 0.16 micrograms per liter). These results reveal unexpected risks of 6PPD antioxidants to this aquatic species and imply toxicological relevance for residues derived from tyre rubber.",True,2021-03-01T00:00:00,2024-09-05T10:50:24,2.0,37.0,[1434]
