id,count,code,titel,kurzinfo,signal,erf_date,mut_date,mean_sterne,count_mut,meldung_ids
34,2,F-2018-054,Mycotoxins in foods,"Mycotoxins are metabolites formed from certain moulds. Mould – and hence mycotoxins – can form on vulnerable foods in warm and humid conditions, either whilst crops are still growing or post-harvest during storage, drying and transport. Most mycotoxins have toxic effects in humans, and some of the better characterised mycotoxins have regulatory limits in food. Certain foods are at particular risk. These include nuts and peanuts (primarily for aflatoxins) and raisins (primarily for ochratoxin A). Horizon Scan (a non-public database) has compiled a list of the most important products and has noted an increase in recalls. These findings are also supported by other stakeholders across the food chain (e.g., Biomin World Mycotoxin Survey 2018).",True,2018-12-11T00:00:00,2026-02-17T08:01:32,1.0,65.0,"[2891, 2889]"
165,1,F-2022-316,Marine toxins: an emerging risk in Europe?,"Ciguatera is the most common form of marine biotoxin food poisoning in the world, with between 10,000 and 50,000 cases reported each year, a figure that is probably far from the reality. Ciguatera poisoning (CTXs) is endemic in tropical and subtropical areas, particularly in the Pacific and Caribbean (West Indies). Ciguatera is a complex syndrome with gastrointestinal, neurological and cardiovascular effects. The symptoms appear two to twelve hours after the contaminating meal. The question of a possible emergence of indigenous European cases is raised in view of the potential impact of climate change on the contamination of the food chain.",False,2022-07-21T00:00:00,2026-03-24T07:45:04,2.0,14.0,[2887]
85,1,F-2019-125,Nitrite in meat products,"The World Cancer Research Fund (WCRF) 2007 stated that the consumption of processed meat may be linked to colorectal cancer. The cause is said to be nitrite curing salt, which is added to many products to prevent the growth of food spoilage bacteria, especially Clostridium botulinum. Several studies have investigated this hypothesis but have come to different conclusions. A connection between high nitrite intake from meat products and an increased cancer risk can neither be clearly proven nor disproven. Moreover, it is not only the consumption of a food that plays a role in the development of the disease, but the interaction between all lifestyle habits such as diet, exercise, alcohol and cigarette consumption, etc. Nitrite is not only absorbed through cured meat products, but is also formed as a degradation product of nitrate-containing foods in the body. These are mainly plant foods, as nitrite is an intermediate product in the supply of nitrogen to the plant. Examples of nitrate-containing foods are salads and vegetables such as rocket, spinach, kohlrabi, beetroot and radish. Furthermore, nitrate converted into nitrite can react with amines, amides or amino acids (present for example in the gastrointestinal tract or in the production of meat products) to form nitrosamines. Many nitrosamines are potent genotoxic carcinogens in laboratory animals and it is assumed that many nitrosamines are also human carcinogens.",True,2019-11-14T00:00:00,2026-02-02T08:57:41,1.0,51.0,[2888]
27,1,F-2019-047,Dietary supplements,"According to Menu CH, around 50% of Swiss people regularly consume food supplements containing vitamins, minerals, trace elements or other substances. The focus of this briefing note is primarily on food supplements containing plant extracts or endogenous substances (amino acids, coenzymes, etc.) in concentrated doses, which are notyet specifically regulated in Switzerland (see legal framework). Food supplements are foods and as such must be safe and not deceptive, they must also not be pharmacologically active. This responsibility primarily lies with the manufacturers/distributors within the framework of their self-regulation. As they are available as capsules, pills, powder, etc., the presentation of food supplements is similar to that of drugs; more concretely, they are sometimes advertised similarly to drugs namely, as improving health/quality of life or are at least perceived as such by consumers. On the internet, but also in supermarkets and health food shops, products are also offered as food supplements which are to be classified as non-approved novel foods or drugs. Novel foods and medicinal products undergo an official approval procedure in which their safety to health must be proven before they can be marketed. For the other food supplements, which are not considered novel foods, no approval procedure is required. Practice shows that the specifications of such products are often unclear and the toxicity (main substance, residual extracts, contaminants) is not clarified by experts. In literature, through nutrivigilance systems and through official warnings (e.g., from the US FDA), case studies of adverse effects, of up to serious liver or kidney damage are described (e.g., with certain green tea extracts), or also interactions with drugs taken simultaneously. The number of undesirable effects that go unnoticed is estimated to be high; as the effects are often not immediately visible and thus the causal connection to previous consumption goes unnoticed. Consumers do not necessarily consult a doctor or a poison control centre, and there is no nutrivigilance system in Switzerland.Legal framework Switzerland: Most important: General food law provisions on safety and protection against deception, VNem, Ordinance on Novel Food, certain plants and substances may not be used in food (VLpH and VZVM). No nutrivigilance system (unlike France), no notification legal framework EU: Largely non-harmonised. Certain countries have specific regulations (maximum quantities, plant lists), some notification, few countries with nutrivigilance systems.",True,2019-02-11T00:00:00,2024-06-11T07:55:09,2.0,18.0,[2885]
13,1,F-2018-029,Cyclospora,"Cyclospora infection is an intestinal disease caused by a unicellular parasite. Humans can be infected by the fecal-oral route; most commonly via contaminated water or food treated with it (such as salads, berries, herbs, etc.). In 2017 and 2018, several outbreaks occurred in the United Kingdom and the United States. In each of these outbreaks, numerous people fell ill. As a result, various food products were withdrawn from the market. International companies have also been affected. The list of outbreaks is long and seems to have been increasing in recent years.",True,2018-12-17T00:00:00,2026-01-13T07:43:39,1.0,22.0,[2891]
