id,count,code,titel,kurzinfo,signal,erf_date,mut_date,mean_sterne,count_mut,meldung_ids
150,5,F-2022-298,Artificial sweeteners influence microbiome,"New research shows that common artificial sweeteners can cause previously healthy gut bacteria to become sick and invade the gastrointestinal wall, potentially leading to serious health problems. The study by Shil and Chichger (2021) , published in the International Journal of Molecular Sciences, is the first to show the pathogenic effects of some of the most commonly used artificial sweeteners, saccharin, sucralose and aspartame, on two types of gut bacteria, E. coli (Escherichia coli) and E. faecalis (Enterococcus faecalis). Previous studies have shown that artificial sweeteners can change the number and type of bacteria in the gut, but this new molecular research, led by scientists at Anglia Ruskin University (ARU), has shown that sweeteners can also make the bacteria pathogenic. It was found that these pathogenic bacteria can attach to, invade, and kill Caco-2 cells, the epithelial cells that line the gastrointestinal wall. It is known that bacteria such as E. faecalis that cross the intestinal wall can enter the bloodstream and accumulate in the lymph nodes, liver, and spleen, causing a range of infections including septicaemia. In this new study, it was found that at concentrations equivalent to two cans of diet soft drink, all three artificial sweeteners significantly increased the adhesion of E. coli and E. faecalis to intestinal Caco-2 cells and differentially increased the formation of biofilms (Eurek Alert).The substance D-allulose belongs to the group of simple sugars (monosaccharides).The specific risk of favouring human pathogenic bacteria in the human body by food ingredients is to be considered as a possible ""emerging risk"". Aspartame, an artificial sweetener, has been repeatedly criticised for not being safe. This thesis has been taken up in various studies and examined by means of meta-analyses. The authors Millstone and Dawson conclude that it is premature to call aspartame 'safe' because the studies conducted by the EFSA to assess aspartame are flawed.Concerns are also raised concerning the sweetener D-allulose. The sweetness of D-allulose corresponds to about 70% of the sweeteness of household sugar (sucrose), but leads to a significantly lower calorie intake, which is why the substance is advertised as a sugar substitute. The European Food Safety Authority (EFSA) has yet to issue an opinion on the safety of D-allulose as a novel food. The BfR (German Federal Institute for Risk Assessment) reported that the use of D-allulose as a food ingredient could selectively promote the growth of bacteria of the Klebsiella genus, such as K. pneumoniae, in the human body. From a risk assessment perspective, the extent to which regular consumption of previously uncommon amounts of D-allulose as a novel food will undesirably influence the occurrence of Klebsiella spp. in the human gut microbiome remains to be scientifically determined.",True,2022-05-31T00:00:00,2025-10-31T09:29:05,1.0,32.0,"[1273, 1450, 69, 323, 1112]"
126,5,F-2021-273,"6PPD-Chinon - car tire abrasion, artificial turf","Exposure of coho salmon (Oncorhynchus kisutch) in the Pacific Northwest of the United States to stormwater causes unexplained acute annual mortality when adult salmon migrate to urban streams to reproduce. Investigating this phenomenon, researchers identified a highly toxic quinone transformation product of N-(1,3-dimethylbutyl)-N′-phenyl-p-phenylenediamine (6PPD), a ubiquitous antioxidant found in tyre rubber worldwide. Retrospective analyses of representative U.S. West Coast road runoff and stormwater-influenced streams revealed the widespread occurrence of 6PPD quinone (<0.3 to 19 micrograms per liter) at toxic concentrations (median lethal concentration of 0.8 ± 0.16 micrograms per liter). These results reveal unexpected risks of 6PPD antioxidants to this aquatic species and imply toxicological relevance for residues derived from tyre rubber.",True,2021-03-01T00:00:00,2025-09-26T08:43:59,2.4,49.0,"[735, 1434, 1796, 229, 2413]"
180,5,F-2022-336,Nano coating of foods,"There is currently a lot of investment in research to develop new types of food packaging and a trend towards sustainable and also edible forms of packaging. Edible packaging is usually made of sustainable, biodegradable material. On the one hand, this includes packaging such as yoghurt pots that can be eaten, but also edible coatings that are placed around the food. In Switzerland, edible coatings of fruits and some vegetables are permitted, e.g. beeswax (E 901) as a coating for apples. Provided that the substances are approved as food additives for the respective food. What is new is that more and more packaging or coating agents are now being developed in nano form. Depending on the application, these are nanofibres, nanoparticles, nanoemulsions or even nanoencapsulations. A current example is the development of a nano-cellulose layer for fruits and vegetables, which is made from pomace (pressed out fruit and vegetable peels). The project is a collaboration between Lidl and researchers at EMPA. The reason for using nano-forms is manifold. Nano-form coatings allow thin edible layers on the food (about 5nm thickness). Coatings based on nanotechnology usually also allow better regulation of moisture in the food and better gas exchange for longer shelf life. In addition, nanocoatings can enable other functions such as the incorporation of so-called nanosensors in food, which indicate the spoilage of food (so-called ""smart packaging""). Various legal and health issues arise in the application. For example, in the case of the cellulose developed by EMPA, it is not clear whether the already approved coating agents (celluloses E 460-469) cover the newly developed cellulose or whether it would need a new approval. Secondly, there are questions about the toxicity of the nanoparticles through the consumption of the edible layers, which need to be carefully clarified before new nanoforms can be put on the market. A report by the RIVM in the Netherlands, for example, points out that specific risk assessments are needed for nanocellulose applications in the food sector, and that these might even have to be considered as novel foods. Retailers and Empa (Swiss Federal Laboratories for Materials Science and Technology) are researching protective cellulose coating for fruit and vegetable products. The innovative coating is made from so-called pomace (press residue) and in the future, is to be used for retailers' products. The innovative project can reduce packaging and avoid food waste. No fresh vegetables are to be used for the novel protective coating, only organic residues. At Empa's Cellulose & Wood Materials lab, commissioned by a retailer, researchers developed a special protective cellulose layer that can be applied to fruit and vegetables within a year's time. The result: the coated fruits and vegetables stay significantly longer fresh. In tests, for example, the shelf life of bananas could be extended by more than a week.Other materials for alternative packaging and substitutes for plastics are being researched, including silk, for example.",True,2022-03-16T00:00:00,2024-09-05T10:59:16,1.4,30.0,"[147, 185, 429, 209, 2004]"
85,5,F-2019-125,Nitrite in meat products,"The World Cancer Research Fund (WCRF) 2007 stated that the consumption of processed meat may be linked to colorectal cancer. The cause is said to be nitrite curing salt, which is added to many products to prevent the growth of food spoilage bacteria, especially Clostridium botulinum. Several studies have investigated this hypothesis but have come to different conclusions. A connection between high nitrite intake from meat products and an increased cancer risk can neither be clearly proven nor disproven. Moreover, it is not only the consumption of a food that plays a role in the development of the disease, but the interaction between all lifestyle habits such as diet, exercise, alcohol and cigarette consumption, etc. Nitrite is not only absorbed through cured meat products, but is also formed as a degradation product of nitrate-containing foods in the body. These are mainly plant foods, as nitrite is an intermediate product in the supply of nitrogen to the plant. Examples of nitrate-containing foods are salads and vegetables such as rocket, spinach, kohlrabi, beetroot and radish. Furthermore, nitrate converted into nitrite can react with amines, amides or amino acids (present for example in the gastrointestinal tract or in the production of meat products) to form nitrosamines. Many nitrosamines are potent genotoxic carcinogens in laboratory animals and it is assumed that many nitrosamines are also human carcinogens.",True,2019-11-14T00:00:00,2025-07-28T07:25:50,1.8,48.0,"[226, 259, 316, 1810, 394]"
147,5,F-2021-295,Plant-based substitutes - nutrients,"Milk is the main source of iodine in the UK; however, the consumption and popularity of plant-based milk alternatives is increasing. Consumers may be at risk of iodine deficiency as milk alternatives, unless fortified, have low iodine concentrations.Agroscope has also conducted a study on the nutritional quality of plant-based beverages. This revealed major differences in macro- and micronutrient composition compared to cow's milk. Many of the milk alternatives are therefore fortified with micronutrients.",False,2021-07-20T00:00:00,2024-02-26T08:33:16,1.6,10.0,"[2042, 2142, 142, 989, 2576]"
224,4,F-2023-007,Ukraine war: long-term effects on food safety,"Armed conflict is inherently destructive. Environmental damage that arises during conflict brings devastating  consequences for natural resources, critical ecosystems and people’s health, livelihoods and security. The  containment, mitigation and remediation of environmental impacts is, therefore, an essential part of response to and  recovery from conflict. These impacts may also endanger food safety, be it directly, be it indirectly.Initial information shows that Ukraine, already burdened by a host of legacy environmental challenges, is now facing a compounded, multi-dimensional environmental crisis that has either exacerbated existing issues or added new ones.  The country and the region risk being burdened with a toxic legacy long after the conflict ends.",True,2023-01-31T14:20:15,2025-09-10T08:47:56,1.25,48.0,"[1604, 768, 943, 268]"
160,4,F-2021-309,Human milk donation and associated health risks,"In the absence of a lactarium in French-speaking Switzerland, young mothers give, sell, buy, or receive breast milk. There are platforms for these exchanges on social networks, but they do not seem to be supervised by health professionals. The journalist in this article raises the microbiological and toxicological risks that the failure to respect certain basic sanitary rules (use of medication and bacterial contamination by Salmonella, Streptococcus, Staphylococcus) may represent for breast milk and therefore for the newborn. In 2022, a first lactarium will be opened, it is possible that these platforms will or will not cease to exist, but the question concerning the professional supervision of this issue remains if they continue to exist.",False,2021-08-10T00:00:00,2023-01-13T15:13:17,1.25,8.0,"[1668, 2330, 241, 1703]"
264,4,F-2024-012,Alternaria spp. mycotoxins in vegetables,"The plant disease cabbage blight in cabbage plants (Brassicaceae), e.g. cauliflower and broccoli, is caused by infestation with the fungal species Alternaria brassicae and A. brassicicola. Alternaria spp. also infest other vegetables, namely tomatoes. They produce mycotoxins, with the 'big 5', namely alternariol (AOH), alternariol monomethyl ether (AME), tenuazonic acid (TeA), tentoxin (TEN) and altenuene (ALT), being particularly problematic. These toxins have been detected in cauliflower. Other toxins are known. No maximum levels have been set for these toxins in food across Europe. The problem is being addressed; the focus of interest so far has been on tomatoes [1,2,3]. The first symptoms of cauliflower infestation are the formation of small black dots on the surface of an inflorescence. The FSVO does not consider such an incipient infestation to be a health concern. It cannot be assumed that an incipient infestation (visible through individual black dots on the surface) is accompanied by a contamination of the entire inflorescence that is hazardous to health. However, the FSVO cannot make a recommendation regarding a decision (eat or reject) based on the first visible symptoms and applicable to the layperson. The spread of mycotoxins in infested vegetables depends on the water content of the vegetable tissue. The higher the water content (e.g. tomato vs. cabbage), the faster the spread. However, there are various indiscriminate recommendations to dispose of the product if it is visibly infested. The question arises as to how the infestation progresses in cabbage vegetables, whose tissue is relatively firm, and whether there is a correlation between visible symptoms and a potential health risk. Such findings could contribute to better consumer protection.",True,2024-04-08T14:10:35,2025-03-10T14:28:53,1.0,14.0,"[1890, 1063, 1199, 1605]"
30,4,F-2019-050,Microalgae as food,"Algae have great potential as a new food source. They grow quickly, can be produced in a water-saving way and do not require fertile soil. They are rich in protein, high in omega-3 fatty acids and contain essential vitamins and minerals. They could one day replace meat and fish. Currently, chlorella and spirulina are the main food supplements on the market.",False,2019-02-22T00:00:00,2024-02-29T08:17:23,1.25,5.0,"[1577, 2280, 142, 643]"
75,4,F-2019-115,Cyanobacteria,"Cyanobacteria are microorganisms found mainly in eutrophic freshwaters, i.e. waters enriched with nutrients. While the impact of climate change has an impact on the spread of cyanobacteria, human activity, both urban and rural (fertiliser runoff, sewage, etc.) is also crucial. Cyanobacteria can release toxins some of which are very dangerous to humans. The main circumstances and routes of exposure to these toxins are ingestion of contaminated water, inhalation, or skin contact during recreational water activities (swimming, water sports). Consumption of fruits or vegetables irrigated with contaminated water or consumption of fish and shellfish can also be a source of exposure to cyanotoxins. The effects of cyanotoxins on human health are varied. Fever and gastrointestinal symptoms (nausea, vomiting) are most commonly reported, but eye or skin damage (irritation and rash), myalgia, liver and kidney damage are also often described. On the other hand, the involvement of these toxins in the development of chronic diseases, especially neurological diseases, remains the subject of scientific controversy.",True,2019-10-17T00:00:00,2025-10-08T07:15:13,1.25,36.0,"[1325, 1085, 2026, 1200]"
140,4,F-2021-287,Human gut microbiome,"The human gut microbiome is a diversified, resilient, immunostabilised, metabolically active and physiologically essential component of the human body. Scientific investigations have been conducted to explore detailed information on the establishment of the human gut microbiome, the functioning of the microbiome, the succession of the microbiome, factors influencing microbial community dynamics and the role of the gut microbiome in health and disease. Extensive research has suggested microbiome therapeutics as a futuristic medicine for various physiological and metabolic disorders. A comprehensive review of microbial colonisation, host-microbe interactions, microbial adaptation, commensal selection and immune survivability is still required to catalogue the essential genetic and physiological features for commensal engagement. The evolution of a structured human gut microbiome relies on microbial flexibility for genetic, immunological and physiological adaptation in the human gut. The key features for commensalism could be used in the development of a tailored microbiome-based therapy to overcome various physiological and metabolic disorders.The influence of the gut microbiome on human health has come increasingly into focus in recent years. The microbiome in the gut has an important function in the metabolism of food components and chemicals and also serves as a barrier against harmful effects from the environment. The microbiome is a highly diverse community of microorganisms and includes bacteria, archaea, eukaryotes, and viruses. Ongoing studies show that microbiome structure and dynamics can have both a direct (e.g., direct metabolic conversion of chemicals) and indirect (e.g., regulation of gut barrier function) impact on human and animal health. The microbiome structure and dynamics are in turn influenced by external influences, such as food or chemicals. There are now a number of studies showing an effect of additives such as artificial sweeteners or emulsifiers on the microbiome, often resulting in impaired glucose metabolism or gut inflammation (Laudisi et al. 2019, Roca-Saavedra et al. 2018). There is evidence from studies with mice that emulsifiers, for example, can disrupt gut homeostasis and lead to inflammation in the gut (Chassaing et al. 2015). Recent data also show that artificial sweeteners favour horizontal gene transfer in intestinal bacteria and thus promote the spread of antimicrobial resistance genes (Yu et al. 2021).",True,2021-11-16T00:00:00,2025-05-26T11:50:21,1.5,34.0,"[1154, 1833, 1845, 1112]"
233,4,F-2023-016,Social media and food safety risk,"Food and nutrition are popular topics in the media and on social networks. The ubiquity of social media has created new opportunities for qualified or accredited experts from the scientific community to connect with customers and the public. It has also created challenges. Health and wellness gurus, or self-proclaimed experts, use social media platforms to attract attention with compelling narratives, build an audience and influence public opinion by sharing (often) misleading information about food and nutrition. This can result in the perpetuation of misinformation, which not only undermines the proper functioning of democracy, but also diminishes support for science-based or evidence-based policies. In addition, ephemeral types of content that attract the attention of a large audience (trends) can quickly spread across major social media platforms and be replicated by more or less aware users. The use of social media can be both a threat and an opportunity for public health.",True,2023-03-13T13:01:19,2025-06-25T07:44:44,1.0,51.0,"[693, 671, 1324, 1107]"
27,4,F-2019-047,Dietary supplements,"According to Menu CH, around 50% of Swiss people regularly consume food supplements containing vitamins, minerals, trace elements or other substances. The focus of this briefing note is primarily on food supplements containing plant extracts or endogenous substances (amino acids, coenzymes, etc.) in concentrated doses, which are notyet specifically regulated in Switzerland (see legal framework). Food supplements are foods and as such must be safe and not deceptive, they must also not be pharmacologically active. This responsibility primarily lies with the manufacturers/distributors within the framework of their self-regulation. As they are available as capsules, pills, powder, etc., the presentation of food supplements is similar to that of drugs; more concretely, they are sometimes advertised similarly to drugs namely, as improving health/quality of life or are at least perceived as such by consumers. On the internet, but also in supermarkets and health food shops, products are also offered as food supplements which are to be classified as non-approved novel foods or drugs. Novel foods and medicinal products undergo an official approval procedure in which their safety to health must be proven before they can be marketed. For the other food supplements, which are not considered novel foods, no approval procedure is required. Practice shows that the specifications of such products are often unclear and the toxicity (main substance, residual extracts, contaminants) is not clarified by experts. In literature, through nutrivigilance systems and through official warnings (e.g., from the US FDA), case studies of adverse effects, of up to serious liver or kidney damage are described (e.g., with certain green tea extracts), or also interactions with drugs taken simultaneously. The number of undesirable effects that go unnoticed is estimated to be high; as the effects are often not immediately visible and thus the causal connection to previous consumption goes unnoticed. Consumers do not necessarily consult a doctor or a poison control centre, and there is no nutrivigilance system in Switzerland.Legal framework Switzerland: Most important: General food law provisions on safety and protection against deception, VNem, Ordinance on Novel Food, certain plants and substances may not be used in food (VLpH and VZVM). No nutrivigilance system (unlike France), no notification legal framework EU: Largely non-harmonised. Certain countries have specific regulations (maximum quantities, plant lists), some notification, few countries with nutrivigilance systems.",True,2019-02-11T00:00:00,2024-06-11T07:55:09,1.5,18.0,"[1164, 1257, 1483, 1737]"
128,4,F-2022-275,Bioplastic as packaging material,"As the environmental impact of the growing tide of plastic in the oceans and on land becomes more apparent, scientists are scrambling to create alternatives to petroleum-based plastics. But it has proven tricky to make bioplastics that are cheap, strong, water-resistant and break down quickly when their use is over. The race for renewable plastics has led to bioplastics made from corn starch, sugar cane, potatoes, coffee grounds, food waste, algae and wood waste powder.",False,2022-01-07T00:00:00,2022-09-06T13:17:32,1.75,3.0,"[212, 632, 2156, 1844]"
250,4,F-2023-033,Dimethylated Thioarsenates in rice,"Arsenic (As) occurrence in rice is a serious human health threat. Worldwide, regulations typically limit only carcinogenic inorganic As, but not possibly carcinogenic dimethylated oxyarsenate (DMA). However, there is emerging evidence that “DMA”, determined by routine acid-based extraction and analysis, hides a substantial share of dimethylated thioarsenates that have similar or higher cytotoxicities than arsenite. Risk assessments characterizing the in vivo toxicity of rice-derived dimethylated thioarsenates are urgently needed. In the meantime, either more sophisticated methods based on enzymatic extraction and separation of dimethylated oxy- and thioarsenates have to become mandatory or total As should be regulated.Since the publication of the 2009 EFSA opinion on arsenic in food new studies have become available on the toxic effects of organic arsenic. Furthermore it has become clear that dimethylmonothioarsenate (DMMTA) is formed from methyl arsenate due to the application of sulphate fertilisers, and that this substance could be more toxic than methylarsenate. It is therefore appropriate to update the hazard identification and characterisation of organic arsenic. On the basis of the available occurrence data for organic arsenic or literature information on organic arsenic in food, the exposure could be estimated in order to carry out an assessment for the risks for human health related to organic arsenic in food. In view of different properties of the methylated arsenic species, arsenobetaine, arsenolipids and arsenosugars, it is appropriate to assess the organic arsenic species in 2 separate opinions: an opinion on methylated arsenic species and an opinion on arsenobetaine, arsenolipids and the arsenosugars, which should also include any other possible organic arsenic species. After finalising the risk assessments on inorganic and organic arsenic, also the combined exposure to inorganic and organic arsenic should be assessed (source: Open EFSA (europa.eu))",False,2023-11-09T07:40:13,2024-01-23T07:04:35,1.0,9.0,"[933, 1027, 1014, 2180]"
