id,count,code,titel,kurzinfo,signal,erf_date,mut_date,mean_sterne,count_mut,meldung_ids
227,4,F-2023-010,Irrigation with wastewater,"As climatic changes are increasing the pressure on water resources and more fresh fruits and vegetables are needed to meet the demands of a growing population, growers may need to start depending on more varied sources of water for irrigation, including environmental, recycled, and reclaimed wastewaters. Additionally, the wastewater draining from massive pools of sewage sludge has the potential to play a role in more sustainable agriculture (Science of The Total Environment, 20.01.2023). However, this practice is not without risks as some of some of these wastewater sources might be susceptible to contamination with microbial pathogensFor instance, surveys have found Listeria monocytogenes in water, soil, vegetation, and farm animal feces around the world. The frequency at which this pathogen is present in water sources is dependent on multiple factors, including the season, surrounding land use, presence of animals, and physicochemical water parameters. Understanding the survival duration of L. monocytogenes in specific water sources is important, but studies are limited concerning this environment and the impact of these highly variable factors. Understanding the pathogen’s ability to remain infectious is key to understanding how L. monocytogenes impacts produce outbreaks and, ultimately, consumers’ health.Moreover, the German federal institute for risk assessment (BfR) has published a risk assessment of transmission of Cryptosporidium spp., Giardia duodenalis and Toxoplasma gondii to humans related to using reclaimed wastewater in agriculture where they recommend to only use irrigation water of a quality comparable to drinking water for watering plants that are usually consumed raw.",True,2023-02-28T11:35:21,2025-07-24T07:08:52,1.25,32.0,"[2243, 180, 1182, 613]"
59,4,F-2019-098,Controlled environment agriculture (CEA) (e.g Vertical Farming),"A new trend is spreading. Salads and herbs are growing directly in retail shops. Young plants are grown hors-sol in illuminated display cases. The customer harvests them himself. The concept of underground farming goes even further. Here, fish and vegetables are grown in underground, disused caverns, tunnels and underground shafts in a circular economy. This concept also aims to use less water and fewer pesticides. The first underground farm is already growing and selling salads in London.Vertical farming can play an important role in reducing emissions from the agricultural sector while providing affordable and abundant food to consumers. Vertical farming can produce high crop yield.Artificial grow lights, such as light-emitting diodes (LEDs) and fluorescent grow lights, are commonly used in modern day indoor farming, citing advantages in energy efficiency and a higher controlled environment. However, the use of LEDs poses a risk in mercury contaminations as a result of its production process, specifically LEDs with polyurethane encapsulates that were traditionally produced using mercury resins as a catalyst. The investigation found high concentrations of mercury in the LED encapsulant, and the encapsulant material was identified to be polyurethane, indicating the source of mercury contamination to be the LED polyurethane encapsulant.",True,2019-07-30T00:00:00,2025-11-11T08:26:53,1.5,60.0,"[772, 1283, 1365, 1386]"
125,3,F-2021-257,Melatonin for pre- and post-harvest treatment,"Melatonin (N-acetyl-5-methoxytryptamine) is known as a potential free radical. In a study by Li et al. (2021), the prolonged effect of the shelf life of white champignons was investigated. These had a significantly longer shelf life depending on the treatment. Melatonin also delays the leaf senescence of Chinese cabbage (Tan et al. 2020) or the yellowing of broccoli (Wu et al. 2021 or Miao et al. 2020). It is also employed in the ripening of fruit (such as tomatoes; Sun et al. 2020) or to increase the resistance of grapes (Gao et al. 2020). Melatonin is found in plant-based foods and in very small doses also in animal foods. The highest melatonin content is found in cranberries (up to 9,600 µg/100g dry weight). Other sources of melatonin are some types of mushrooms (saffron milk cap, common boletus, agaricus bisporus, chanterelle), some types of cereals (corn, rice, wheat, oat, barley), mustard seeds, dried tomatoes and peppers, and some types of wine (wikipedia).",True,2021-02-25T00:00:00,2025-10-08T08:02:56,1.0,28.0,"[1993, 2004, 2342]"
216,3,F-2022-372,Chaga mushroom (Inonotus obliquus) as natural food supplement,"Inonotus obliquus, is a fungus which is growing on trunks of birch and alder trees. In english it is called ""chaga"". It is a popular health product, with claimed therapeutic action. It is claimed to be rich in vitamins and minerals. In Estonia chaga products (pieces, powder, extracts in alcohol or water) are on the market, with more than 60 products and more than 20 producers. There is a search for export markets. Inonotus obliquus is marketed as a healthy lifestyle product, superfood and universal medicine suitable for everyone. Estonia did some analysis and concluded based on these results: 

If chaga is consumed in recommended quantities, the contents of aluminium and heavy metals (As, Cd, Ni, Pb, Sn) don’t pose health risk for adults
The oxalate contents (up to 80% of ADI) may induce the risk of kidney stones or nephropathy in adults
Due to the smaller body weigt of children: 

Possible health risks due to Ni and Pb
The exposure to Al and Cd contribute a major part of TWI
The exposure to oxalates may reach up to 352% of ADI


The concentrations of minerals are generally small (below 10% of NRV)
Concentrations of vitamins were below detection limits
",False,2022-12-19T12:13:55,2024-07-26T07:30:58,1.33,8.0,"[215, 749, 748]"
281,3,F-2024-029,Antifungal resistance,"Fungi are known for causing superficial infections of the nails, skin and hair, but they can also cause systemic infections that can have much more serious health implications. Indeed, over 6.5 million people are infected yearly with a life-threatening fungal infection, leading to 3.8 million deaths. Many of the fungal pathogens are resistant to treatment with current drugs – of which only four classes are in use – or can rapidly acquire resistance during treatment or in their natural environment. As with bacteria and antibiotic resistance, so fungi can evolve to become resistant to the drugs used to treat them. The second UN-hosted meeting on antimicrobial resistance took place on September 26, 2024. Aside from the wider acknowledgement of antimicrobial resistance, the meeting drew attention to the growing problem of fungal pathogens and their resistance to known treatments, globally. Tons of fungicides are used annually to protect crops, of which some work the same way as antifungals used in humans. An example of this is an antifungal drug class called the azoles. There is strong evidence to suggest that azole resistance in the clinic can be of environmental origin due to agriculturally used azoles.",False,2024-10-21T08:08:50,2024-10-21T17:16:22,1.67,5.0,"[252, 417, 838]"
230,3,F-2023-013,Grayanotoxin in honey,"The European Commission asked EFSA for a scientific opinion on the risks for human health of the presence of grayanotoxins (GTXs) in ‘certain honey’ from Ericaceae plants. The risk assessment included all structurally related grayananes occurring with GTXs in ‘certain’ honey. Oral exposure is associated with acute intoxication in humans. Acute symptoms affect the muscles, nervous and cardiovascular systems. These may lead to complete atrioventricular block, convulsions, mental confusion, agitation, syncope and respiratory depression. For acute effects, the CONTAM Panel derived a reference point (RP) of 15.3 μg/kg body weight for the sum of GTX I and III based on a BMDL10 for reduced heart rate in rats. A similar relative potency was considered for GTX I. Without chronic toxicity studies, an RP for long-term effects could not be derived. There is evidence for genotoxicity in mice exposed to GTX III or honey containing GTX I and III, showing increased levels of chromosomal damage. The mechanism of genotoxicity is unknown. Without representative occurrence data for the sum of GTX I and III and consumption data from Ericaceae honey, acute dietary exposure was estimated based on selected concentrations for GTX I and III reflecting concentrations measured in ‘certain’ honeys. Applying a margin of exposure (MOE) approach, the estimated MOEs raised health concerns for acute toxicity. The Panel calculated the highest concentrations for GTX I and III below which no acute effects would be expected following ‘certain honey’ consumption. The Panel is 75% or more certain that the calculated highest concentration of 0.05 mg for the sum of GTX I and III per kg honey is protective for all age groups regarding acute intoxications. This value does not consider other grayananes in ‘certain honey’ and does not cover the identified genotoxicity.",False,2023-03-06T09:24:30,2025-01-17T07:53:43,1.33,6.0,"[754, 345, 225]"
223,2,F-2023-006,Encapsulation Systems for Antimicrobial Food Packaging Components,"Antimicrobial active packaging has emerged as an effective technology to reduce microbialgrowth in food products increasing both their shelf-life and microbial safety for the consumer while maintaining their quality and sensorial properties. In the last years, a great effort has been made to develop more efficient, long-lasting and eco-friendly antimicrobial materials by improvingthe performance of the incorporated antimicrobial substances. With this purpose, more effective antimicrobial compounds of natural origin such as bacteriocins, bacteriophages and essential oils have been preferred over synthetic ones and new encapsulation strategies such as emulsions, core-shell nanofibres, cyclodextrins and liposomes among others, have been applied in order to protect these antimicrobials from degradation or volatilization while trying to enable a more controlled release and sustained antimicrobial action. This trend brought new challenges regarding the incorporation of these new products into these novel packaging materials in terms of antimicrobial-packaging material compatibilities and, the most important one, the decreased stability of these natural-based compounds as they are more prone to suffer degradation by heat and light. Furthermore, there are other losses to be faced when incorporating some of these antimicrobials in packaging materials due to their inherent volatilization.",False,2023-01-30T07:13:34,2024-02-27T13:43:57,1.5,7.0,"[264, 147]"
48,2,F-2019-078,Antimicrobial resistance in plant-based foods,"Antibiotics are essential drugs. They are used to treat diseases caused by bacteria. However, antibiotics increasingly lose their efficacy because bacteria are becoming resistant. In recent years, antibiotics have become less effective. In order to ensure their efficacy in the long run and to stem the spread of resistant bacteria, the Federal Council has adopted the comprehensive Strategy on Antibiotic Resistance (StAR), which is now being implemented in various fields. Antibiotic-resistant pathogens can also be found in foods. They can lead to increased resistance in humans. Resistance can be enhanced not only through animal products but also plant-based products. However, we have far less information on plant-based products than on animal food products. Salads are popular foods in a balanced and healthy diet. They are often sold in a ready-tp-eat packging (plastic wrapping). It is known that such fresh products can be contaminated with hygiene-relevant germs. Different research groups have shown that these products contain germs that are resistant to antibiotics.",True,2019-04-16T00:00:00,2025-06-20T07:08:16,2.0,37.0,"[568, 307]"
212,2,F-2022-368,Tara flour behind mysterious illness,"An online vegan food company says it has discovered the ingredient in one of its products that has been making consumers severely ill. Symptoms included severe gastrointestinal distress and highly elevated level of liver enzymes. Several consumers needed to have their gallbladders removed as a result. The company announced that it had identified the culprit in the French lentil & leek crumbles: Tara flour, made from the seeds of tara trees.",True,2022-10-21T11:30:03,2025-03-07T08:41:29,1.5,49.0,"[18, 637]"
235,2,F-2023-018,Detrimental impact of cellulose derivatives food additive on the gut microbiota,"Additive derivated from cellulose - such as microcrystalline cellulose (E 460), powdered cellulose (E 460), methyl cellulose (E 461), ethyl cellulose (E 462), hydroxypropyl cellulose (E 463), hydroxypropyl methyl cellulose (E 464), ethyl methyl cellulose (E 465), sodium carboxy methyl cellulose (E 466) and enzymatically hydrolysed carboxy methyl cellulose (E 469) - are often used in the food industry because of thier thechnological properties. However, since several years, these additives are controversial because of their potential adverse health effects. The EFSA stated in 2018 that they would be no safety concern at the reported uses and use levels for the unmodified and modified celluloses. However, results of a randomized Controlled-Feeding Study of Dietary Emulsifier Carboxymethylcellulose (CMC) published in 2021 support the notion that the broad use of CMC in processed foods may be contributing to increased prevalence of an array of chronic inflammatory diseases by altering the gut microbiome and metabolome. Because these additives are commonly used in meat-alternatives and regular consumer of these product would be more exposed to these additives, increasing the risk of developing inflammatory diseases.",False,2023-04-20T13:45:41,2024-05-29T16:51:44,1.5,6.0,"[1154, 445]"
265,2,F-2024-013,Functional drinks,"There are sodas made with mushrooms that supposedly improve mental clarity and juices packed with bacteria that claim to enhance digestive health. Water infused with collagen carries the promise of better skin, and energy drinks offer to help burn body fat. What started in the late 1980s with caffeine- and vitamin-laced energy drinks has grown into a multi-billion-dollar industry. Hundreds of brands are vying for consumers’ attention with increasingly exotic ingredients and wellness-focused marketing.",False,2024-04-22T12:14:50,2024-07-29T13:21:28,1.0,6.0,"[748, 1318]"
12,2,F-2018-028,Azole resistance in Aspergillus spp.,"Infections with Aspergillus spp. show a high morbidity and mortality rate in risk groups. Over 30 different species are responsible for this, but the species Aspergillus fumigatus (A. fumigatus) is the most common. Azoles, mainly triazoles, are used to prevent or treat Aspergillus spp. infections in humans and plants. Resistance of Aspergillus usually results from long-term treatments with triazoles. However, A. fumigatus has been isolated from patients who have never been treated with such drugs. It is therefore suspected that resistant strains spread in the environment. These strains may have acquired their resistance through the use of triazole-based fungicides. Azole resistance is therefore described as an emerging problem. In Germany, an increased number of aspergilloses have been observed in the last 5 years. In agriculture, resistance to Aspergillus also seems to be increasing, probably due to changes in cultivation techniques (minimum tillage) which may promote contamination and the growth of Aspergillus. Another risk is the emergence of cross-resistance. Studies have shown that resistant Aspergillus spp. are also resistant to medicinal azoles, emerging from fungicides.",True,2018-04-13T00:00:00,2024-09-05T16:22:19,1.0,16.0,"[218, 1977]"
195,2,F-2022-351,Antibiotic resistance genes in agricultural soils,"Antibiotic resistance genes may be considered as environmental pollutants if anthropogenic emission and manipulations increase their prevalence above usually occurring background levels . The prevalence of aph(3')-IIa/nptII and aph(3')-IIIa/nptIII, frequent marker genes in plant biotechnology conferring resistance to certain aminoglycosides, was determined by Woegerbauer et al. (2015) in Austrian soils from 100 maize and potato fields not yet exposed to but eligible for GMO crop cultivation . Total soil DNA extracts were analysed by nptII/nptIII-specific TaqMan real time PCR. Of all fields, 6% were positive for nptII (median: 150 copies/g soil; range: 31-856) and 85% for nptIII (1190 copies/g soil; 13-61600). The copy-number, deduced prevalence of nptIII carriers, was 14-fold higher compared to nptII. Of the cultivable kanamycin-resistant soil bacteria, 1.8% (95% confidence interval: 0-3.3%) were positive for nptIII, none for nptII (0-0.8%). The nptII-load of the studied soils was low rendering nptII a typical candidate for environmental pollution upon anthropogenic release into these ecosystems.",False,2022-07-13T00:00:00,2024-01-11T06:39:19,1.5,12.0,"[307, 2118]"
103,2,F-2021-149,Post-harvest treatment of fruit and vegetables,"Pathogenic fungi such as moulds are the main cause of plant diseases and cause an estimated 200bn CHF worth of damage in agriculture worldwide every year. A Swiss start-up wants to put an end to this problem by means of a group of substances extracted from plants of the cruciferous family, which is thought to be able to curb the evolution of various pathogenic fungi and thus extend the shelf life of numerous types of fruit and vegetables; depending on the variety, fruit and vegetables are said to stay fresh for two to four days longer.",True,2021-05-18T00:00:00,2024-03-04T07:17:17,1.5,19.0,"[794, 147]"
225,2,F-2023-008,Change of consumer behaviour due to energy costs,"A worrying fifty percent of consumers in Scotland have admitted to eating food which has passed its ‘use-by’ date in order to save money, research by Food Standards Scotland (FSS) reveals. Around 10% of respondents had changed the temperature of the thermostat in their fridge, with a further 2% turning their fridges off for a period of time to reduce energy bills. This survey of the Food Standards Scotland shows that the cost of living crisis is driving consumer behaviour with the potential to negatively impact public health.",True,2023-02-14T07:45:42,2025-01-16T15:45:52,1.0,37.0,"[1017, 943]"
64,2,F-2019-103,Milk substitutes made from cashews,"Vegan nutrition is in vogue. Companies are responding by creating new milk substitutes, including cashew nut-based ones. In Switzerland, cheese has been made from cashew nuts since 2015. 50 to 60 tonnes of organic cashews are imported from Vietnam every year. The cashew milk is processed raw and not pasteurised, only the ""ricotta"" and the products sold in the retail trade are thermised at 65 degrees to make them last longer. The concern here is that products are not necessarily pasteurised, especially as nuts can be contaminated by micro-organisms and/or pesticides. In many countries, nuts are harvested by hand and dried in the sun. Contamination can occur through insects, birds, rodents, but also through air and soil. Wet, humid conditions also pose a significant risk for the formation of aflatoxins. Nuts and seeds are known sources of salmonella, but E. coli O157 can also be frequently detected.",True,2019-10-17T00:00:00,2024-09-05T16:25:10,1.5,14.0,"[2433, 186]"
9,1,F-2018-025,Organosilicone surfactants,"Organosilicone surfactants (OSS) adjuvants are silicone-based copolymers with super –penetrating, -spreading and –wetting properties to potentiate the active ingredient against plant and animal pests and diseases. Over 700’000 tons of OSS are produced globally per year out of over 4.5 million tons of total of organosilicon production making this class of formulants the most widely used amongst all high-production chemicals for pollution worldwide. The metabolism and fate of OSS are almost unstudied on published literature. Toxic effects from OSS are observed in honeybees. Several recently published peer-reviewed journals on this topic highlight the safety concerns of organosilicone surfactant on humans and animals.",True,2018-12-19T00:00:00,2023-12-05T09:28:00,1.0,10.0,[121]
245,1,F-2023-028,Is it safe to cook with essential oils?,"Essential oils, which are extracted from plants, are best known for their use in aromatherapy, a complementary health practice that involves inhaling the scents or mixing the oils with lotion or massage oil. There has been a growing interest in other uses for these oils, however, including using them for cooking. In addition to irritating and burning the tissues of the mouth and esophagus, consuming essential oils directly can cause seizures, hallucinations, and coma. A study published in 2019 in The Medical Journal of Australia reported that toxicity from ingesting essential oils is on the rise, and “increasing frequency and severity of essential oil poisonings have been reported in Europe and the United States. Some essential oils have been linked to adverse effects when ingested, even in tiny amounts. These are particularly: Eucalyptus Oil, Sage Oil, Wintergreen Oil.",True,2023-10-11T11:14:35,2024-06-24T07:29:33,0.0,16.0,[853]
47,1,F-2019-077,Organochlorines when heating sucralose,"When foods containing sucralose are heated above 120°C, harmful substances such as organochlorines (e.g., polychlorinated dibenzodioxins, dibenzofurans, chloropropanols) can be formed through dechlorination and decomposition. The sweetener sucralose (E955) was internationally deemed as safe within the framework of the authorisation of additives and will be re-evaluated by the EFSA by the end of 2020 at the latest. The current state of knowledge (see BfR 2019) on the stability of sucralose and the decomposition products formed during heating should be taken into account. There are still many data gaps on the identity and concentration concerning these substances and the exposure estimation, and the BfR ( German Federal Institute for Risk Assessment) was not able to make a conclusive risk assessment in its statement (2019). The question arises whether measures should be taken in the meantime.",True,2019-04-16T00:00:00,2024-11-19T07:13:42,1.0,11.0,[1632]
136,1,F-2021-283,Asparagopsis taxiformis as a fodder,"Cows exhale the powerful greenhouse gas methane. One of the ways to limit methane emissions from cows is to feed them the seaweed Asparagopsis taxiformis. This seaweed contains high concentrations of bromoform, a substance that counteracts the formation of methane in the cow's rumen. Studies by Wageningen University & Research show that bromoform can get into the cow's milk and urine. Bromoform in its pure form is harmful to health. There are limits to the maximum amount of bromoform in drinking water, but no such limits for food.",False,2021-05-12T00:00:00,2022-08-26T14:56:34,1.0,5.0,[2525]
40,1,F-2019-060,Cronobacter sakazakii,"Cronobacter sakazakii is a motile, gram-negative, rod-shaped bacterium from the Enterobacteriaceae family. The bacterium has so far been detected in domestic environments and food production sites, in clinical sample material such as cerebrospinal fluid (CSF), blood or sputum, as well as in food (e.g., cheese, meat and vegetables) and animals (e.g., rats and flies). The bacterium Cronobacter sakazakii can cause life-threatening infections, especially in newborns. A Europe-wide study led by AGES has determined how frequently infections with this pathogen occur. In the process, 77 human C. sakazakii isolates from sick people from eleven European countries, of which 36 isolates were from 2017 and 41 isolates from the years before 2017, were evaluated by AGES.",False,2019-03-12T00:00:00,2025-10-13T10:26:01,1.0,10.0,[1974]
139,1,F-2021-286,Extraintestinal E. coli from poultry flocks,"Escherichia coli is one of the most important bacterial species studied, commonly found as a commensal intestinal inhabitant of humans and various animals. However, E. coli also represents an extremely versatile and diverse pathogen capable of causing infections of the gastrointestinal tract, termed intestinal pathogenic E. coli, while others, termed extraintestinal pathogenic E. coli (ExPEC), cause infections outside the gastrointestinal tract. ExPEC include the following different pathotypes based on the host and site of infection; uropathogenic E. coli (UPEC), which are responsible for urinary tract infections (UTI); avian pathogenic E. coli (APEC) causing the most common disease, colibacillosis in poultry; septicaemia-associated E. coli (SEPEC) and neonatal meningitis-causing E. coli (NMEC) responsible for septicaemia and neonatal meningitis, respectively. ExPEC infections in humans are a significant cause of morbidity or mortality and are also mainly responsible for economic losses in poultry due to reduced production. Poultry could act as a source of extraintestinal infections such as urinary tract infections, meningitis, septicaemia in humans or systemic disease in animals and pose a significant threat to food safety and human and animal health.",False,2021-05-19T00:00:00,2022-09-19T10:02:50,1.0,4.0,[1718]
263,1,F-2024-011,"Salmonella Infantis, an emerging human multidrug-resistant pathogen","Salmonella enterica serovar Infantis is a concerning human pathogen due to its widespread presence and high levels of antimicrobial resistance. A study analyzing strains from 74 countries found that a high percentage of poultry isolates exhibited multidrug resistance, attributed to the presence of the pESI megaplasmid. This highlights the potential for transmission of multidrug-resistant strains from poultry to humans, emphasizing the need for surveillance and control measures.",False,2024-03-14T08:26:04,2024-03-15T10:20:57,1.0,8.0,[1718]
