id,count,code,titel,kurzinfo,signal,erf_date,mut_date,mean_sterne,count_mut,meldung_ids
8,25,F-2018-024,Microplastics,"Microplastics are ubiquitous in various bodies of water. It is estimated that 4.8-12.7 million tonnes of plastic entered the oceans in 2010. Plastic pollution is classified as an emerging risk and poses a global threat to marine ecosystems. Various studies (and subsequent media reports) report contamination of microplastics in table salt and drinking water. The amounts vary, but there is agreement that microplastics are found in table salt in different countries. Inorganic and organic particles can adhere to microplastics, which are then absorbed by the human body through consumption of contaminated salt. In addition, various types of plastic contain plasticisers, which can have a negative impact on health.",True,2018-09-25T00:00:00,2024-09-30T08:28:10,1.44,48.0,"[1280, 1225, 1316, 1215, 1031, 1440, 1178, 1547, 1586, 1030, 1361, 1008, 1079, 1277, 1342, 1291, 1477, 1500, 1701, 1362, 1427, 1702, 1043, 1235, 1314]"
34,15,F-2018-054,Mycotoxins in foods,"Mycotoxins are metabolites formed from certain moulds. Mould – and hence mycotoxins – can form on vulnerable foods in warm and humid conditions, either whilst crops are still growing or post-harvest during storage, drying and transport. Most mycotoxins have toxic effects in humans, and some of the better characterised mycotoxins have regulatory limits in food. Certain foods are at particular risk. These include nuts and peanuts (primarily for aflatoxins) and raisins (primarily for ochratoxin A). Horizon Scan (a non-public database) has compiled a list of the most important products and has noted an increase in recalls. These findings are also supported by other stakeholders across the food chain (e.g., Biomin World Mycotoxin Survey 2018).",True,2018-12-11T00:00:00,2024-09-13T08:13:57,1.27,46.0,"[1556, 1132, 1171, 1529, 1562, 1463, 1220, 1259, 1276, 1063, 1199, 1457, 1591, 1675, 1605]"
234,13,F-2023-017,PFAS in water and soils,"During the last 20 years, guideline values for Per- and polyfluoroalkyl substances (PFAS) in drinking water, surface waters, and soils have decreased dramatically due to new insights into their toxicity. As a result, levels in environmental media are now ubiquitously above guideline levels.",False,2023-03-15T08:32:44,2024-08-30T08:15:03,1.23,28.0,"[1508, 908, 1117, 1496, 1236, 1634, 1015, 1126, 1011, 953, 952, 1345, 1713]"
51,9,F-2019-083,Surrogate meat and meat alternatives,"The consumption of meat is coming under heightened pressure, be that for religious, environmental or health reasons. Numerous publications have appeared on this topic. But what does this mean in terms of opportunities and risks in terms of food safety?Alternative protein sources, mostly not animal-based, are an upward trend. Increasing interest in vegetarian or vegan diets is only one reason for this development, concerns about the environmental and climate impacts of animal agriculture, as well as the question of how to feed a growing world population in the future, also support the search for alternative protein sources. Here are some examples: Moringa tree: a Thurgau-based company wants to extract protein from the leaves of the Moringa tree and use it for the food and feed industry. Interview in the Tagblatt. (April 2020). Algae directly consumed and processed. Insects directly consumed and processed. Fermentation: see ADURA ID 129 'Animal-free food'.",True,2019-05-27T00:00:00,2024-09-17T06:30:10,2.22,108.0,"[1395, 1159, 967, 1140, 1138, 1220, 989, 1373, 1386]"
83,7,F-2021-123,PFAS in food packaging,"Per- and polyfluorinated alkyl substances (PFAS) are industrial chemicals that are used in numerous industrial processes and consumer products, such as fire extinguishing materials. They are also popular in food packaging because the substances are water and fat repellent. However, in animal studies, some of them have been shown to be liver-damaging, toxic to reproduction and probably carcinogenic. PFAS are of particular concern because, unlike other common contaminants that pass quickly through the human body, they can linger for years and thus accumulate cumulatively. This property has given them the name ""forever chemicals"". PFASs can also enter the food chain through environmental pollution, for example when plants are supplied with contaminated water or grown in contaminated soil, such as near factories or places where products containing PFASs have been used for firefighting. From mid-2020, Denmark will be the first country to ban the use of all PFASs in food packaging.",False,2021-06-17T00:00:00,2024-10-08T08:29:00,1.14,48.0,"[908, 1015, 1126, 931, 1239, 952, 1345]"
36,7,F-2019-056,Climate change and its impact on food safety,"Climate change is likely to have a considerable impact on food safety, both direct and indirect, putting public health at risk. With changing rainfall patterns and increases in extreme weather conditions and the annual average temperature, we will begin to face the impacts of climate change. These impacts will affect the persistence and occurrence of bacteria, viruses, parasites, harmful algae, fungi and their vectors, and the patterns of their corresponding food-borne diseases and risk of toxic contamination. Alongside these impacts, chemical residues of pesticides and veterinary medicines in plant and animal products will be affected by changes in pest pressure. The risk of food contamination with heavy metals and persistent organic pollutants following changes in crop varieties cultivated, cultivation methods, soils, redistribution of sediments and long-range atmospheric transport, is increased because of climate change. Climate-sensitive risk factors and illnesses will be among the largest contributors to the global burden of food-related disease and mortality, including malnutrition, communicable, non-communicable, and diarrheal- and vector-borne diseases.",False,2019-03-05T00:00:00,2024-09-30T07:54:56,1.29,38.0,"[1673, 1562, 1085, 988, 989, 1338, 941]"
21,6,F-2019-039,Nanoplastics,"Nanoplastics, the smaller fraction than microplastics, appear to be able to cross the blood-brain barrier in fish. It is therefore probably of greater human toxicological significance than microplastics.",False,2019-01-30T00:00:00,2024-07-12T14:11:49,2.17,10.0,"[1215, 1031, 1030, 1008, 1342, 1477]"
95,6,F-2020-135,Ultraprocessed food,"Since 1980, scientific literature has reported on the links between the prevalence of certain health conditions and the high consumption of ultra-processed food (see NOVA Klassifikation for definition of ultraprocessed food). The increased consumption of this type of food may be responsible for the increase in incidence of many health conditions such as obesity, type 2 diabetes, hypertension, dyslipidaemia, loss of microbial diversity, dysbiosis, other inflammation-related diseases of the digestive system, increased risk of ischaemic heart disease, coronary heart disease and cancer. Ultra-processed foods have high energy density (energy per volume) and low nutrient density (nutrient per unit energy), making them nutritionally unbalanced. Additives are often used to improve shelf life and taste, and chemical contaminants can result from processing methods. Maximum permitted levels for food additives and contaminants are set to protect consumers, but their cumulative effects are largely unknown.",False,2020-01-06T00:00:00,2024-09-23T07:55:14,1.33,65.0,"[1154, 1225, 1163, 1136, 1408, 1191]"
93,5,F-2021-133,"Cannabinoids CBD,CBG,CBN,Δ-8 THC in foods","Foods containing extracts of hemp or cannabinoids (such as CBD) represent the current trend in Switzerland (FSVO, leaflet). The product range containing CBD includes various product categories, which are mainly sold on the internet. CBD, unlike THC (tetrahydrocannabinol), is not subject to the Federal Act on Narcotics (BetmG, SR 812.121) because it has no similar psychoactive effect. However, cannabinoids and hemp extracts are essentially novel foods, which is why they cannot be added to food as one pleases. In the USA, for a long time, the FDA had classified CBD as GRAS ('generally recognised as safe'), i.e. as a food additive, the substance was deemed to be harmless. However, this classification has now been revised and the FDA warns of possible side effects, such as liver damage, interactions with other drugs, fatigue, diarrhea and mood swings. Cannabigerol (CBG) is - similar to CBD - a non-psychoactive cannabinoid found in various cannabis species. It has a relaxing effect but does not cause drowsiness; instead, it has an energising effect. CBG is thought to have medicinal potential, for example as an anti-inflammatory or when treating pain and nausea. However, cannabinoid research has not progressed enough to support the definitive treatment potential of cannabinoids. The FOPH writes: ""Regarding the effects attributed to CBD, research is still in its infancy and it is quite impossible to confirm or deny its effects and its usefulness for clinical practice. In general, it remains to be said that its efficacy is claimed to be more promising than what has been proven, but CBD is likely to be effective for certain symptoms and disorders"".In its 2019 European Food Trends Report, the GDI states that the market for 'drinkables' and 'edibles' - foods and beverages containing cannabis - is booming. Other cannabinoids are entering the market, such as cannabigerol (CBG) . CBD is the hype of the decade - according to New Food 2020 - but with the market for cannabidiol oversaturated in the U.S., product companies will introduce other cannabinoids such as cannabinol (CBN) and cannabigerol (CBG), which are said to have functional benefits regarding sleep and appetite manipulation. According to Food News, the FDA is expected to voice its concerns about these 'cannabis-derived compounds'. However, it is still expected that they will be marketed. Inquiries about this have already reached the FSVO. Since CBD is currently becoming a trend product and is offered in various forms (as drops, as food ingredient, in cosmetics, etc.), it is quite possible that other cannabinoids such as CBG will also become popular in the future. In Ireland, poisoning in children has occured 1) after the consumption of sweets (Ir Med J Vol. 2021 Vol.114, No. 8 p446). It is also suspected that synthetic cannabinoids were used. Hence, synthetic cannabinoids are likely to pose a new risk.",True,2021-07-19T00:00:00,2024-09-27T08:55:02,1.2,52.0,"[1636, 1672, 1249, 1169, 1176]"
25,5,F-2019-045,Insects for human consumption,The microbiological safety of insects approved for consumption is the subject of various studies. These products are relatively new on the market and corresponding experience is lacking.,False,2019-01-31T00:00:00,2024-06-25T07:16:04,2.2,22.0,"[1147, 1271, 1069, 1526, 1386]"
75,3,F-2019-115,Cyanobacteria,"Cyanobacteria are microorganisms found mainly in eutrophic freshwaters, i.e. waters enriched with nutrients. While the impact of climate change has an impact on the spread of cyanobacteria, human activity, both urban and rural (fertiliser runoff, sewage, etc.) is also crucial. Cyanobacteria can release toxins some of which are very dangerous to humans. The main circumstances and routes of exposure to these toxins are ingestion of contaminated water, inhalation, or skin contact during recreational water activities (swimming, water sports). Consumption of fruits or vegetables irrigated with contaminated water or consumption of fish and shellfish can also be a source of exposure to cyanotoxins. The effects of cyanotoxins on human health are varied. Fever and gastrointestinal symptoms (nausea, vomiting) are most commonly reported, but eye or skin damage (irritation and rash), myalgia, liver and kidney damage are also often described. On the other hand, the involvement of these toxins in the development of chronic diseases, especially neurological diseases, remains the subject of scientific controversy.",False,2019-10-17T00:00:00,2024-10-01T08:08:01,1.0,13.0,"[1325, 1085, 1200]"
250,3,F-2023-033,Dimethylated Thioarsenates in rice,"Arsenic (As) occurrence in rice is a serious human health threat. Worldwide, regulations typically limit only carcinogenic inorganic As, but not possibly carcinogenic dimethylated oxyarsenate (DMA). However, there is emerging evidence that “DMA”, determined by routine acid-based extraction and analysis, hides a substantial share of dimethylated thioarsenates that have similar or higher cytotoxicities than arsenite. Risk assessments characterizing the in vivo toxicity of rice-derived dimethylated thioarsenates are urgently needed. In the meantime, either more sophisticated methods based on enzymatic extraction and separation of dimethylated oxy- and thioarsenates have to become mandatory or total As should be regulated.Since the publication of the 2009 EFSA opinion on arsenic in food new studies have become available on the toxic effects of organic arsenic. Furthermore it has become clear that dimethylmonothioarsenate (DMMTA) is formed from methyl arsenate due to the application of sulphate fertilisers, and that this substance could be more toxic than methylarsenate. It is therefore appropriate to update the hazard identification and characterisation of organic arsenic. On the basis of the available occurrence data for organic arsenic or literature information on organic arsenic in food, the exposure could be estimated in order to carry out an assessment for the risks for human health related to organic arsenic in food. In view of different properties of the methylated arsenic species, arsenobetaine, arsenolipids and arsenosugars, it is appropriate to assess the organic arsenic species in 2 separate opinions: an opinion on methylated arsenic species and an opinion on arsenobetaine, arsenolipids and the arsenosugars, which should also include any other possible organic arsenic species. After finalising the risk assessments on inorganic and organic arsenic, also the combined exposure to inorganic and organic arsenic should be assessed (source: Open EFSA (europa.eu))",False,2023-11-09T07:40:13,2024-01-23T07:04:35,1.0,9.0,"[933, 1027, 1014]"
273,3,F-2024-021,Microdosing candies,"The Food and Drug Administration is investigating nearly 50 illnesses—including one possible death—that might be linked to microdosing candies available online and at retailers nationwide. These chocolate bars and gummies showed higher than normal amounts of muscimol, a chemical found in mushrooms of the genus amanita, wich could be a potential cause of symptoms consistent with those observed in persons who became ill after eating the products",False,2024-07-04T08:58:03,2024-09-30T07:31:11,2.0,12.0,"[1672, 1590, 1475]"
27,3,F-2019-047,Dietary supplements,"According to Menu CH, around 50% of Swiss people regularly consume food supplements containing vitamins, minerals, trace elements or other substances. The focus of this briefing note is primarily on food supplements containing plant extracts or endogenous substances (amino acids, coenzymes, etc.) in concentrated doses, which are notyet specifically regulated in Switzerland (see legal framework). Food supplements are foods and as such must be safe and not deceptive, they must also not be pharmacologically active. This responsibility primarily lies with the manufacturers/distributors within the framework of their self-regulation. As they are available as capsules, pills, powder, etc., the presentation of food supplements is similar to that of drugs; more concretely, they are sometimes advertised similarly to drugs namely, as improving health/quality of life or are at least perceived as such by consumers. On the internet, but also in supermarkets and health food shops, products are also offered as food supplements which are to be classified as non-approved novel foods or drugs. Novel foods and medicinal products undergo an official approval procedure in which their safety to health must be proven before they can be marketed. For the other food supplements, which are not considered novel foods, no approval procedure is required. Practice shows that the specifications of such products are often unclear and the toxicity (main substance, residual extracts, contaminants) is not clarified by experts. In literature, through nutrivigilance systems and through official warnings (e.g., from the US FDA), case studies of adverse effects, of up to serious liver or kidney damage are described (e.g., with certain green tea extracts), or also interactions with drugs taken simultaneously. The number of undesirable effects that go unnoticed is estimated to be high; as the effects are often not immediately visible and thus the causal connection to previous consumption goes unnoticed. Consumers do not necessarily consult a doctor or a poison control centre, and there is no nutrivigilance system in Switzerland.Legal framework Switzerland: Most important: General food law provisions on safety and protection against deception, VNem, Ordinance on Novel Food, certain plants and substances may not be used in food (VLpH and VZVM). No nutrivigilance system (unlike France), no notification legal framework EU: Largely non-harmonised. Certain countries have specific regulations (maximum quantities, plant lists), some notification, few countries with nutrivigilance systems.",True,2019-02-11T00:00:00,2024-06-11T07:55:09,1.67,18.0,"[1164, 1257, 1483]"
150,3,F-2022-298,Artificial sweeteners influence microbiome,"New research shows that common artificial sweeteners can cause previously healthy gut bacteria to become sick and invade the gastrointestinal wall, potentially leading to serious health problems. The study by Shil and Chichger (2021) , published in the International Journal of Molecular Sciences, is the first to show the pathogenic effects of some of the most commonly used artificial sweeteners, saccharin, sucralose and aspartame, on two types of gut bacteria, E. coli (Escherichia coli) and E. faecalis (Enterococcus faecalis). Previous studies have shown that artificial sweeteners can change the number and type of bacteria in the gut, but this new molecular research, led by scientists at Anglia Ruskin University (ARU), has shown that sweeteners can also make the bacteria pathogenic. It was found that these pathogenic bacteria can attach to, invade, and kill Caco-2 cells, the epithelial cells that line the gastrointestinal wall. It is known that bacteria such as E. faecalis that cross the intestinal wall can enter the bloodstream and accumulate in the lymph nodes, liver, and spleen, causing a range of infections including septicaemia. In this new study, it was found that at concentrations equivalent to two cans of diet soft drink, all three artificial sweeteners significantly increased the adhesion of E. coli and E. faecalis to intestinal Caco-2 cells and differentially increased the formation of biofilms (Eurek Alert).The substance D-allulose belongs to the group of simple sugars (monosaccharides).The specific risk of favouring human pathogenic bacteria in the human body by food ingredients is to be considered as a possible ""emerging risk"". Aspartame, an artificial sweetener, has been repeatedly criticised for not being safe. This thesis has been taken up in various studies and examined by means of meta-analyses. The authors Millstone and Dawson conclude that it is premature to call aspartame 'safe' because the studies conducted by the EFSA to assess aspartame are flawed.Concerns are also raised concerning the sweetener D-allulose. The sweetness of D-allulose corresponds to about 70% of the sweeteness of household sugar (sucrose), but leads to a significantly lower calorie intake, which is why the substance is advertised as a sugar substitute. The European Food Safety Authority (EFSA) has yet to issue an opinion on the safety of D-allulose as a novel food. The BfR (German Federal Institute for Risk Assessment) reported that the use of D-allulose as a food ingredient could selectively promote the growth of bacteria of the Klebsiella genus, such as K. pneumoniae, in the human body. From a risk assessment perspective, the extent to which regular consumption of previously uncommon amounts of D-allulose as a novel food will undesirably influence the occurrence of Klebsiella spp. in the human gut microbiome remains to be scientifically determined.",True,2022-05-31T00:00:00,2024-09-12T09:37:48,1.0,27.0,"[1273, 1450, 1112]"
59,3,F-2019-098,Controlled environment agriculture (CEA) (e.g Vertical Farming),"A new trend is spreading. Salads and herbs are growing directly in retail shops. Young plants are grown hors-sol in illuminated display cases. The customer harvests them himself. The concept of underground farming goes even further. Here, fish and vegetables are grown in underground, disused caverns, tunnels and underground shafts in a circular economy. This concept also aims to use less water and fewer pesticides. The first underground farm is already growing and selling salads in London.Vertical farming can play an important role in reducing emissions from the agricultural sector while providing affordable and abundant food to consumers. Vertical farming can produce high crop yield.Artificial grow lights, such as light-emitting diodes (LEDs) and fluorescent grow lights, are commonly used in modern day indoor farming, citing advantages in energy efficiency and a higher controlled environment. However, the use of LEDs poses a risk in mercury contaminations as a result of its production process, specifically LEDs with polyurethane encapsulates that were traditionally produced using mercury resins as a catalyst. The investigation found high concentrations of mercury in the LED encapsulant, and the encapsulant material was identified to be polyurethane, indicating the source of mercury contamination to be the LED polyurethane encapsulant.",True,2019-07-30T00:00:00,2024-09-06T11:53:12,1.33,50.0,"[1283, 1365, 1386]"
264,3,F-2024-012,Alternaria spp. mycotoxins in vegetables,"The plant disease cabbage blight in cabbage plants (Brassicaceae), e.g. cauliflower and broccoli, is caused by infestation with the fungal species Alternaria brassicae and A. brassicicola. Alternaria spp. also infest other vegetables, namely tomatoes. They produce mycotoxins, with the 'big 5', namely alternariol (AOH), alternariol monomethyl ether (AME), tenuazonic acid (TeA), tentoxin (TEN) and altenuene (ALT), being particularly problematic. These toxins have been detected in cauliflower. Other toxins are known. No maximum levels have been set for these toxins in food across Europe. The problem is being addressed; the focus of interest so far has been on tomatoes [1,2,3]. The first symptoms of cauliflower infestation are the formation of small black dots on the surface of an inflorescence. The FSVO does not consider such an incipient infestation to be a health concern. It cannot be assumed that an incipient infestation (visible through individual black dots on the surface) is accompanied by a contamination of the entire inflorescence that is hazardous to health. However, the FSVO cannot make a recommendation regarding a decision (eat or reject) based on the first visible symptoms and applicable to the layperson. The spread of mycotoxins in infested vegetables depends on the water content of the vegetable tissue. The higher the water content (e.g. tomato vs. cabbage), the faster the spread. However, there are various indiscriminate recommendations to dispose of the product if it is visibly infested. The question arises as to how the infestation progresses in cabbage vegetables, whose tissue is relatively firm, and whether there is a correlation between visible symptoms and a potential health risk. Such findings could contribute to better consumer protection.",True,2024-04-08T14:10:35,2024-07-15T10:14:32,1.0,12.0,"[1063, 1199, 1605]"
35,2,F-2019-055,Nanoparticles in foods,"Nanotechnology opens up new possibilities for the food industry to modulate various aspects of food. As a result, man-made nanoparticles are increasingly being used as functional ingredients in foods and beverages. They already serve a wide variety of purposes: they give chewing gum its white colour and keep instant coffee from clumping.As far as health concerns go, something is particularly questionable with regard to these substances: can the particles, due to their small size, penetrate barriers that are actually supposed to protect against intruders? An American study has shown that manganese oxide nanoparticles were able to penetrate the brain via the nose of test animals.Consumers are concerned about the possibly carcinogenic and in the long run harmful substances.On the other hand, the targeted use of nanoparticles for health promotion is being discussed. One study shows how nanoparticles can positively influence bacteria of the digestive tract. They speak of ""probiotic nanoparticles"". Nanoparticles are also already being used in pharmacy, for example to precisely transport substances to where they are needed.",True,2019-10-18T00:00:00,2024-06-27T12:17:25,1.0,20.0,"[1041, 1586]"
