id,count,bezeichnung_de,bezeichnung_fr,bezeichnung_it,bezeichnung_en,mean_sterne,meldung_ids
18,45,Diverse Lebensmittel,Aliments divers,Diverse derrate alimentari,Miscellaneous,1.22,"[2053, 2061, 2062, 2004, 2055, 2087, 2096, 2101, 2113, 2114, 2065, 2134, 2138, 2131, 2118, 2196, 2176, 2277, 2228, 2235, 2248, 2265, 2259, 2318, 2321, 2320, 2287, 2319, 2328, 2369, 2409, 2411, 2430, 2451, 2464, 2468, 2325, 2524, 2526, 2522, 2631, 2634, 2591, 2655, 2667]"
8,27,"Fleisch, Fleischprodukte und Fleischersatz","Viandes, produits à base de viande et substituts de viande","Carne, prodotti di carne e sostituti della carne","Meat, Meat Products And Substitutes",1.33,"[1986, 2005, 2036, 2007, 2079, 2089, 2157, 2149, 2213, 2187, 2334, 2360, 2292, 2309, 2332, 2382, 2011, 2475, 2494, 2442, 2399, 2457, 2488, 2497, 2570, 2523, 2661]"
9,18,"Fische, Meeresfrüchte, Amphibien und Reptilien","Poissons, fruits de mer, amphibiens et reptiles","Pesce, crostacei, frutti di mare e anfibi","Fish, Shellfish And Amphibians",1.11,"[2028, 2025, 2102, 2119, 2205, 2203, 2231, 2253, 2365, 2308, 2333, 2341, 2404, 2421, 2534, 2581, 2597, 2654]"
6,16,"Milch, Milchprodukte und Milchersatzprodukte","Laits, produits laitiers et substituts de lait","Latte, latticini e succedanei del latte",Dairy Products And Substitutes,1.38,"[1985, 2032, 2085, 2206, 2250, 2255, 2257, 2273, 2300, 2320, 2403, 2379, 2393, 2399, 2535, 2678]"
60,14,Fische,Poissons,Pesce,Fish,1.36,"[2108, 2200, 2245, 2221, 2271, 2344, 2356, 2290, 2320, 2419, 2429, 2508, 2653, 2459]"
54,11,Geflügel,Volailles,Pollame,Poultry,1.36,"[1989, 2076, 2174, 2173, 2455, 2516, 2604, 2629, 2130, 2650, 2674]"
3,9,Gemüse,Légumes,Ortaggi,Vegetables,1.44,"[1990, 2239, 2270, 2357, 2293, 2314, 2407, 2424, 2472]"
1,8,Nicht spezifiziert,Non spécifié,Non specificato,Unclassified,1.62,"[2002, 2031, 2041, 2110, 2303, 2467, 2532, 2500]"
34,8,Früchte,Fruits,Frutta,Fruits,1.38,"[1990, 2014, 2227, 2239, 2337, 2342, 2391, 2472]"
82,8,Wasser,Eau,Acqua,Waters,1.25,"[2039, 2112, 2143, 2164, 2185, 2310, 2320, 2479]"
42,7,Käse,Fromages,Formaggi,Cheeses (Including Spread Cheeses),1.43,"[2187, 2271, 2281, 2364, 2474, 2484, 2582]"
23,5,"Blattgemüse (ohne Kohlgemüse), Blattsalate und Algen","Légumes-feuilles (excl. chou), mescluns et algues","Verdure a foglie (esclusi cavoli), insalate a foglie e alghe",Leafy Vegetables (Except Cabbages),1.6,"[2226, 2259, 2332, 2328, 2465]"
38,4,"Milch, Milchgetränke und fermentierte Milchgetränke","Laits, boissons à base de lait ou de lait fermenté","Latte, bevande a base di latte e di latte fermentato","Milk, Milk Beverages And Fermented Milk Beverages",1.25,"[2006, 2030, 2322, 2484]"
56,4,Fleisch- und Wurstwaren (verarbeitetes Fleisch),Charcuterie,Prodotti di carne e insaccati (carne trasformata),Processed Meat,1.5,"[2027, 2271, 2538, 2542]"
5,4,"Früchte, Nüsse und Samen","Fruits, fruits oléagineux et graines","Frutta, frutta oleaginosa e semi","Fruits, Nuts And Seeds",1.25,"[2044, 2081, 2219, 2410]"
118,4,Rind,Boeuf,Manzo,Beef,1.0,"[2257, 2379, 2454, 2446]"
30,3,Blattstiel- und Stängelgemüse sowie Keimlinge und Sprossen,"Légumes-tiges, germes et pousses",Ortaggi a stelo e germogli,"Stalk Vegetables, Sprouts",1.33,"[2073, 2049, 2412]"
93,3,"Gewürze, Kräuter und Aromastoffe","Epices, herbes et aromates","Spezie, erbe e aromi","Spices, Herbs And Flavourings",2.0,"[1990, 2401, 2460]"
120,3,Schwein,Porc,Maiale,Pork,1.33,"[2138, 2263, 2289]"
35,3,Nüsse und Samen (inkl. Aufstriche und Pasten),Fruits oléagineux et graines (incl. beurre),Frutta oleaginosa e semi (inclusi prodotti da spalmare e paste),Nuts And Seeds (+ Nut Spread),1.33,"[2181, 2338, 2610]"
24,3,Blüten- und Fruchtgemüse,Légumes-fruits,"Ortaggi da fiore, verdura a frutti ",Fruiting Vegetables,1.0,"[2395, 2423, 2499]"
10,2,Eier und Eiprodukte,Oeufs et dérivés,Uova e prodotti di uova,Eggs And Egg Products,1.0,"[2076, 2336]"
100,2,Diätprodukte und Sportlernahrung,Produits diététiques et aliments pour sportifs,Prodotti dietetici e alimenti per sportivi,Dietetic Products,1.0,"[2013, 2664]"
26,2,Kohlgemüse,Choux,Cavoli,Cabbages,1.0,"[2040, 2012]"
22,2,Nicht spezifizierte sowie gemischte Gemüse und Salate,Légumes et salades non spécifiés ou mélangés,Insalate e ortaggi misti non specificati,"Unclassified, Mixed Salad/Vegetables",1.5,"[2014, 2554]"
27,2,Pilze,Champignons,Funghi,Mushrooms,2.0,"[2190, 2471]"
48,2,"Teigwaren, Reis, andere Getreide und Körner","Pâtes alimentaires, riz, autres céréales et graines","Pasta, riso, altri cereali e grani","Pasta, Rice, Other Grain",1.5,"[2207, 2453]"
58,2,Fleischersatz,Substituts de viande,Sostituti della carne,Meat Substitutes,1.0,"[2329, 2632]"
139,1,Schokoriegel,Barres de chocolat,Barrette di cioccolato,Chocolate Candy Bars,1.0,[2072]
133,1,Honig,Miel,Miele,Honey,1.0,[2098]
43,1,"Desserts auf Milchbasis (z.B. Crème, Mousse, Pudding; ohne Speiseeis)","Desserts lactés (p.ex. crème, mousse, pudding; sans glace) ","Dessert a base di latte (p.e. crema, mousse, budini; esclusi gelati)","Cream Desserts, Puddings (Milk Based)",1.0,[2080]
13,1,"Cakes, Kuchen, Torten, süsse Wähen, Patisserie und Feingebäck","Cakes, gâteaux, tartes sucrées, pâtisseries et petits fours","Cake, torte, prodotti di confetteria e panetteria fine",Cakes And Sweet Biscuits,1.0,[2104]
126,1,Huhn und Hähnchen,"Poule, poulet","Pollo, gallina","Chicken, Hen",1.0,[2275]
21,1,Kartoffeln,Pommes de terre,Patate,Potatoes,1.0,[2270]
62,1,Fischprodukte und panierter Fisch,Produits à base de poissons et poissons panés,Prodotti della pesca e pesce impanato,"Fish Products, Fish In Crumbs",2.0,[2352]
50,1,Frühstückscerealien,Céréales du petit-déjeuner,Cereali per la colazione,Breakfast Cereals,1.0,[2328]
76,1,"Cakes, Kuchen, Torten, süsse Wähen, Patisserie sowie weiches oder gefülltes Feingebäck","Cakes, gâteaux, tartes sucrées, pâtisseries et petits fours mollets ou fourrés","Cake, torte, prodotti di confetteria e panetteria fine, molli o farciti","Cakes, Pies, Pastries, Puddings (Non Milk",1.0,[2339]
115,1,"Brot, Brötchen und Gipfel","Pains, petits pains et croissants","Pane, panini e croissant","Bread, Croissants",1.0,[2353]
113,1,Sorbet und Wasserglace,Sorbets et glaces à l'eau,Sorbetto e ghiacciolo,Sorbet/Water Ice,1.0,[2415]
98,1,Nicht spezifizierte sowie gemischte diverse Lebensmittel,Aliments divers non spécifiés ou mélangés,Vari alimenti non classificati o misti,Unclassified Or Combined Miscellaneous Foods,1.0,[2493]
7,1,"Getreide, Getreideprodukte und Körner",Céréales et produits céréaliers,Cereali e prodotti cereali,Cereals And Cereal Products,2.0,[2431]
81,1,"Kaffee, Tee, Frucht- und Kräutertee","Café, thé, tisane aux fruits et aux herbes","Caffè, tè, tè di frutti e di erbe","Coffee, Tea And Herbal Teas",1.0,[2397]
14,1,Alkoholfreie Getränke,Boissons sans alcool,Bevande analcoliche,Non Alcoholic Beverages,1.0,[2638]
99,1,Vegetarische Produkte und Gerichte,Produits et plats végétariens,Prodotti/piatti vegetariani,Vegetarian Products/Dishes,1.0,[2643]
