id,count,bezeichnung_de,bezeichnung_fr,bezeichnung_it,bezeichnung_en,mean_sterne,meldung_ids
79,1,Frucht- und Gemüsesäfte,Jus de fruits et de légumes,Succhi di frutta e di verdura,Fruit And Vegetable Juices,1.0,[1883]
3,1,Gemüse,Légumes,Ortaggi,Vegetables,1.0,[1890]
7,1,"Getreide, Getreideprodukte und Körner",Céréales et produits céréaliers,Cereali e prodotti cereali,Cereals And Cereal Products,1.0,[1890]
54,1,Geflügel,Volailles,Pollame,Poultry,1.0,[1896]
8,1,"Fleisch, Fleischprodukte und Fleischersatz","Viandes, produits à base de viande et substituts de viande","Carne, prodotti di carne e sostituti della carne","Meat, Meat Products And Substitutes",1.0,[1897]
56,1,Fleisch- und Wurstwaren (verarbeitetes Fleisch),Charcuterie,Prodotti di carne e insaccati (carne trasformata),Processed Meat,1.0,[1899]
6,1,"Milch, Milchprodukte und Milchersatzprodukte","Laits, produits laitiers et substituts de lait","Latte, latticini e succedanei del latte",Dairy Products And Substitutes,1.0,[1900]
