id,count,code,titel,kurzinfo,signal,erf_date,mut_date,mean_sterne,count_mut,meldung_ids
58,1,F-2021-097,Food platforms and delivery services,"What has found its way into other domains is also spreading in the food sector. Platforms offer consumers the possibility of having their food delivered and ready-to-eat by the restaurant of their choice, whereby different people in the same household can have a wide variety of dishes delivered to their home at the same time (e.g., smood.ch). Another option is to go eat at someone's place who offers their services on an internet platform (e.g., de.eatwith.com); yet another option is to have someone cook for you at home (e.g., deinkoch.ch). There are numerous delivery platforms, such as: Uber Eats, Deliveroo, Blue Apron, Amazon restaurants, GrubHub, Eat street, just eat, etc. In contrast to already existing offers, 'ghost kitchens' are establishing themselves, which uniquely produce on an industrial scale for delivery services and deliver to customers. A dining room with guests is no longer needed. Production and delivery can be industrialised using robots and drones. Bank analysts assume that there is great growth potential. Some providers go even further, they try to no longer use packaging materials. The German app Vanilla Bean, for example, plans to launch a packaging-free delivery service as soon as autumn 2019.",True,2021-06-29T00:00:00,2025-07-25T07:10:30,1.0,14.0,[2880]
36,1,F-2019-056,Climate change and its impact on food safety,"Climate change is likely to have a considerable impact on food safety, both direct and indirect, putting public health at risk. With changing rainfall patterns and increases in extreme weather conditions and the annual average temperature, we will begin to face the impacts of climate change. These impacts will affect the persistence and occurrence of bacteria, viruses, parasites, harmful algae, fungi and their vectors, and the patterns of their corresponding food-borne diseases and risk of toxic contamination. Alongside these impacts, chemical residues of pesticides and veterinary medicines in plant and animal products will be affected by changes in pest pressure. The risk of food contamination with heavy metals and persistent organic pollutants following changes in crop varieties cultivated, cultivation methods, soils, redistribution of sediments and long-range atmospheric transport, is increased because of climate change. Climate-sensitive risk factors and illnesses will be among the largest contributors to the global burden of food-related disease and mortality, including malnutrition, communicable, non-communicable, and diarrheal- and vector-borne diseases.",False,2019-03-05T00:00:00,2026-05-06T07:11:13,2.0,52.0,[2882]
13,1,F-2018-029,Cyclospora,"Cyclospora infection is an intestinal disease caused by a unicellular parasite. Humans can be infected by the fecal-oral route; most commonly via contaminated water or food treated with it (such as salads, berries, herbs, etc.). In 2017 and 2018, several outbreaks occurred in the United Kingdom and the United States. In each of these outbreaks, numerous people fell ill. As a result, various food products were withdrawn from the market. International companies have also been affected. The list of outbreaks is long and seems to have been increasing in recent years.",True,2018-12-17T00:00:00,2026-01-13T07:43:39,1.0,22.0,[2891]
34,1,F-2018-054,Mycotoxins in foods,"Mycotoxins are metabolites formed from certain moulds. Mould – and hence mycotoxins – can form on vulnerable foods in warm and humid conditions, either whilst crops are still growing or post-harvest during storage, drying and transport. Most mycotoxins have toxic effects in humans, and some of the better characterised mycotoxins have regulatory limits in food. Certain foods are at particular risk. These include nuts and peanuts (primarily for aflatoxins) and raisins (primarily for ochratoxin A). Horizon Scan (a non-public database) has compiled a list of the most important products and has noted an increase in recalls. These findings are also supported by other stakeholders across the food chain (e.g., Biomin World Mycotoxin Survey 2018).",True,2018-12-11T00:00:00,2026-02-17T08:01:32,1.0,65.0,[2891]
43,1,F-2019-063,Hepatitis E virus (HEV),"Hepatitis E virus (HEV) is an important human infection in the EU/EEA countries and, according to EFSA, more than 21,000 acute clinical cases with 28 deaths have been reported in the last 10 years, with a tenfold increase in the total number of HEV cases reported; the majority (80%) of cases were reported in France, Germany and the UK. However, as human infections are not notifiable in all Member States and surveillance varies from country to country, the number of reported cases is not comparable and the actual number of cases may be higher. Food-borne transmissions of HEV appear to be one of the main routes in Europe; pigs and wild boar are the main source of HEV, but deer may also be infected. There is a particular risk related to the consumption of pig liver and raw meat products. Recently, HEV has been detected in shellfish and their production environment (seawater) in Italy. HEV can also enter food through faecal contamination. Outbreaks and sporadic cases have been identified in immunocompetent individuals as well as in recognised risk groups, such as those with pre-existing liver damage, immunosuppressive diseases or immunosuppressive treatments.",True,2019-05-10T00:00:00,2026-04-14T07:18:33,1.0,40.0,[2871]
178,1,F-2022-334,Protozoan parasites in foods,"Parasitic protozoa are important pathogens in humans and animals. Due to their complex life cycles, different transmission routes and longer periods between infection and symptoms, the public health burden and the relative importance of different transmission routes are often difficult to assess. Protozoa are unicellular, eukaryotic organisms. There are about 40 known human pathogenic species. They include cryptosporidia, giardia, microsporidia, toxoplasma, balantidium coli, entamoeba histolytica, blastocystis. Cryptosporidia and Giardia are considered the main cause of diarrhoeal diseases in humans worldwide. Toxoplasmas, for example, were ranked as the pathogens with the highest risk in a comparative assessment by the Biological Hazards Panel of the Norwegian Scientific Committee for Food and Environment in 2021. In pets, coccidia, toxoplasma, cryptosporidia and giardia are the main ones. In addition to consumer exposure to protozoan parasites through animal contact or contaminated water, foodborne transmission is also possible.",True,2022-08-03T00:00:00,2025-11-24T15:15:20,1.0,38.0,[2884]
12,1,F-2018-028,Azole resistance in Aspergillus spp.,"Infections with Aspergillus spp. show a high morbidity and mortality rate in risk groups. Over 30 different species are responsible for this, but the species Aspergillus fumigatus (A. fumigatus) is the most common. Azoles, mainly triazoles, are used to prevent or treat Aspergillus spp. infections in humans and plants. Resistance of Aspergillus usually results from long-term treatments with triazoles. However, A. fumigatus has been isolated from patients who have never been treated with such drugs. It is therefore suspected that resistant strains spread in the environment. These strains may have acquired their resistance through the use of triazole-based fungicides. Azole resistance is therefore described as an emerging problem. In Germany, an increased number of aspergilloses have been observed in the last 5 years. In agriculture, resistance to Aspergillus also seems to be increasing, probably due to changes in cultivation techniques (minimum tillage) which may promote contamination and the growth of Aspergillus. Another risk is the emergence of cross-resistance. Studies have shown that resistant Aspergillus spp. are also resistant to medicinal azoles, emerging from fungicides.",True,2018-04-13T00:00:00,2024-09-05T16:22:19,1.0,16.0,[2894]
