id,count,code,titel,kurzinfo,signal,erf_date,mut_date,mean_sterne,count_mut,meldung_ids
43,2,F-2019-063,Hepatitis E virus (HEV),"Hepatitis E virus (HEV) is an important human infection in the EU/EEA countries and, according to EFSA, more than 21,000 acute clinical cases with 28 deaths have been reported in the last 10 years, with a tenfold increase in the total number of HEV cases reported; the majority (80%) of cases were reported in France, Germany and the UK. However, as human infections are not notifiable in all Member States and surveillance varies from country to country, the number of reported cases is not comparable and the actual number of cases may be higher. Food-borne transmissions of HEV appear to be one of the main routes in Europe; pigs and wild boar are the main source of HEV, but deer may also be infected. There is a particular risk related to the consumption of pig liver and raw meat products. Recently, HEV has been detected in shellfish and their production environment (seawater) in Italy. HEV can also enter food through faecal contamination. Outbreaks and sporadic cases have been identified in immunocompetent individuals as well as in recognised risk groups, such as those with pre-existing liver damage, immunosuppressive diseases or immunosuppressive treatments.",True,2019-05-10T00:00:00,2025-08-08T08:32:58,2.0,36.0,"[2303, 2289]"
10,2,F-2018-026,Shiga toxin-producing E. coli in flour,"STEC from different types of flour have caused epidemics in CAN (O121) and the USA (O121, O26). Several  product recalls were issued in the USA. Based on the publication by Mäde et al. (2017), investigations were also carried out at the FSVO which confirmed the findings (detection of STEC in types of flour).",True,2018-04-13T00:00:00,2024-01-19T07:25:05,1.5,18.0,"[2314, 2322]"
36,2,F-2019-056,Climate change and its impact on food safety,"Climate change is likely to have a considerable impact on food safety, both direct and indirect, putting public health at risk. With changing rainfall patterns and increases in extreme weather conditions and the annual average temperature, we will begin to face the impacts of climate change. These impacts will affect the persistence and occurrence of bacteria, viruses, parasites, harmful algae, fungi and their vectors, and the patterns of their corresponding food-borne diseases and risk of toxic contamination. Alongside these impacts, chemical residues of pesticides and veterinary medicines in plant and animal products will be affected by changes in pest pressure. The risk of food contamination with heavy metals and persistent organic pollutants following changes in crop varieties cultivated, cultivation methods, soils, redistribution of sediments and long-range atmospheric transport, is increased because of climate change. Climate-sensitive risk factors and illnesses will be among the largest contributors to the global burden of food-related disease and mortality, including malnutrition, communicable, non-communicable, and diarrheal- and vector-borne diseases.",False,2019-03-05T00:00:00,2025-05-26T06:47:48,1.5,44.0,"[2325, 2321]"
11,2,F-2018-027,Vibrio spp. in seafood,"V. vulnificus and V. parahaemolyticus are marine bacterial microorganisms that can occur in seawater, especially at warmer temperatures. They are the main cause of bacterial diseases caused by seafood. These pathogens are regularly detected in the USA and Asia. In Europe, the pathogen is hardly ever found. There are fears that these pathogens will become increasingly important as the oceans warm up. The severity of the diseases caused by V. vulnificus can be described as very severe. According to literature, the lethality rate is over 50% after infection. This makes it one of the most serious pathogens in terms of lethality in the area of food-borne diseases. The FDA regulation expresses this with a zero tolerance. In the EU and Switzerland, there is no regulation of this pathogen. In addition, various publications report the multiple development of antibiotic resistance in these pathogens, caused by the use of antibiotics in aquacultures. Environmental and patient isolates show similar resistance profiles. These included resistance to ampicillin, penicillin and tetracycline. HorizonScan: Since 1999, 250 reports of Vibrio spp. in shrimp have been recorded.",True,2018-12-20T00:00:00,2025-08-04T06:53:33,1.0,49.0,"[2290, 2341]"
116,2,F-2021-232,Anisakis spp.: a parasite with allergic potential,"The consumption of raw or undercooked fish poses a potential risk of contamination with Anksakis spp., a parasitic helminth, that can cause anisakidosis in humans. Swiss legislation requires fish that is to be consumed raw must be subjected to a treatment that inactivates the larvae of Anisakis. However, the larvae, even when dead, pose an allergenic risk to some consumers. Allergic and anaphylactic symptoms have been observed with increasing frequency, even after eating well-cooked fish. There is now evidence that the digestion of material from dead parasites in food also poses a risk (J. Ivanović J. et al, 2017); indeed, some Anisakis allergens are heat-stable and resistant to pepsin (Morozińska-Gogol J. et al., 2019).",True,2021-01-05T00:00:00,2025-08-08T08:04:42,1.5,27.0,"[2344, 2345]"
267,1,F-2024-015,Avian flu: WHO warns of a high concentration of the HPAI (H5N1) virus in milk from contaminated cows,"The World Health Organization (WHO) has reported 889 human cases of avian flu in 23 countries between 2023 and April 1, 2024, with a case fatality rate of 52%. Traces of the H5N1 virus were found in cow's milk in the United States, prompting the WHO to recommend the consumption of pasteurized milk and to conduct studies on the virus's survival in milk. The virus has been found to spread to mammals, including cows and goats, and there has been a case of cow-to-human transmission in Texas. While human infections remain rare and there is no evidence of human-to-human transmission, health officials are concerned about the potential for the virus to mutate and spread more easily among humans.",False,2024-04-25T08:27:48,2025-08-08T15:48:46,2.0,66.0,[2300]
263,1,F-2024-011,"Salmonella Infantis, an emerging human multidrug-resistant pathogen","Salmonella enterica serovar Infantis is a concerning human pathogen due to its widespread presence and high levels of antimicrobial resistance. A study analyzing strains from 74 countries found that a high percentage of poultry isolates exhibited multidrug resistance, attributed to the presence of the pESI megaplasmid. This highlights the potential for transmission of multidrug-resistant strains from poultry to humans, emphasizing the need for surveillance and control measures.",False,2024-03-14T08:26:04,2024-03-15T10:20:57,1.0,7.0,[2309]
232,1,F-2023-015,Persistent Listeria monocytogenes strains in food environments,Specific Listeria monocytogenes (Lm) genotypes are adapted to meat and dairy processing environments. Genome analysis identified slaughterhouse as a Lm contamination source for meat processing facilities. Several events of Lm persistence over four years were identified in food processing facilities in Italy. Persistence seems not to be related to specific Lm genotypes.,False,2023-03-10T08:20:25,2025-07-23T07:01:10,1.0,41.0,[2319]
51,1,F-2019-083,Surrogate meat and meat alternatives,"The consumption of meat is coming under heightened pressure, be that for religious, environmental or health reasons. Numerous publications have appeared on this topic. But what does this mean in terms of opportunities and risks in terms of food safety?Alternative protein sources, mostly not animal-based, are an upward trend. Increasing interest in vegetarian or vegan diets is only one reason for this development, concerns about the environmental and climate impacts of animal agriculture, as well as the question of how to feed a growing world population in the future, also support the search for alternative protein sources. Here are some examples: Moringa tree: a Thurgau-based company wants to extract protein from the leaves of the Moringa tree and use it for the food and feed industry. Interview in the Tagblatt. (April 2020). Algae directly consumed and processed. Insects directly consumed and processed. Fermentation: see ADURA ID 129 'Animal-free food'.",True,2019-05-27T00:00:00,2025-03-07T07:40:51,1.0,112.0,[2329]
23,1,F-2019-043,Escherichia coli ST131 as a uropathogen,"In 2008, a previously unknown Escherichia coli clonal group, sequence type 131 (ST131), was identified on three continents. Today, ST131 is the predominant E. coli lineage among extra-intestinal pathogenic E. coli (ExPEC) isolates worldwide. Retrospective studies have suggested that it may originally have risen to prominence as early as 2003. ST131 isolates are commonly reported to produce extended-spectrum beta-lactamases, such as CTX-M-15, and almost all are resistant to fluoroquinolones. Moreover, ST131 E. coli isolates are considered to be truly pathogenic, due to the spectrum of infections they cause in both community and hospital settings, and the large number of virulence-associated genes they contain. Previous investigations appeared to exonerate retail meat as a source of human exposure to ST131; recently in the United States, a 1-year prospective study of E. coli from meat products and clinical cultures showed that E. coli ST131 strains are shared by both clinical samples from extra-intestinal human infections and meat samples from poultry.",True,2019-01-30T00:00:00,2024-01-30T09:34:46,2.0,27.0,[2314]
181,1,F-2022-337,Safety of probiotics,"The microbiome affects the initiation and progression of cancerous tumours through direct effects on tumour cells, and indirectly through manipulation of the immune system. It can also determine the response to cancer therapies and predict disease progression and survival (Jain et al., 2021). There is vast literature on the beneficial effects of probiotics for the prevention and treatment of cancer. A review of the available literature on the subject was published in 2022. The authors conclude that probiotics have been shown to be effective against various types of cancer, but also that there is a need to evaluate the adverse effects of probiotics (gastrointestinal side effects, skin reactions, access to antibiotic resistance genes, harmful effects of metabolites, abnormal stimulation of the immune system) (Sankarapandian et al., 2022). Cancer patients have compromised immunity due to primary disease, chemotherapy, and radiotherapy. The effects of probiotics in this population may differ from those in healthy individuals and raise several critical issues (Lu et al., 2021). A new publication states that Lactobacillus can alter the function of immune cells (macrophages) in the pancreatic tumour environment and stimulate cancer growth (Hezaveh et al., 2022). The mechanism involves the metabolisation of dietary tryptophan by bacteria in the gut, which leads to an inactivation of immune cells involved in tumour control. This is not the only indication of potentially harmful effects of probiotic microorganisms, even independently of the presence of cancer. Among others:

Although probiotic bacteria are generally recognised as safe (GRAS status), there are several reports of side effects triggered by the presence of these organisms: systemic infections, impact on the immune system, disruption of metabolism and horizontal gene transfer (Zawistowska-Rojek and Tyski, 2018).
Brain fog syndrome has been reported to be related to probiotic use, with symptoms improving with antibiotics and probiotic discontinuation (Rao et al., 2018).
Fungemia and other fungal infections have been associated with the use of probiotic supplements based on Saccharomyces boulardii (Rannikko et al., 2021).
",True,2022-03-17T00:00:00,2025-07-14T08:25:18,1.0,38.0,[2287]
236,1,F-2023-019,Antimicrobial resistance genes in probiotic bacteria,"Antimicrobial resistance (AMR) is a major threat to public health. In bacteria, AMR depends on antibiotic resistance genes (ARGs), some of which are mobile and can transfer their ARGs to other bacteria. This action, known as horizontal gene transfer (HGT), involves the transfer of small fragments of DNA between bacteria and is facilitated by plasmids, among other things. If bacteria with mobile ARGs are found in food, they can transmit these ARGs to bacteria in the human digestive tract or to pathogens when ingested, contributing to the emergence of drug-resistant bacteria. Although the extent to which probiotics modulate the microbiome is disputed, it is possible that they contribute to the intestinal resistome by colonising the gut. A recent study conducted in Europe, analysing in detail probiotic bacterial species commonly used in certain foods (fermented and non-fermented) and dietary supplements, suggests that consumption of certain probiotic bacterial strains could contribute to the onset and spread of AMR, as in more than half of AGR-positive samples, at least one gene is linked to a plasmid. The results are consistent with another study concluding that the consumption of probiotic products can lead to the transfer of AGRs to human intestinal bacteria. Similarly, probiotics used to feed livestock can also cause antibiotic-resistant THG in animals. Animals treated with these resistant probiotics are likely to become a possible source of ARG for human consumers after ingestion of meat or dairy products.",True,2023-05-02T10:47:28,2025-07-14T08:24:35,1.0,18.0,[2287]
190,1,F-2022-346,Tick-borne meat allergy,"Meat allergy was first observed in the 1990s and formally described in 2009, which makes it a relatively recent arrival to the compendium of allergic conditions. Its most curious quality may be that it is seemingly triggered by a tick bite. In America, the culprit, called the lone-star tick, females have a distinctive white splotch on their backs, is common in the warm and humid Southeast, where most cases of meat allergy have been diagnosed.This syndrome is called AlphaGal syndrome (AGS). Individuals are allergic to a sugar molecule, which does not occur in humans but is on a large number of cells in all other mammals. It is a sugar with the name galactose-alpha-1,3 galaktose, or alpha-galactose, or alpha-gal for short. AGS patients develop a disease after eating mammalian meat, dairy products or even cosmetics containing animal ingredients. Allergy symptoms: from thick lips, shortness of breath and itchy skin to circulatory problems and unconsciousness. Many suffer from abdominal pain, nausea and diarrhoea.",False,2022-05-09T00:00:00,2025-08-07T08:20:17,2.0,12.0,[2344]
239,1,F-2023-022,Helicobacter pylori in raw and ready-to-eat meat,"Helicobacter pylori, classified as a class-I carcinogen, is one of the leading medical pathogens of global concern associated mainly with the development of gastric adenocarcinomas and gastric mucosa-associated lymphoid tissue lymphomas; nevertheless, its prevalence in food especially meat and meat products is not fully covered. A study investigated the prevalence, molecular characterization, and antimicrobial resistance profiles of clarithromycin-, and metronidazole-resistant H. pylori isolated from raw and ready-to-eat meat samples retailed in Mansoura city, Egypt. The results showed a widespread contamination of examined raw and ready-to-eat meat product samples with multidrug-resistant H. pylori isolates, which could constitute a tremendous public health hazard.",True,2023-07-26T11:34:05,2025-07-08T09:10:32,1.0,40.0,[2320]
257,1,F-2024-005,Extended-spectrum β-lactamase-producing Enterobacterales in raw seafood,"The extended-spectrum β-lactamase (ESBL)-producing Enterobacterales (ESBL-EB) encompass several important human pathogens and are found on the World Health Organization (WHO) priority pathogens list of antibiotic-resistant bacteria. They are a group of organisms which demonstrate resistance to third-generation cephalosporins (3GC) and their presence has been documented worldwide, including in aquaculture and the aquatic environment.  The risk profile found that Enterobacterales and ESBL-EB have been found in multiple aquatic environments, as well as multiple host species and production levels. The unmonitored and excessive use of antibiotics in aquatic environments promotes the development and propagation of antimicrobial resistance, and fish can be reservoirs of antibiotic resistance genes, which can easily be transmitted to humans through the consumption of raw fish, creating a public health problem.According to a study from Canada, Surveillance activities to detect ESBL-EB in seafood are needed; salmon and shrimp could be used in initial surveillance activities, representing domestic and imported products. Another study found that, on average, one in five seafood products sold at retail globally is contaminated with ESBL-producing Enterobacterales of clinical relevance.",True,2024-02-09T15:23:32,2025-06-20T13:48:16,1.0,33.0,[2308]
199,1,F-2022-355,STEC contamination in pork production chain,"Epidemiological evidence of Shiga toxin-producing Escherichia coli (STEC) infections associated with the consumption of contaminated pork highlight the need for increased awareness of STEC as an emerging pathogen in the pork supply chain. The reported prevalence rate of stx-positive E. coli isolates in live swine, slaughtered swine, and retail pork samples around the world ranged from 4.4 % (22/500) to 68.3 % (82/120), 22 % (309/1395) to 86.3 % (69/80), and 0.10 % (1/1167) to 80 % (32/40), respectively,depending upon the sample categories, detection methods, and the hygiene condition of the slaughterhouses and retail markets. In retail pork, serogroup O26 was prevalent in the U.S., Europe, and Africa. Serogroup O121 was only reported in the U.S. Furthermore, serogroup O91 was reported in the U.S., Asia, and South American retail pork samples. The most common virulence gene combination in retail pork around the globe were as follows: the U.S.: serogroup O157 + stx, non-O157 + stx, unknown serogroups+stx + eae; Europe: unknown serogroups +(stx+ eae, stx2 + eae, or stx1 + stx2 + eae); Asia: O157 + stx1 + stx2 + ehxA, Unknown+stx1 + eaeA + ehxA, or only eae; Africa: O157 + stx2 + eae + ehxA. STEC strains derived from retail pork in the U.S. fall under low to moderate risk categories capable of causing human disease, thus indicating the need for adequate cooking and prevention of cross contamination to minimize infection risk in humans.",False,2022-07-13T00:00:00,2024-07-01T10:36:13,2.0,9.0,[2318]
164,1,F-2021-315,Staphylococcal enterotoxins,"Staphylococci (and their enterotoxins) are the leading cause of food-borne illness (CFTI) with a confirmed or suspected agent in France and are a major cause of food-borne illness worldwide. Staphylococcal CFTIs are due to the ingestion of heat-resistant staphylococcal enterotoxins (SE), preformed in food at the time of preparation. The vast majority of these CFTIs occur in restaurants, school canteens or in the home. Staphylococci and ES are most often detected in food samples and more rarely in the vomit and stools of patients. Very often, only ES are detected in contaminated food; the bacterial strains producing these toxins have been eliminated by the preparation conditions. It is therefore sometimes difficult to link ES to the producing strains. The detection of ES in food is therefore a crucial step in the surveillance of staphylococcal CAI.",False,2021-09-22T00:00:00,2024-05-21T07:09:09,1.0,14.0,[2337]
125,1,F-2021-257,Melatonin for pre- and post-harvest treatment,"Melatonin (N-acetyl-5-methoxytryptamine) is known as a potential free radical. In a study by Li et al. (2021), the prolonged effect of the shelf life of white champignons was investigated. These had a significantly longer shelf life depending on the treatment. Melatonin also delays the leaf senescence of Chinese cabbage (Tan et al. 2020) or the yellowing of broccoli (Wu et al. 2021 or Miao et al. 2020). It is also employed in the ripening of fruit (such as tomatoes; Sun et al. 2020) or to increase the resistance of grapes (Gao et al. 2020). Melatonin is found in plant-based foods and in very small doses also in animal foods. The highest melatonin content is found in cranberries (up to 9,600 µg/100g dry weight). Other sources of melatonin are some types of mushrooms (saffron milk cap, common boletus, agaricus bisporus, chanterelle), some types of cereals (corn, rice, wheat, oat, barley), mustard seeds, dried tomatoes and peppers, and some types of wine (wikipedia).",True,2021-02-25T00:00:00,2025-08-07T07:57:23,1.0,25.0,[2342]
48,1,F-2019-078,Antimicrobial resistance in plant-based foods,"Antibiotics are essential drugs. They are used to treat diseases caused by bacteria. However, antibiotics increasingly lose their efficacy because bacteria are becoming resistant. In recent years, antibiotics have become less effective. In order to ensure their efficacy in the long run and to stem the spread of resistant bacteria, the Federal Council has adopted the comprehensive Strategy on Antibiotic Resistance (StAR), which is now being implemented in various fields. Antibiotic-resistant pathogens can also be found in foods. They can lead to increased resistance in humans. Resistance can be enhanced not only through animal products but also plant-based products. However, we have far less information on plant-based products than on animal food products. Salads are popular foods in a balanced and healthy diet. They are often sold in a ready-tp-eat packging (plastic wrapping). It is known that such fresh products can be contaminated with hygiene-relevant germs. Different research groups have shown that these products contain germs that are resistant to antibiotics.",True,2019-04-16T00:00:00,2025-06-20T07:08:16,1.0,37.0,[2293]
42,1,F-2019-062,Bacillus cereus sensu lato - Bacillus thuringiensis,"In agriculture, bacteria of the genus Bacillus are increasingly used as biocides or plant protection products respectively. B. thuringiensis in particular is used as an insecticide as these bacteria produce Bt toxins. The Bacillus cereus group (Bacillus cereus sensu lato) consists of the B. cereus sensu stricto, B. anthracis, B. thuringiensis, B. weihenstephanensis, B. mycoides, B. pseudomycoides, B. cytotoxicus, and B. toyonensis species. B. cereus and B. thuringiensis genotypically hardly differ. Furthermore, in clinical diagnostics, these species are not differentiated; therefore, it is unclear to what extent B. thuringiensis could have an impact on food-associated intoxications. The greatest difference between the two species is limited to the presence or absence of plasmids. Plasmids often code exotoxins. The mechanisms of horizontal gene transfer would enable a plasmid exchange in the Bacillus cereus sensu lato group. Whether and how this happens has not been closely investigated yet. Thus, whether B. thuringiensis can be detected in food samples has also not been investigated in greater detail. Recently, certain strain of B. thuringiensis was described as being able to produce large amounts of sphingomyelinase; several other strains of B. thuringiensis demonstrated cytotoxicity in vero cell assays. Therefore, these strains have to be potentially considered virulent. The investigated strains were all isolated from biocides. The safety of strains (QPS or GRAS) employed in agriculture is not explicitly demonstrated. In general, precise identification and characterisation of the strains used, in particular of B. thuringiensis and of possible virulence factors, are not available.",True,2019-07-11T00:00:00,2025-06-27T17:39:54,1.0,51.0,[2328]
99,1,F-2021-139,Acinetobacter in foods,"Bacteria of the genus Acinetobacter have become a major problem in hospitals around the world because they often develop resistances to antimicrobial drugs and disinfectants. A new study has now been able to find evidence of the same bacteria in food and food-producing animals. The study collected and analysed a wide variety of chicken, pork and beef meat samples from markets in Lima and Peru. Researchers found 12 Acinetobacter isolates from five different beef samples sold at two unrelated markets. However, it has to be mentioned that the Acinetobacter isolates found in this study had a low prevalence and were not multi-resistant. Raw meat thus appears to be a new potential source of infection for humans or a reservoir for Acinetobacter bacteria respectively.",True,2021-05-12T00:00:00,2024-09-05T16:26:11,1.0,32.0,[2334]
